sentence,verb_lemma,verb_token_idx,on_sense,wn_synsets,vn_class,situation,match_path,source_file,sentence_idx,situation_count,needs_review
"He then hung a rope out a third - floor window and lowered himself to safety, injuring his hands slightly in the process.",hang,2,1,hang.v.01;hang.v.02;hang.v.05;hang.v.10;hang.v.12;hang.v.13;hang.v.14;hang.v.15,put_spatial-9.2,Incremental,WN,../../Linguistic data/ontonotes-release-5.0/data/files/data/english/annotations/mz/sinorama/10/ectb_1011.sense,16,1,False
"The Chicago company 's beverage carrier, meant to replace cardboard trays at concession stands and fast - food outlets, resembles the plastic loops used on six - packs of beer, only the loops hang from a web of strings.",hang,36,1,hang.v.01;hang.v.02;hang.v.05;hang.v.10;hang.v.12;hang.v.13;hang.v.14;hang.v.15,spray-9.7,Incremental,WN,../../Linguistic data/ontonotes-release-5.0/data/files/data/english/annotations/nw/wsj/01/wsj_0102.sense,16,1,False
Paint sprayed onto the wall.,spray,,,,,Incremental,,"Croft et al 2021, p. 76f.",,,
"Suddenly, it is night, and a tarp - covered, skyscraper - sized structure looms over the poor nation as choppers spray spotlights across it.",spray,23,1,spray.v.01;spray.v.02;spray.v.03,spray-9.7,Incremental,WN,../../Linguistic data/ontonotes-release-5.0/data/files/data/english/annotations/wb/eng/00/eng_0009.sense,289,1,False
"Radiation signs plastered all over the door, nobody should have been surprised at any detecto-noises.",plaster,2,2,plaster.v.03,spray-9.7,Incremental,WN,../../Linguistic data/ontonotes-release-5.0/data/files/data/english/annotations/wb/sel/78/sel_7813.sense,0,1,False
"If you can only get L-section, you can do this with a center plate and weld or rivet each side to it.",rivet,18,2,rivet.v.02,tape-22.4,Incremental,VN,../../Linguistic data/ontonotes-release-5.0/data/files/data/english/annotations/wb/sel/91/sel_9156.sense,0,1,False
"Also on the way, equipment to lift the ""Cole"" out of the water and specialists to help retrieve the bodies of those trapped and presumed dead.",trap,25,2,trap.v.02;trap.v.03;trap.v.04,pocket-9.10,Incremental,VN,../../Linguistic data/ontonotes-release-5.0/data/files/data/english/annotations/bn/nbc/00/nbc_0010.sense,7,1,False
"Close the lid and seal it up, and let it sit for about 5 minutes.",seal,4,1,seal.v.02;seal.v.01,tape-22.4,Incremental,VN,../../Linguistic data/ontonotes-release-5.0/data/files/data/english/annotations/wb/sel/29/sel_2965.sense,0,1,False
"Currently, the Ministry of Agriculture and Forestry and the local government of Chungcheongnam - Do had already sealed off and had restricted access to the four major roads surrounding the avian flu - infected duck farm.",seal,18,5,seal.v.02,tape-22.4,Incremental,WN,../../Linguistic data/ontonotes-release-5.0/data/files/data/english/annotations/nw/p2.5_c2e/00/p2.5_c2e_0085.sense,5,1,False
"Sources tell ABC News that a suspect who has been in custody for several weeks told Yemeni investigators that his group failed in their attack because their small boat, overloaded with explosives, sank just off the beach.",overload,30,1,overload.v.01;overload.v.02;overload.v.03,spray-9.7,Incremental,WN,../../Linguistic data/ontonotes-release-5.0/data/files/data/english/annotations/bn/abc/00/abc_0030.sense,5,1,False
"I used to herd sheep with my aunts, and they showed me how to work in clay. & quot;",herd,3,1,herd.v.01;herd.v.02;herd.v.03,herd-47.5.2,Incremental,VN,../../Linguistic data/ontonotes-release-5.0/data/files/data/english/annotations/wb/sel/60/sel_6092.sense,0,1,False
"add the flowers, and well, to my mind, that 's poetry.",add,0,1,add.v.01;add.v.02;add.v.03;add.v.06,mix-22.1,Incremental,WN,../../Linguistic data/ontonotes-release-5.0/data/files/data/english/annotations/wb/eng/00/eng_0017.sense,126,1,False
"""Personal Computer"" yearbooks are lined up on nearly every desk, and dog - eared copies of Nikkei Computer crowd magazine racks.",crowd,21,1,crowd.v.02;crowd.v.03,spray-9.7,Incremental,WN,../../Linguistic data/ontonotes-release-5.0/data/files/data/english/annotations/nw/wsj/04/wsj_0445.sense,22,1,False
"Mr. Fischer plows his own fields, sows his own corn and sunflowers, and feeds his own sheep.",sow,7,1,sow.v.01;sow.v.03,spray-9.7,Incremental,WN,../../Linguistic data/ontonotes-release-5.0/data/files/data/english/annotations/nw/wsj/17/wsj_1760.sense,25,1,False
""" Nobody seems to care about our Pali, and we are very remote, so people just dump what they do n't want out here.",dump,18,2,dump.v.01;dump.v.03,funnel-9.3,Incremental,WN,../../Linguistic data/ontonotes-release-5.0/data/files/data/english/annotations/mz/sinorama/10/ectb_1050.sense,63,1,False
Glue the sign to the window.,glue,,,,,Incremental,,ontonotes,,,
"Still bleeding, he ran downstairs and scooped up the baby and took the baby to the hospital.",scoop,7,1,scoop.v.01,funnel-9.3,Incremental,VN,../../Linguistic data/ontonotes-release-5.0/data/files/data/english/annotations/bn/cnn/02/cnn_0242.sense,22,1,False
Linda taped the picture to the wall.,tape,,,,,Incremental,,"Croft et al 2021, p. 76f.",,,
Leslie covered the bed with blankets.,cover,,,,,Incremental,,"Croft et al 2021, p. 76f.",,,
The prepaid plans take payment today -- usually at current tuitions or at a slight discount -- for a promise that tuition will be covered tomorrow.,cover,24,cover-v 2,cover.v.03;cover.v.04;cover.v.05;cover.v.06;cover.v.07;cover.v.08;cover.v.14;cover.v.18,NM,Concealment,pos_fill,nw/wsj/15/wsj_1569.sense,57,,False
It pretty much covers hurricane related stuff.,cover,3,cover-v 2,cover.v.03;cover.v.04;cover.v.05;cover.v.06;cover.v.07;cover.v.08;cover.v.14;cover.v.18,NM,Concealment,pos_fill,wb/sel/04/sel_0491.sense,0,,False
"Correspondent Xu Xiaobing, covering frontline news at the time, snapped the shutter while artillery fire roared overhead.",cover,4,cover-v 2,cover.v.03;cover.v.04;cover.v.05;cover.v.06;cover.v.07;cover.v.08;cover.v.14;cover.v.18,NM,Concealment,pos_fill,bc/cctv/00/cctv_0001.sense,194,,False
"The offering is rated doubleA - 2 by Moody 's and double - A by S&P, based on the quality of the underlying auto loans and a guarantee covering 9 % of the deal from Ford Motor Credit.",cover,29,cover-v 2,cover.v.03;cover.v.04;cover.v.05;cover.v.06;cover.v.07;cover.v.08;cover.v.14;cover.v.18,NM,Concealment,pos_fill,nw/wsj/13/wsj_1312.sense,41,,False
Doug cleaned the dishes from the table.,clean,,,,,Incremental,,"Croft et al 2021, p. 76f.",,,
I funneled the mixture into the bottle.,funnel,,,,,Incremental,,"Croft et al 2021, p. 76f.",,,
"At these words, the samurai, perceiving the discipline of the master, sheathed his sword and bowed.",sheathe,14,1,sheathe.v.01;sheathe.v.02,pocket-9.10,Incremental,VN,../../Linguistic data/ontonotes-release-5.0/data/files/data/english/annotations/wb/sel/96/sel_9624.sense,0,1,False
"Buoyed by the continued inflows into money funds, assets of all mutual funds swelled to a record $ 953.8 billion in September, up fractionally from $ 949.3 billion in August.",swell,14,swell-v 1,swell.v.01;swell.v.03;swell.v.06,calibratable_cos-45.6-1;entity_specific_cos-45.5,Incremental,pos_fill,nw/wsj/04/wsj_0422.sense,31,,False
"His mother and father did not get on well together, and after constant arguments they finally divorced.",divorce,17,divorce-v 2,divorce.v.02,marry-36.2;separate-23.1-1,Incremental,pos_fill,mz/sinorama/10/ectb_1067.sense,27,,False
"Ironically, Caltrans this year began working on a second round of seismic reinforcements of freeways around the state, this time wrapping freeway columns in ""steel blankets"" to reinforce them.",wrap,22,wrap-v 1,wrap.v.01;wrap.v.03;wrap.v.01;wrap.v.04,spray-9.7-1,Incremental,pos_fill,nw/wsj/19/wsj_1916.sense,31,,False
"This has raised the hackles of Lung Ying - tai, the director of the Taipei Bureau of Culture: "" The new government can not try to lock up the nation.",lock,28,lock-v 2,lock.v.07;lock.v.01;lock.v.02;lock.v.01;lock.v.02,,Incremental,pos_fill,mz/sinorama/10/ectb_1036.sense,132,,False
"In addition, he says, the buy - out business is under pressure ""because of the junk bond collapse,"" meaning that returns are likely to decline as the volume of junk - bond financings shrinks.",shrink,38,shrink-v 1,shrink.v.01;shrink.v.03;shrink.v.04,,Incremental,pos_fill,nw/wsj/01/wsj_0128.sense,17,,False
Efficient land distribution through society colleting rental values sweeps those struggles and inefficiencies aside.,sweep,8,sweep-v 2,sweep.v.03;sweep.v.06;sweep.v.01,funnel-9.3-2-1;wipe_manner-10.4.1-1,Incremental,pos_fill,wb/sel/33/sel_3338.sense,0,,False
The Red Sox used to segregate the bleachers in this fashion -- you could n't get from the bleachers to the rest of the stands.,segregate,5,2,segregate.v.02;segregate.v.03,disassemble-23.3,Incremental,VN,../../Linguistic data/ontonotes-release-5.0/data/files/data/english/annotations/wb/sel/94/sel_9463.sense,0,1,False
Paint splattered on the tarp beneath the ladder.,splatter,1,,,,Incremental,synthetic,,,,False
"First Ang Lee 's Crouching Tiger, Hidden Dragon won Golden Globes for best director and best foreign - language film as well as 10 Oscar nominations, and then Lin Cheng - sheng won the Silver Bear at the Berlin Film Festival for Betelnut Beauty.",hide,7,1,hide.v.01;hide.v.02;hide.v.03;hide.v.04,concealment-16,Concealment,WN,../../Linguistic data/ontonotes-release-5.0/data/files/data/english/annotations/mz/sinorama/10/ectb_1077.sense,3,1,False
Top executives at the company accused of cooking the books to hide billions of dollars in debt.,hide,11,hide-v 1,hide.v.01;hide.v.02;hide.v.03;hide.v.04;hide.v.01,concealment-16-1,Concealment,pos_fill,bn/cnn/03/cnn_0396.sense,6,,False
So far U.S. soldiers have discovered nearly $ 600 million hidden around Baghdad.,hide,10,1,hide.v.01;hide.v.02;hide.v.03;hide.v.04,concealment-16,Concealment,WN,../../Linguistic data/ontonotes-release-5.0/data/files/data/english/annotations/bn/cnn/03/cnn_0306.sense,5,1,False
He tells CNN he was told to keep the parts hidden so they would be ready when the time came to rebuild Iraq 's program.,hide,10,1,hide.v.01;hide.v.02;hide.v.03;hide.v.04,concealment-16,Concealment,WN,../../Linguistic data/ontonotes-release-5.0/data/files/data/english/annotations/bn/cnn/02/cnn_0244.sense,6,1,False
"That is, the treasure is all hidden underground.",hide,7,1,hide.v.01;hide.v.02;hide.v.03;hide.v.04,concealment-16,Concealment,WN,../../Linguistic data/ontonotes-release-5.0/data/files/data/english/annotations/bc/cctv/00/cctv_0003.sense,279,1,False
"Yesterday, protesters blocked the entrance to protest what they claim is the company 's inaction against global warming.",block,3,block-v 1,block.v.01;block.v.04;block.v.06;block.v.07;block.v.09;block.v.10;block.v.12;block.v.01;block.v.02;block.v.03;block.v.02;block.v.03;block.v.01,concealment-16;fill-9.8,Concealment,pos_fill,bn/cnn/03/cnn_0366.sense,6,,False
It is unreasonable to block roads and cut off traffic even if the villagers ' homes were being damaged by the blasting for road construction and the economy was being hurt; these methods are illegal and harm innocent bystanders; they are unacceptable.,block,4,block-v 1,block.v.01;block.v.04;block.v.06;block.v.07;block.v.09;block.v.10;block.v.12;block.v.01;block.v.02;block.v.03;block.v.02;block.v.03;block.v.01,concealment-16;fill-9.8,Concealment,pos_fill,wb/c2e/00/c2e_0015.sense,7,,False
"The protesters lie down in the street, blocking traffic, and will not move until the authorities carry them away.",block,8,block-v 1,block.v.01;block.v.04;block.v.06;block.v.07;block.v.09;block.v.10;block.v.12;block.v.01;block.v.02;block.v.03;block.v.02;block.v.03;block.v.01,concealment-16;fill-9.8,Concealment,pos_fill,nw/wsj/02/wsj_0290.sense,30,,False
"Taking this case as an example, the common folk blocked the road because the local government did not resolve the problem.",block,10,block-v 1,block.v.01;block.v.04;block.v.06;block.v.07;block.v.09;block.v.10;block.v.12;block.v.01;block.v.02;block.v.03;block.v.02;block.v.03;block.v.01,concealment-16;fill-9.8,Concealment,pos_fill,wb/c2e/00/c2e_0015.sense,25,,False
"When they did, his commanders did n't have the initiative to do more than block a couple of roads.",block,15,block-v 1,block.v.01;block.v.04;block.v.06;block.v.07;block.v.09;block.v.10;block.v.12;block.v.01;block.v.02;block.v.03;block.v.02;block.v.03;block.v.01,concealment-16;fill-9.8,Concealment,pos_fill,nw/wsj/13/wsj_1307.sense,9,,False
"What I saw was their bodies shrouded, then the dog stealing the shroud, then a pair of bodies going into the ground.",shroud,6,shroud-v 2,shroud.v.03,fill-9.8,Concealment,pos_fill,wb/sel/97/sel_9732.sense,0,,False
"He added: & quot; We 'll be able to throw back the curtains that shroud the early Universe, revealing many of its mysteries. & quot;",shroud,16,shroud-v 1,shroud.v.01;shroud.v.02,fill-9.8,Concealment,pos_fill,wb/sel/97/sel_9716.sense,0,,False
"Plain-clothes security forces have been deployed across Yangon to try to quell the protests, leaving the nation 's economic hub shrouded in fear.",shroud,21,shroud-v 1,shroud.v.01;shroud.v.02,fill-9.8,Concealment,pos_fill,wb/sel/97/sel_9718.sense,0,,False
The New York Times did its usual best to shroud the issue.,shroud,9,shroud-v 1,shroud.v.01;shroud.v.02,fill-9.8,Concealment,pos_fill,wb/sel/97/sel_9707.sense,0,,False
He even had proteges who shrouded his work in this area after his death.,shroud,5,shroud-v 1,shroud.v.01;shroud.v.02,fill-9.8,Concealment,pos_fill,wb/sel/97/sel_9715.sense,0,,False
"I would n't get rid of it, but I would figure out a way to shroud it to prevent the noise intrusion into the cab.",shroud,16,shroud-v 1,shroud.v.01;shroud.v.02,fill-9.8,Concealment,pos_fill,wb/sel/97/sel_9704.sense,0,,False
"( that and the possibility that one day there might be Something to See? ) Every time I go to look at the volcano-cam it seems to be either shrouded in fogmistcloudrain, or else in the dark!",shroud,30,shroud-v 1,shroud.v.01;shroud.v.02,fill-9.8,Concealment,pos_fill,wb/sel/97/sel_9713.sense,0,,False
"The murk of war - the natural blur of unbuckled event, and its artificial augmentation by professional massagers - shrouds the details of the actual operation.",shroud,20,shroud-v 1,shroud.v.01;shroud.v.02,fill-9.8,Concealment,pos_fill,wb/sel/97/sel_9730.sense,0,,False
They hollow out the bat and stick the cork in there to mask the hollow sound.,mask,12,mask-v 1,mask.v.01;mask.v.02;mask.v.04,fill-9.8,Concealment,pos_fill,bn/cnn/03/cnn_0383.sense,19,,False
Originally Navy officials said a small boat that assisted in securing the ship 's lines or whose movements were masked by the mooring operation pulled aside the Cole and blew up in an apparent suicide attack.,mask,19,mask-v 2,mask.v.03,,Concealment,pos_fill,bn/voa/00/voa_0041.sense,3,,False
"Mr. Reed admitted he conspired to conceal an agreement not to enforce loan guarantees executed by Dallas real - estate developers A. Starke Taylor III and George S. Watson, both of whom were FirstSouth stockholders.",conceal,6,conceal-v 1,conceal.v.01;conceal.v.02,concealment-16,Concealment,pos_fill,nw/wsj/19/wsj_1983.sense,3,,False
"By concealing the non-enforcement agreement, certain transactions with Messrs. Taylor and Watson were entered on FirstSouth 's books as loans, allowing the thrift to report fees and interest as current income, according to the U.S. attorney 's office in Little Rock, Ark.",conceal,1,conceal-v 1,conceal.v.01;conceal.v.02,concealment-16,Concealment,pos_fill,nw/wsj/19/wsj_1983.sense,5,,False
"But the government now claims that a group of company managers and lawyers engaged in an elaborate strategy over five years to obscure from federal authorities the extent and details of ""widespread"" fraudulent billing practices.",obscure,22,obscure-v 2,obscure.v.02;obscure.v.03;obscure.v.05,other_cos-45.4,Concealment,pos_fill,nw/wsj/11/wsj_1184.sense,6,,False
"They insist that CFCs are damaging the earth 's stratospheric ozone layer, which screens out some of the sun 's ultraviolet rays.",screen,14,3,screen.v.05;screen.v.07,concealment-16,Concealment,VN,../../Linguistic data/ontonotes-release-5.0/data/files/data/english/annotations/nw/wsj/12/wsj_1269.sense,13,1,False
Scam artists seek out such people -- or try to make sure that their victims isolate themselves.,isolate,15,isolate-v 1,isolate.v.01;isolate.v.03,concealment-16,Concealment,pos_fill,nw/wsj/15/wsj_1572.sense,52,,False
"Walt Disney Co. 's Disneyland in Anaheim, Calif., stocks rescue equipment, medical supplies, and enough food and water to feed at least 10,000 visitors for as long as five days in the event that a calamity isolates the theme park.",isolate,40,isolate-v 1,isolate.v.01;isolate.v.03,concealment-16,Concealment,pos_fill,nw/wsj/16/wsj_1691.sense,37,,False
David - who gets really annoyed when the volts drop so low his microwave can hardly boil water Esther & Fester Bestertester wrote: I 've got a 240 v. electric water heater and a need for a 208 v ( single - phase ) one.,boil,16,1,boil.v.01;boil.v.03,cooking-45.3,Cause Change of State,VN,../../Linguistic data/ontonotes-release-5.0/data/files/data/english/annotations/wb/sel/35/sel_3559.sense,0,1,False
"They say the plane took off, clicking the construction equipment, slamming into the ground and then breaking up.",break,18,16.1,,break-45.1,Change of State,VN,../../Linguistic data/ontonotes-release-5.0/data/files/data/english/annotations/bn/mnb/00/mnb_0009.sense,11,1,False
"The caster improves the metallurgical quality of the iron mill rolls, which are basically huge rolling pins used to flatten or shape steel products.",shape,22,1,shape.v.02;shape.v.03,build-26.1,Cause Creation,WN,../../Linguistic data/ontonotes-release-5.0/data/files/data/english/annotations/nw/wsj/07/wsj_0782.sense,13,1,False
"So you cut your leg on the window frame at six o'clock, correct?",cut,,,,,Hurt,,framenet,,,
"City dwellers love them because they shift smoothly in traffic, bounce easily over curbs and roll through road glass with far fewer flat tires than racing bikes.",bounce,11,1,bounce.v.01;bounce.v.02;bounce.v.03,slide-11.2,Motion,WN,../../Linguistic data/ontonotes-release-5.0/data/files/data/english/annotations/nw/wsj/20/wsj_2034.sense,49,1,False
"By late this afternoon, as movers transported the belongings to the home in Chappaqua, he had no longer the power to grant pardons, and at a rally in New York, it was the state 's new senator who got the spotlight.",transport,7,1,transport.v.01;transport.v.02;transport.v.04;transport.v.05,send-11.1,Sending,VN,../../Linguistic data/ontonotes-release-5.0/data/files/data/english/annotations/bn/abc/00/abc_0064.sense,20,1,False
"suffice to say that all the local Rotarians and VFW heroes so desperate as to have voluntarily rocketed down to their local strip mall before dawn backed away from me hard, then stared at me like i had suddenly dropped my pants and started, er, ' amusing myself ' in a public place.",drop,40,1,drop.v.01;drop.v.02;drop.v.09;drop.v.15,put_direction-9.4,Pick_Up_and_Drop_Off,VN,../../Linguistic data/ontonotes-release-5.0/data/files/data/english/annotations/wb/eng/00/eng_0017.sense,5,3,True
Mirabella shared the mischievous vision of childlike exuberance and used the chair as a pseudo jungle gym.,use,,,,,Manipulation,,framenet (Using),,,
Cops say he allegedly kidnapped her in his car and threatened her but eventually brought her back to her home.,bring,14,1,bring.v.01;bring.v.02;bring.v.03;bring.v.04;bring.v.05;bring.v.06;bring.v.10,bring-11.3,Carrying,WN,../../Linguistic data/ontonotes-release-5.0/data/files/data/english/annotations/bn/cnn/02/cnn_0242.sense,13,1,False
The park borders a very upscale neighborhood.,border,,,,,Location,,framenet (Adjacency),,,
"One more last note: We do n't know why this happens, but even without the benefit of self-anointing, their spines seem to have a mild toxicirritant effect; when you prick yourself on one, even slightly, it hurts more than it should, and for a little bit longer.",prick,33,1,prick.v.01;prick.v.04,poke-19,Contact,VN,../../Linguistic data/ontonotes-release-5.0/data/files/data/english/annotations/wb/sel/82/sel_8251.sense,0,1,False
"Since I 'm a non-native, I 'm not allowed to paddle the length of this beautiful river without a native & quot; guide & quot;, but they do allow me to launch into the river at Taholah... as long as I 'm heading out to sea.",paddle,11,1,,drive-11.5,Vehicular_Motion,VN,../../Linguistic data/ontonotes-release-5.0/data/files/data/english/annotations/wb/sel/75/sel_7570.sense,0,1,False
Israelis who had been firing rubber bullets stepped up their use of real ones.,fire,4,1,fire.v.01;fire.v.02;fire.v.05,throw-17.1,Throwing,WN,../../Linguistic data/ontonotes-release-5.0/data/files/data/english/annotations/bn/abc/00/abc_0019.sense,14,1,False
"Three members of Solace, including superstar fiddler Winfred Horan are Irish Americans, the remaining two are Irish transplants living in New York City.",remain,15,2,remain.v.03,exist-47.1,Existence,WN,../../Linguistic data/ontonotes-release-5.0/data/files/data/english/annotations/bn/pri/00/pri_0037.sense,6,1,False
Hunger strikers in the prison were force-fed by the guards.,force-feed,,,,,Feeding,,synthetic,,,
"In August last year, as Taiwan was being buffeted by a typhoon, over 20 eggs hatched out into tiny snakes, which the zoo hopes can grow up safe and sound.",hatch,17,1,hatch.v.01,grow-26.2.1,Form,WN,../../Linguistic data/ontonotes-release-5.0/data/files/data/english/annotations/mz/sinorama/10/ectb_1066.sense,74,1,False
"Pushing small luggage carts, they lead customers to the buses.",lead,6,5,lead.v.01,accompany-51.7,Pursuit,VN,../../Linguistic data/ontonotes-release-5.0/data/files/data/english/annotations/mz/sinorama/10/ectb_1009.sense,136,1,False
"Still bleeding, he ran downstairs and scooped up the baby, and took the baby to the hospital.",bleed,1,1,bleed.v.01,substance_emission-43.4,Emission,VN,../../Linguistic data/ontonotes-release-5.0/data/files/data/english/annotations/bn/cnn/02/cnn_0241.sense,21,1,False
"In most cases, this means you 're actually eating the fruit of the plants, rather than getting down on your hands and knees to graze on the green stuff.",graze,26,1,graze.v.01;graze.v.03;graze.v.05,dine-39.5,Ingestion,VN,../../Linguistic data/ontonotes-release-5.0/data/files/data/english/annotations/wb/sel/58/sel_5812.sense,0,1,False
The knife cut the envelope open.,cut,,,,,Cause Change of State,,verbnet,,,
"London, sunny changing to cloudy, 1 degree below zero to 8 degrees.",change,3,1,change.v.02;change.v.01;change.v.03;change.v.09,turn-26.6.1,Change of State,WN,../../Linguistic data/ontonotes-release-5.0/data/files/data/english/annotations/bc/cctv/00/cctv_0002.sense,507,1,False
"Texas Instruments Japan Ltd., a unit of Texas Instruments Inc., said it opened a plant in South Korea to manufacture control devices.",manufacture,21,1,manufacture.v.01;manufacture.v.04,create-26.4,Cause Creation,VN,../../Linguistic data/ontonotes-release-5.0/data/files/data/english/annotations/nw/wsj/00/wsj_0017.sense,0,1,False
She strolled through the garden after dinner.,stroll,1,,,,Motion,synthetic,,,,False
TransCanada transports all gas that moves eastward from Alberta.,transport,1,1,transport.v.01;transport.v.02;transport.v.04;transport.v.05,send-11.1,Sending,VN,../../Linguistic data/ontonotes-release-5.0/data/files/data/english/annotations/nw/wsj/05/wsj_0529.sense,4,1,False
"At the level of the other factions, supporters of six factions demonstrated, raising the Palestinian flag only, calling for Fatah and Hamas to abide by the truce agreement, to end the security chaos syndrome, and return to the negotiations table in order to activate the talks to form a national unity government.",raise,14,2,raise.v.02;raise.v.08;raise.v.20;raise.v.24,put_direction-9.4,Pick_Up_and_Drop_Off,WN,../../Linguistic data/ontonotes-release-5.0/data/files/data/english/annotations/bn/p2.5_a2e/00/p2.5_a2e_0037.sense,9,3,True
"It has been used successfully in physician offices, schools, and in sensory function laboratories for over 35 years.",use,,,,,Manipulation,,framenet (Using),,,
Karl carried the books across the campus.,carry,,,,,Carrying,,framenet,,,
China adjoins the South Asian region.,adjoin,,,,,Location,,ontonotes,,,
It is like a beast which touches a corpse or overshadows it.,touch,6,1,touch.v.01;touch.v.02;touch.v.08;touch.v.11;touch.v.13;touch.v.14,touch-20,Contact,WN,../../Linguistic data/ontonotes-release-5.0/data/files/data/english/annotations/wb/sel/34/sel_3417.sense,0,1,False
Thus began an era in which great ships sailed in and out of Pali.,sail,8,1,sail.v.01;sail.v.03;sail.v.04,vehicle_path-51.4.3,Vehicular_Motion,WN,../../Linguistic data/ontonotes-release-5.0/data/files/data/english/annotations/mz/sinorama/10/ectb_1050.sense,23,1,False
"I think he knows the truth but because of doctrinal positions or financial gains or certain political inclinations you find him closing his mind, throwing these facts behind his back, and enjoying the attempt to promote and polish falsehood.",throw,25,1,throw.v.01;throw.v.02;throw.v.04;throw.v.05;throw.v.08;throw.v.10;throw.v.13;throw.v.14,throw-17.1,Throwing,WN,../../Linguistic data/ontonotes-release-5.0/data/files/data/english/annotations/wb/a2e/00/a2e_0031.sense,50,1,False
The knife cut the envelope into pieces.,cut,,,,,Cause Change of State,,verbnet,,,
"Rather, it is born of frustration with having to combat constantly changing strains of a statist idea that one thought had been eliminated in the early 1970s, along with smallpox.",change,12,1,change.v.02;change.v.01;change.v.03;change.v.09,other_cos-45.4,Change of State,VN,../../Linguistic data/ontonotes-release-5.0/data/files/data/english/annotations/nw/wsj/24/wsj_2407.sense,2,1,False
