sentence,verb_lemma,verb_token_idx,on_sense,wn_synsets,vn_class,situation,match_path,source_file,sentence_idx,situation_count,needs_review
"Mr. Stoltzman tied the composer in by proclaiming him ""the great improviser of the 18th century,"" and then built on the image by joining with Mr. Douglas in some Bach two - part inventions, cleverly arranged for clarinet and bassoon by Mr. Douglas.",arrange,39,3,arrange.v.06,build-26.1,Cause Creation,WN,../../Linguistic data/ontonotes-release-5.0/data/files/data/english/annotations/nw/wsj/02/wsj_0207.sense,17,1,False
"These days at almost every street corner in central Belgrade, there is a stall selling compact discs with protest songs against the former regime, and the most popular tune blaring out of the speakers goes like this, ""attention, attention, last train for Serbia via day stop Kosovo and The Hague is departing with a ten hour delay.",depart,57,1,depart.v.01;depart.v.03;depart.v.04;depart.v.05,escape-51.1,Motion,VN,../../Linguistic data/ontonotes-release-5.0/data/files/data/english/annotations/bn/pri/00/pri_0039.sense,5,1,False
This prince after only one month sent a poem of longing to his family.,send,6,1,send.v.02;send.v.03;send.v.04;send.v.06;send.v.08,send-11.1,Sending,WN,../../Linguistic data/ontonotes-release-5.0/data/files/data/english/annotations/wb/p2.5_a2e/00/p2.5_a2e_0008.sense,11,1,False
We had heard a few months ago about some theories on how the submarine could be raised.,raise,16,2,raise.v.02;raise.v.08;raise.v.20;raise.v.24,put_direction-9.4,Pick_Up_and_Drop_Off,WN,../../Linguistic data/ontonotes-release-5.0/data/files/data/english/annotations/bn/pri/01/pri_0106.sense,21,3,True
"Also such location devices, some ships have smoke floats they can toss out so the man overboard will be able to use smoke signals as a way of trying to find or locate, let the rescuer locate them.",use,22,1,use.v.01;use.v.04;use.v.05,use-105.1,Manipulation,WN,../../Linguistic data/ontonotes-release-5.0/data/files/data/english/annotations/bn/cnn/03/cnn_0360.sense,16,1,False
"When they take their sons out for some exercise, they do n't even have the strength to do a single pull - up!",take,2,4,take.v.03;take.v.07;take.v.27;take.v.30,bring-11.3,Carrying,VN,../../Linguistic data/ontonotes-release-5.0/data/files/data/english/annotations/mz/sinorama/10/ectb_1068.sense,58,1,False
Post-Soviet Russia adjoins a number of independent states.,adjoin,,,,,Location,,ontonotes,,,
It 'll kill most any green thing it touches.,touch,8,1,touch.v.01;touch.v.02;touch.v.08;touch.v.11;touch.v.13;touch.v.14,touch-20,Contact,WN,../../Linguistic data/ontonotes-release-5.0/data/files/data/english/annotations/wb/sel/34/sel_3424.sense,0,1,False
"Many larger egg producers are also egg processors, who crack, inspect, and sanitize billions of eggs, turning them into powdered, liquified or frozen egg products.",crack,10,1,crack.v.01;crack.v.06;crack.v.07;crack.v.11,break-45.1,Cause Change of State,VN,../../Linguistic data/ontonotes-release-5.0/data/files/data/english/annotations/nw/wsj/18/wsj_1830.sense,11,1,False
Some of the ones we 've bought have been very solid but the most recent one flexes very badly.,flex,16,2,flex.v.03,bend-45.2,Change of State,VN,../../Linguistic data/ontonotes-release-5.0/data/files/data/english/annotations/wb/sel/51/sel_5170.sense,0,1,False
"Moreover, this corporation is also planning to construct an ethylene factory with natural gas as its raw material through co-operating with foreign companies, and will annually produce 300,000 tons of ethylene.",construct,8,1,construct.v.01;construct.v.02;construct.v.04;construct.v.05,create-26.4,Cause Creation,VN,../../Linguistic data/ontonotes-release-5.0/data/files/data/english/annotations/nw/xinhua/01/chtb_0118.sense,16,1,False
"One 60 - second TV spot features a diverse group of skiers gracefully gliding down sun - drenched slopes: senior citizens, minorities, families with children -- even a blind skier.",glide,13,1,glide.v.01;glide.v.03,run-51.3.2,Motion,WN,../../Linguistic data/ontonotes-release-5.0/data/files/data/english/annotations/nw/wsj/16/wsj_1617.sense,12,1,False
"In the harbor area a railway of 14 kilometers has been built, and the Nanning - Fangchenggang railway can reach the dock directly.",reach,20,1,reach.v.01;reach.v.02;reach.v.05;reach.v.06;reach.v.07,reach-51.8,Motion,WN,../../Linguistic data/ontonotes-release-5.0/data/files/data/english/annotations/nw/xinhua/01/chtb_0120.sense,8,1,False
A Moscow summit on Yugoslavia may be some way off as President Putin has arrived in India for a four - day visit.,arrive,14,1,arrive.v.01;arrive.v.02,escape-51.1,Motion,WN,../../Linguistic data/ontonotes-release-5.0/data/files/data/english/annotations/bn/pri/00/pri_0003.sense,0,1,False
The only humans who entered there were the aboriginal people who came to hunt and to collect wild fruit and berries.,come,11,1,come.v.01;come.v.02;come.v.11;come.v.16,escape-51.1,Motion,WN,../../Linguistic data/ontonotes-release-5.0/data/files/data/english/annotations/mz/sinorama/10/ectb_1070.sense,40,1,False
She walked to the corner store.,walk,1,,,,Motion,synthetic,,,,False
He reached the summit of the mountain.,reach,,,,,Motion,,"Croft et al 2021, p. 69",,,
Bill rolled the ball down the hill.,roll,,,,,Motion,,"Croft et al 2021, p. 69",,,
They marched for miles that day.,march,1,,,,Motion,synthetic,,,,False
The prisoner escaped from the prison.,escape,,,,,Motion,,"Croft et al 2021, p. 69",,,
He jogged along the river path.,jog,1,,,,Motion,synthetic,,,,False
Typical perfect day in San Diego waiting for these men and women to come home.,come,13,1,come.v.01;come.v.02;come.v.11;come.v.16,escape-51.1,Motion,WN,../../Linguistic data/ontonotes-release-5.0/data/files/data/english/annotations/bn/cnn/03/cnn_0330.sense,2,1,False
Alessio Vinci reports that may not happen until tomorrow because some members of parliament will have to travel to Belgrade from Montenegro.,travel,17,1,travel.v.01;travel.v.02;travel.v.03;travel.v.05;travel.v.06,run-51.3.2,Motion,WN,../../Linguistic data/ontonotes-release-5.0/data/files/data/english/annotations/bn/cnn/00/cnn_0010.sense,22,1,False
"Yet, while these tourists bring a human touch to the streets on weekends and holidays, on ordinary weekdays the silence is accompanied only by leftover garbage, empty shops, and those Huwei people who refuse to leave their old homes.",leave,39,1,leave.v.01;leave.v.05;leave.v.08,escape-51.1,Motion,WN,../../Linguistic data/ontonotes-release-5.0/data/files/data/english/annotations/mz/sinorama/10/ectb_1049.sense,20,1,False
He cut into traffic on the highway.,cut,,,,,Motion,,ontonotes,,,
They wandered through the old market.,wander,1,,,,Motion,synthetic,,,,False
"If you ask them questions about it, yes, they will tell you the United States has done a very good job, but it 's time to leave and what we are hearing now that a returning exiled group called the Supreme Council for Islamic Revolution in Iraq is sending a delegation here from Iran where they 've been in exile for several decades, sending a delegation here tomorrow.",leave,29,1,leave.v.01;leave.v.05;leave.v.08,escape-51.1,Motion,WN,../../Linguistic data/ontonotes-release-5.0/data/files/data/english/annotations/bn/cnn/03/cnn_0304.sense,16,1,False
"""It takes three months to turn copper concentrate into cathodes,"" he said.",take,2,3,take.v.02;take.v.14,cost-54.2,Measurement,VN,../../Linguistic data/ontonotes-release-5.0/data/files/data/english/annotations/nw/wsj/12/wsj_1203.sense,30,1,False
"The past six years have seen the greatest degree of military escalation and political aggravation in all the crises in the Middle East, and neither escalation nor aggravation has helped achieve the specific agendas of any side that has worked to provoke or inflame these crises.",provoke,42,1,provoke.v.01;provoke.v.02;provoke.v.03,engender-27.1,Cause and Effect,WN,../../Linguistic data/ontonotes-release-5.0/data/files/data/english/annotations/wb/p2.5_a2e/00/p2.5_a2e_0048.sense,1,1,False
Egypt has recalled its ambassador from Israel to protest the rocket attacks on Gaza.,recall,2,3,recall.v.04,banish-10.2,Cause Membership,WN,../../Linguistic data/ontonotes-release-5.0/data/files/data/english/annotations/bn/abc/00/abc_0036.sense,3,1,False
"Yet Section 605 of the appropriations bill for the executive office provides: ""No part of any appropriation for the current fiscal year contained in this or any other Act shall be paid to any person for the filling of any position for which he or she has been nominated after the Senate has voted not to approve the nomination of said person.""",nominate,50,1,nominate.v.01;nominate.v.02;nominate.v.03;nominate.v.04,appoint-29.1,Cause Participation,VN,../../Linguistic data/ontonotes-release-5.0/data/files/data/english/annotations/nw/wsj/01/wsj_0112.sense,18,1,False
"Large cross-border deals numbered 51 and totaled $ 17.1 billion in the second quarter, the firm added.",total,6,1,total.v.01;total.v.02,register-54.1,Measurement,WN,../../Linguistic data/ontonotes-release-5.0/data/files/data/english/annotations/nw/wsj/04/wsj_0401.sense,7,1,False
"Tele - Communications controls close to 12 million cable subscribers, and Viacom has about one million.",control,3,1,control.v.01;control.v.02;control.v.03;control.v.04;control.v.08,enforce-63,Enforcement,WN,../../Linguistic data/ontonotes-release-5.0/data/files/data/english/annotations/nw/wsj/11/wsj_1190.sense,16,1,False
"As discussed in the context of controlling federal spending, the line - item veto is characterized as a way for the president to excise perfectly constitutional provisions in a spending bill that are objectionable merely because they conflict with his policy objectives.",control,6,1,control.v.01;control.v.02;control.v.03;control.v.04;control.v.08,enforce-63,Enforcement,WN,../../Linguistic data/ontonotes-release-5.0/data/files/data/english/annotations/nw/wsj/01/wsj_0112.sense,42,1,False
She says there is an acknowledgment from those officials that there are not enough ground troops in place and particularly in Baghdad to control what our Nic Robertson is saying is a stage of anarchy in some parts of Iraq.,control,23,1,control.v.01;control.v.02;control.v.03;control.v.04;control.v.08,enforce-63,Enforcement,WN,../../Linguistic data/ontonotes-release-5.0/data/files/data/english/annotations/bn/cnn/02/cnn_0281.sense,8,1,False
Those other branches of government are functioning to protect us from abuses by the executive branch /.,protect,8,1,protect.v.01,defend-72.3,Protection,WN,../../Linguistic data/ontonotes-release-5.0/data/files/data/english/annotations/bc/msnbc/00/msnbc_0006.sense,791,2,True
"To assure the livelihood of the local Atayal aborigines of Chilan, when the cypress national park is set up consideration will have to be given to how to balance the need to protect the forests with the demand for sustainable tourism.",protect,33,1,protect.v.01,defend-72.3,Protection,WN,../../Linguistic data/ontonotes-release-5.0/data/files/data/english/annotations/mz/sinorama/10/ectb_1070.sense,106,2,True
"when the guy ( the owner, it turned out ) arrived to open the gas station, he took one look at our cow pie with wheels and said ""what the fook?""",say,29,1,say.v.01;say.v.02;say.v.09;say.v.08;say.v.05;say.v.10,say-37.7,Statement,WN,../../Linguistic data/ontonotes-release-5.0/data/files/data/english/annotations/wb/eng/00/eng_0017.sense,179,1,False
"He was speaking in front of invitees to his office at 10 Downing Street in London and said, "" The immigrant 's right to live within a multicultural society is always balanced by his duty to integrate, to be part of Britain, to be Asian British, black British, or white British. """,say,17,1,say.v.01;say.v.02;say.v.09;say.v.08;say.v.05;say.v.10,say-37.7,Statement,WN,../../Linguistic data/ontonotes-release-5.0/data/files/data/english/annotations/nw/p2.5_a2e/00/p2.5_a2e_0034.sense,1,1,False
Are you suggesting corporate America has not learned its lesson yet?,learn,7,1,learn.v.01;learn.v.03;learn.v.04,learn-14,Learning,WN,../../Linguistic data/ontonotes-release-5.0/data/files/data/english/annotations/bn/cnn/03/cnn_0349.sense,4,1,False
I don't know how actors manage to learn all those lines.,learn,,,,,Learning,,ontonotes,,,
""" No, not necessarily, "" answers 51 - year - old Hsiang Chi - tai, a manager at a newspaper, shaking her head.",answer,7,1,answer.v.01;answer.v.03;answer.v.04,reciprocate-112,Response,WN,../../Linguistic data/ontonotes-release-5.0/data/files/data/english/annotations/mz/sinorama/10/ectb_1068.sense,121,1,False
"Hence, the Committee of Foreign Economy and Trade of Tianjin has asked every department concerned to insist on dealing with enterprise disputes by law, and improving the quality of service.",ask,12,2,ask.v.02;ask.v.04,urge-58.1,Request,VN,../../Linguistic data/ontonotes-release-5.0/data/files/data/english/annotations/nw/xinhua/01/chtb_0127.sense,6,1,False
This time Nityananda Prabhu brought him in the house and began to inquire after the welfare of his family at Fateyabad.,inquire,12,1,inquire.v.01;inquire.v.02,inquire-37.1.2,Communicate,VN,../../Linguistic data/ontonotes-release-5.0/data/files/data/english/annotations/wb/sel/64/sel_6473.sense,0,1,False
I purchased the calculator for easier calculation of my debts.,purchase,,,,,Buying,,framenet,,,
"The citizen would be forced to own a weapon to protect himself, at the time when the security agencies failed to protect him...",own,6,1,own.v.01,own-100.1,Possession,WN,../../Linguistic data/ontonotes-release-5.0/data/files/data/english/annotations/wb/a2e/00/a2e_0005.sense,44,1,False
Pat discovered a great little restaurant in Soho.,discover,,,,,Discovery,,framenet (Becoming_aware),,,
It ruled that recounts submitted to state officials after a filing deadline had passed had to be counted.,count,17,1,count.v.01;count.v.04,multiply-108,Counting,WN,../../Linguistic data/ontonotes-release-5.0/data/files/data/english/annotations/bn/cnn/01/cnn_0113.sense,21,1,False
"Meanwhile, in the Middle East, former Israeli Prime Minister Shimon Peres met with Palestinian leader Yasser Arafat with whom he once shared the Nobel Peace Prize.",meet,13,2,meet.v.02;meet.v.08;meet.v.09,meet-36.3,Reciprocal,WN,../../Linguistic data/ontonotes-release-5.0/data/files/data/english/annotations/bn/voa/00/voa_0081.sense,6,1,False
Well not only is that false and President Clinton has said so but everybody at the meeting who attended the meeting not including Louis Freeh says it 's false /.,attend,18,1,attend.v.01,attend-107.4,Membership,WN,../../Linguistic data/ontonotes-release-5.0/data/files/data/english/annotations/bc/cnn/00/cnn_0008.sense,266,1,False
It was this spineless father who caused Ko 's childhood to be spent in constant house moving.,cause,6,1,cause.v.01;cause.v.02,engender-27.1,Cause and Effect,WN,../../Linguistic data/ontonotes-release-5.0/data/files/data/english/annotations/mz/sinorama/10/ectb_1067.sense,31,1,False
"However, the large amount of worker layoffs that will accompany this will cause unemployment pressure to gradually increase.",cause,13,1,cause.v.01;cause.v.02,engender-27.1,Cause and Effect,WN,../../Linguistic data/ontonotes-release-5.0/data/files/data/english/annotations/nw/xinhua/01/chtb_0112.sense,18,1,False
"But July 5, a thunderstorm in Wilmington, Del., caused Shellpot Creek to rise 15 feet, pouring 1.3 million gallons of water into basement vaults.",cause,11,1,cause.v.01;cause.v.02,engender-27.1,Cause and Effect,WN,../../Linguistic data/ontonotes-release-5.0/data/files/data/english/annotations/nw/wsj/09/wsj_0971.sense,1,1,False
"He then ousted President Nicholas Ardito Barletta, a former World Bank official with close ties to the U.S., after Mr. Barletta tried to create a commission to investigate the murder.",oust,2,1,oust.v.01,remove-10.1,Cause Membership,WN,../../Linguistic data/ontonotes-release-5.0/data/files/data/english/annotations/nw/wsj/20/wsj_2013.sense,141,1,False
Lien is seen as Lee Teng - hui 's designated successor.,designate,9,1,designate.v.01;designate.v.03,appoint-29.1,Cause Participation,VN,../../Linguistic data/ontonotes-release-5.0/data/files/data/english/annotations/mz/sinorama/10/ectb_1014.sense,99,1,False
Not since the British hired hordes of Hessians to crush George Washington 's revolutionary army had a military force tracing to America been so utterly mercenary.,hire,4,1,hire.v.01;hire.v.02;hire.v.03,hire-13.5.3,Cause Membership,WN,../../Linguistic data/ontonotes-release-5.0/data/files/data/english/annotations/wb/eng/00/eng_0016.sense,183,3,True
"For instance, in exchange for the assembly agreeing to give up its authority to elect the president, the body was given power of approval over personnel appointments to the Judicial Yuan, Examination Yuan, and Control Yuan.",elect,15,1,elect.v.01,appoint-29.1,Cause Participation,VN,../../Linguistic data/ontonotes-release-5.0/data/files/data/english/annotations/mz/sinorama/10/ectb_1023.sense,25,1,False
