sentence,verb_lemma,verb_token_idx,on_sense,wn_synsets,vn_class,situation,match_path,source_file,sentence_idx,situation_count,needs_review
"It was hardly the time for the media, the seemingly omnipotent military, or the rest of government and the political culture to reflect on how much ""shock and awe"" depended on overwhelming force brought down on the near - defenseless, on how much the concept reeked of racism and colonial pretense - of natives on the scene and in the vicinity ""shocked and awed"" like Zulus pounded and panicked by the Queen 's own latest howitzers.",reek,50,reek-v 1,reek.v.01,NM,Perception_(stim._subj.),pos_fill,wb/eng/00/eng_0016.sense,168,no copular/attributive marker,True
EA 's suckage still reeks even after he left the team.,reek,4,reek-v 2,reek.v.02,smell_emission-43.3,Perception_(stim._subj.),pos_fill,wb/sel/87/sel_8768.sense,0,no copular/attributive marker,True
COLBERT: It reeks in there!,reek,3,reek-v 2,reek.v.02,smell_emission-43.3,Perception_(stim._subj.),pos_fill,wb/sel/87/sel_8782.sense,0,no copular/attributive marker,True
Traders said retail investors seemed to be hugging the sidelines until a measure of volatility is wrung out of the market.,seem,4,seem-v 1,seem.v.01;seem.v.02;seem.v.03;seem.v.04,,Perception_(stim._subj.),pos_fill,nw/wsj/22/wsj_2239.sense,86,no copular/attributive marker,True
"Exports, which played a key role in fueling growth over the last two years, seem to have stalled.",seem,16,seem-v 1,seem.v.01;seem.v.02;seem.v.03;seem.v.04,,Perception_(stim._subj.),pos_fill,nw/wsj/05/wsj_0598.sense,27,,False
But it did provide us with a written statement saying quote like any company we want to make sure our associates customers and local community feel good about us /.,feel,25,feel-v 1,feel.v.01;feel.v.03;feel.v.04;feel.v.05;feel.v.06;feel.v.07;feel.v.12;feel.v.01;feel.v.01;feel.v.01;feel.v.01,marvel-31.3-3;see-30.1-1;stimulus_subject-30.4,Perception_(stim._subj.),pos_fill,bc/cnn/00/cnn_0001.sense,52,,False
"By doing this you are transmitting an aversion, which you might not feel; and aversion between all the Saudis and Hamas and Palestine.",feel,13,feel-v 1,feel.v.01;feel.v.03;feel.v.04;feel.v.05;feel.v.06;feel.v.07;feel.v.12;feel.v.01;feel.v.01;feel.v.01;feel.v.01,marvel-31.3-3;see-30.1-1;stimulus_subject-30.4,Perception_(stim._subj.),pos_fill,wb/a2e/00/a2e_0011.sense,45,no copular/attributive marker,True
The child's forehead felt warm.,feel,3,,,,Perception_(stim._subj.),synthetic,,,,False
we 're not programmed to take pills if we start to feel good /.,feel,11,feel-v 1,feel.v.01;feel.v.03;feel.v.04;feel.v.05;feel.v.06;feel.v.07;feel.v.12;feel.v.01;feel.v.01;feel.v.01;feel.v.01,marvel-31.3-3;see-30.1-1;stimulus_subject-30.4,Perception_(stim._subj.),pos_fill,bc/cnn/00/cnn_0003.sense,242,,False
The decision appears final.,appear,2,,,,Perception_(stim._subj.),synthetic,,,,False
At the start of the conversation President Saddam appeared extremely calm.,appear,8,appear-v 1,appear.v.01;appear.v.04,NM,Perception_(stim._subj.),pos_fill,wb/a2e/00/a2e_0009.sense,7,no copular/attributive marker,True
Perhaps there are more lessons to be learned from Kailuan than from Qinglong.,learn,7,1,learn.v.01;learn.v.03;learn.v.04,learn-14,Learning,WN,../../Linguistic data/ontonotes-release-5.0/data/files/data/english/annotations/bc/phoenix/00/phoenix_0002.sense,126,1,False
"The junk market 's ""yield hogs are learning a real painful lesson,"" he says.",learn,8,1,learn.v.01;learn.v.03;learn.v.04,learn-14,Learning,WN,../../Linguistic data/ontonotes-release-5.0/data/files/data/english/annotations/nw/wsj/13/wsj_1375.sense,32,1,False
"But when something is inevitable, you learn to live with it,"" he said.",learn,7,1,learn.v.01;learn.v.03;learn.v.04,learn-14,Learning,WN,../../Linguistic data/ontonotes-release-5.0/data/files/data/english/annotations/nw/wsj/23/wsj_2363.sense,15,1,False
"If only you had acquired part of the characteristics of Abu Muaz Al - Khaledi... if you do n't know him, learn about him.",learn,23,2,learn.v.02;learn.v.06,learn-14,Learning,WN,../../Linguistic data/ontonotes-release-5.0/data/files/data/english/annotations/wb/a2e/00/a2e_0012.sense,61,1,False
"good for you, but hardly worth writing, or reading.",read,10,1,read.v.01;read.v.11,learn-14,Learning,WN,../../Linguistic data/ontonotes-release-5.0/data/files/data/english/annotations/wb/eng/00/eng_0017.sense,18,1,False
I have read a lot of proverbs that belittle women...,read,2,1,read.v.01;read.v.11,learn-14,Learning,WN,../../Linguistic data/ontonotes-release-5.0/data/files/data/english/annotations/wb/p2.5_a2e/00/p2.5_a2e_0001.sense,9,1,False
Union members are still angry and they are demanding another vote.,demand,8,1,demand.v.01;demand.v.03;demand.v.04;demand.v.05;demand.v.06,order-58.3,Request,WN,../../Linguistic data/ontonotes-release-5.0/data/files/data/english/annotations/bn/cnn/03/cnn_0301.sense,7,1,False
They warn that asset - backed securities are only as good as the assets and credit backing that support them -- and those are hard to evaluate.,warn,1,1,warn.v.01;warn.v.02;warn.v.03;warn.v.04,advise-37.9,Communicate,VN,../../Linguistic data/ontonotes-release-5.0/data/files/data/english/annotations/nw/wsj/16/wsj_1635.sense,13,1,False
The defense reports an attack at the border fence.,report,2,1,report.v.01;report.v.02;report.v.05,characterize-29.2,Statement,WN,../../Linguistic data/ontonotes-release-5.0/data/files/data/english/annotations/bn/cnn/00/cnn_0050.sense,18,1,False
But they um you know embraced me and let me know that the- they were beside me and behind me and that possibly I should just look a little further for some answers instead of jumping all over me and condemning me for my bad behavior /.,jump,35,4,jump.v.03,attack-60.1,Aggression,WN,../../Linguistic data/ontonotes-release-5.0/data/files/data/english/annotations/bc/cnn/00/cnn_0003.sense,390,1,False
"Large, heterogeneous election districts would encourage good government, said Madison, because a representative would be compelled to serve the interests of all his constituents and be servile to none.",compel,18,1,compel.v.01;compel.v.02,compel-59.1,Induction,WN,../../Linguistic data/ontonotes-release-5.0/data/files/data/english/annotations/nw/wsj/11/wsj_1137.sense,39,1,False
I defended them against the warriors.,defend,,,,,Protection,,"Kalm 2022, p. 258f",,,
"Some governments ( the Manchu Qing ) even adopted a policy of "" using the barbarians to control the barbarians, "" stirring up conflict, using the Hui to control the Han and the Han to control the Hui.",control,30,1,control.v.01;control.v.02;control.v.03;control.v.04;control.v.08,enforce-63,Enforcement,WN,../../Linguistic data/ontonotes-release-5.0/data/files/data/english/annotations/wb/c2e/00/c2e_0027.sense,22,1,False
Sue answered Bob immediately.,answer,,,,,Response,,framenet (Communication_response),,,
"President Clinton and Prime Minister Hasina agreed that it is essential for the US and Bangladesh to coordinate positions on major issues, that come before the United Nations and other international bodies.",agree,6,1,agree.v.01;agree.v.07,correspond-36.1,Joint Statement,WN,../../Linguistic data/ontonotes-release-5.0/data/files/data/english/annotations/bn/voa/00/voa_0049.sense,18,1,False
"Since I 'm a non-native, I 'm not allowed to paddle the length of this beautiful river without a native & quot; guide & quot;, but they do allow me to launch into the river at Taholah... as long as I 'm heading out to sea.",paddle,11,1,,drive-11.5,Vehicular_Motion,VN,../../Linguistic data/ontonotes-release-5.0/data/files/data/english/annotations/wb/sel/75/sel_7570.sense,0,1,False
"Today, Brown separately attended the signing of a 20 - year joint investment agreement between a world famous power plant equipment manufacturer -- the US 's Westinghouse Company and the Shanghai Electric Group; and the signing of a joint investment agreement between the US 's General Electric Capital Company and the Shanghai Electricity Company to jointly invest in and establish a combustible engine electric power generation company.",attend,4,1,attend.v.01,attend-107.4,Membership,WN,../../Linguistic data/ontonotes-release-5.0/data/files/data/english/annotations/nw/xinhua/02/chtb_0299.sense,5,1,False
"One more last note: We do n't know why this happens, but even without the benefit of self-anointing, their spines seem to have a mild toxicirritant effect; when you prick yourself on one, even slightly, it hurts more than it should, and for a little bit longer.",prick,33,1,prick.v.01;prick.v.04,poke-19,Contact,VN,../../Linguistic data/ontonotes-release-5.0/data/files/data/english/annotations/wb/sel/82/sel_8251.sense,0,1,False
Karl toted the books to the car.,tote,,,,,Carrying,,framenet,,,
and so nursing home owners know that in a lot of cases it 's less expensive to break the rules and to hurt people than it is to provide the level of care that /-,hurt,22,1,hurt.v.01;hurt.v.02;hurt.v.06;hurt.v.07,hurt-40.8.3,Hurt,WN,../../Linguistic data/ontonotes-release-5.0/data/files/data/english/annotations/bc/cnn/00/cnn_0000.sense,224,1,False
She breast-fed her son for the first six months.,breast-feed,,,,,Feeding,,synthetic,,,
Flute player Shamus Eagan comes from Pennsylvania.,come,4,5,come.v.05;come.v.07;come.v.08;come.v.18,appear-48.1.1,Location,VN,../../Linguistic data/ontonotes-release-5.0/data/files/data/english/annotations/bn/pri/00/pri_0037.sense,11,1,False
"Her large brown eyes dart around the room from BunBun to her school papers and chewed-on pencils on the floor, then back to the list.",dart,4,2,dart.v.03,slide-11.2,Motion,WN,../../Linguistic data/ontonotes-release-5.0/data/files/data/english/annotations/wb/sel/38/sel_3858.sense,0,1,False
Don't use a natural bristle brush with latex paint.,use,,,,,Manipulation,,framenet (Using),,,
Steve tossed the ball to the garden.,toss,,,,,Throwing,,"Croft et al 2021, p. 69f",,,
"In August last year, as Taiwan was being buffeted by a typhoon, over 20 eggs hatched out into tiny snakes, which the zoo hopes can grow up safe and sound.",hatch,17,1,hatch.v.01,grow-26.2.1,Form,WN,../../Linguistic data/ontonotes-release-5.0/data/files/data/english/annotations/mz/sinorama/10/ectb_1066.sense,74,1,False
"I 'm thinking about house hold fluorescents and when they flicker, sometimes it 's the bulb, sometimes it 's the ballast.",flicker,10,1,,light_emission-43.1,Emission,VN,../../Linguistic data/ontonotes-release-5.0/data/files/data/english/annotations/wb/sel/52/sel_5242.sense,0,1,False
"Meanwhile, in the Middle East, former Israeli Prime Minister Shimon Peres met with Palestinian leader Yasser Arafat with whom he once shared the Nobel Peace Prize.",meet,13,2,meet.v.02;meet.v.08;meet.v.09,meet-36.3,Reciprocal,WN,../../Linguistic data/ontonotes-release-5.0/data/files/data/english/annotations/bn/voa/00/voa_0081.sense,6,1,False
I purchased the calculator for easier calculation of my debts.,purchase,,,,,Buying,,framenet,,,
"The citizen would be forced to own a weapon to protect himself, at the time when the security agencies failed to protect him...",own,6,1,own.v.01,own-100.1,Possession,WN,../../Linguistic data/ontonotes-release-5.0/data/files/data/english/annotations/wb/a2e/00/a2e_0005.sense,44,1,False
"Japan has been testing imported food from Europe since the April 1986 Chernobyl accident in the Soviet Union, the spokesman said.",import,4,1,import.v.01,send-11.1,Sending,WN,../../Linguistic data/ontonotes-release-5.0/data/files/data/english/annotations/nw/wsj/09/wsj_0990.sense,56,1,False
"Pushing small luggage carts, they lead customers to the buses.",lead,6,5,lead.v.01,accompany-51.7,Pursuit,VN,../../Linguistic data/ontonotes-release-5.0/data/files/data/english/annotations/mz/sinorama/10/ectb_1009.sense,136,1,False
He can put away an entire pizza.,put,,,,,Ingestion,,ontonotes,,,
"David Tagg, formerly in charge of gambling operations, was appointed chief executive for retailing and property.",appoint,11,1,appoint.v.01;appoint.v.02,appoint-29.1,Cause Participation,VN,../../Linguistic data/ontonotes-release-5.0/data/files/data/english/annotations/nw/wsj/14/wsj_1494.sense,4,1,False
"Three members of Solace, including superstar fiddler Winfred Horan are Irish Americans, the remaining two are Irish transplants living in New York City.",remain,15,2,remain.v.03,exist-47.1,Existence,WN,../../Linguistic data/ontonotes-release-5.0/data/files/data/english/annotations/bn/pri/00/pri_0037.sense,6,1,False
"""The U.S., with its regional friends, must play a crucial role in designing its architecture.""",design,15,1,design.v.03;design.v.04;design.v.05,create-26.4,Cause Creation,WN,../../Linguistic data/ontonotes-release-5.0/data/files/data/english/annotations/nw/wsj/00/wsj_0043.sense,31,1,False
