sentence,verb_lemma,verb_token_idx,on_sense,wn_synsets,vn_class,situation,match_path,source_file,sentence_idx,situation_count,needs_review
City officials feared widespread gridlock on the first day that normal business operations were resumed following last Tuesday 's earthquake.,fear,2,2,fear.v.01;fear.v.02;fear.v.04,admire-31.2,Emotion (exp. subj.),WN,../../Linguistic data/ontonotes-release-5.0/data/files/data/english/annotations/nw/wsj/12/wsj_1271.sense,2,1,False
"In any case, cable - TV - system operators have reason to fear any tinkering with CNN 's format.",fear,13,2,fear.v.01;fear.v.02;fear.v.04,admire-31.2,Emotion (exp. subj.),WN,../../Linguistic data/ontonotes-release-5.0/data/files/data/english/annotations/nw/wsj/23/wsj_2351.sense,53,1,False
He appreciates her honesty.,appreciate,1,,,,Emotion_(exp. subj.),synthetic,,,,False
"An unsigned email from the embassy commended Allen --"" I know that your Iraqi friends appreciate your friendship"" -- but noted that U.S. visas are ""quite difficult"" for Iraqis to get.",appreciate,16,2,appreciate.v.01;appreciate.v.03,admire-31.2,Emotion (exp. subj.),VN,../../Linguistic data/ontonotes-release-5.0/data/files/data/english/annotations/wb/eng/00/eng_0015.sense,97,1,False
"But, counters Chen Tsai - ching, director of guidance counseling at the Lungshan Middle School, it is in the nature of young people in whatever era to worry about their looks.",worry,30,1,worry.v.01;worry.v.02;worry.v.03;worry.v.04,marvel-31.3,Emotion (exp. subj.),WN,../../Linguistic data/ontonotes-release-5.0/data/files/data/english/annotations/mz/sinorama/10/ectb_1018.sense,146,1,False
""" Miss Chen "" of Pingtung worries that her father, soon to retire at age 60, does n't think much about money, and his expected retirement plus savings will be less than NT$ 4 million ( about US$ 120,000 ).",worry,6,1,worry.v.01;worry.v.02;worry.v.03;worry.v.04,marvel-31.3,Emotion (exp. subj.),WN,../../Linguistic data/ontonotes-release-5.0/data/files/data/english/annotations/mz/sinorama/10/ectb_1028.sense,126,1,False
"Yet the heavy - handedness of the satire also can be effective in a book like this: If the head of AIW were not portrayed as an utterly contemptible, malicious dolt, we would not much care whether his schemes were defeated, and would not be so diverted in the process.",care,38,1,care.v.01;care.v.05,marvel-31.3,Emotion (exp. subj.),WN,../../Linguistic data/ontonotes-release-5.0/data/files/data/english/annotations/nw/wsj/14/wsj_1473.sense,30,1,False
I do n't care for this new chick in town /.,care,3,1,care.v.01;care.v.05,marvel-31.3,Emotion (exp. subj.),WN,../../Linguistic data/ontonotes-release-5.0/data/files/data/english/annotations/bc/cnn/00/cnn_0000.sense,600,1,False
"Tmac gets the highest salary in the team, so he should n't care too much about himself.",care,13,1,care.v.01;care.v.05,marvel-31.3,Emotion (exp. subj.),WN,../../Linguistic data/ontonotes-release-5.0/data/files/data/english/annotations/wb/p2.5_c2e/00/p2.5_c2e_0044.sense,4,1,False
"The Chicago Board of Trade, the No. 1 U.S. grain market, had long chafed under the attention won by its innovative archrival, the livestock - dealing Mercantile Exchange.",chafe,15,2,chafe.v.02;chafe.v.03,marvel-31.3,Emotion (exp. subj.),WN,../../Linguistic data/ontonotes-release-5.0/data/files/data/english/annotations/nw/wsj/17/wsj_1737.sense,4,1,False
"His wife was a universally admired beauty, the envy of all.",admire,5,1,admire.v.01;admire.v.02,admire-31.2,Emotion (exp. subj.),VN,../../Linguistic data/ontonotes-release-5.0/data/files/data/english/annotations/mz/sinorama/10/ectb_1019.sense,33,1,False
"( 4 ) I agree with and support, however we may have already sucked much of the juice out of that orange",support,7,2,support.v.01;support.v.02;support.v.03;support.v.06;support.v.08;support.v.09;support.v.10,admire-31.2,Emotion (exp. subj.),VN,../../Linguistic data/ontonotes-release-5.0/data/files/data/english/annotations/wb/eng/00/eng_0004.sense,93,1,False
"But they had better bring an argument that is supportable as in ""prioritize transportation projects based on what expenditures would produce the most improvement in traffic flow"" and not as in ""its was the taxpayers ' job to pay for the infrastructure to support whatever he built"", and not as in ""new roads will do nothing for 99 % of the drivers"".",support,46,2,support.v.01;support.v.02;support.v.03;support.v.06;support.v.08;support.v.09;support.v.10,admire-31.2,Emotion (exp. subj.),VN,../../Linguistic data/ontonotes-release-5.0/data/files/data/english/annotations/wb/eng/00/eng_0003.sense,232,1,False
"Mr. Thal says that Elizabeth Taylor, a client, ""hates being called ` Liz. '...",hate,11,1,hate.v.01,admire-31.2,Emotion (exp. subj.),WN,../../Linguistic data/ontonotes-release-5.0/data/files/data/english/annotations/nw/wsj/13/wsj_1376.sense,55,1,False
"Senior administration officials are now saying privately that if Milosevic never comes to trial, the U.S. might not like it, but could live with it, as long as the man is gone.",like,19,2,like.v.02;like.v.03;like.v.04,admire-31.2,Emotion (exp. subj.),WN,../../Linguistic data/ontonotes-release-5.0/data/files/data/english/annotations/bn/abc/00/abc_0004.sense,6,1,False
Do you think they would like Hillary Clinton the cut of her jib out there /?,like,5,2,like.v.02;like.v.03;like.v.04,admire-31.2,Emotion (exp. subj.),WN,../../Linguistic data/ontonotes-release-5.0/data/files/data/english/annotations/bc/msnbc/00/msnbc_0004.sense,576,1,False
"Like it or not, the Qatari people are the twin of the Saudi people.",like,0,2,like.v.02;like.v.03;like.v.04,admire-31.2,Emotion (exp. subj.),WN,../../Linguistic data/ontonotes-release-5.0/data/files/data/english/annotations/wb/a2e/00/a2e_0025.sense,146,1,False
She loathes crowded subways.,loathe,1,,,,Emotion_(exp. subj.),synthetic,,,,False
Chang deeply regretted that he was unable to examine the Shangqiu site in eastern Henan.,regret,2,1,regret.v.02;regret.v.03;regret.v.04,admire-31.2,Emotion (exp. subj.),VN,../../Linguistic data/ontonotes-release-5.0/data/files/data/english/annotations/mz/sinorama/10/ectb_1060.sense,43,1,False
The old dog cowered during the thunder.,cower,3,,,,Emotion_(exp. subj.),synthetic,,,,False
"In addition, there is a great deal of shallow water, which is tailor - made for snorkeling, so that even tourists who are not particularly at home in the water can enjoy the magnificence of the ocean.",enjoy,34,1,enjoy.v.01;enjoy.v.03;enjoy.v.05,admire-31.2,Emotion (exp. subj.),WN,../../Linguistic data/ontonotes-release-5.0/data/files/data/english/annotations/mz/sinorama/10/ectb_1022.sense,51,1,False
"Once the Zhuhai - Hong Kong - Macao bridge is built, it will no longer be a dream of tourists to enjoy gourmet food in Macao before having fun at Disneyland just an hour later.",enjoy,22,1,enjoy.v.01;enjoy.v.03;enjoy.v.05,admire-31.2,Emotion (exp. subj.),WN,../../Linguistic data/ontonotes-release-5.0/data/files/data/english/annotations/bc/cctv/00/cctv_0000.sense,181,1,False
"He favors a form of commercial rent control, which the financial community believes would make it more difficult to attract investment in the city.",favor,1,1,favor.v.01;favor.v.02;favor.v.04,admire-31.2,Emotion (exp. subj.),VN,../../Linguistic data/ontonotes-release-5.0/data/files/data/english/annotations/nw/wsj/07/wsj_0765.sense,76,1,False
She dreads the next exam.,dread,1,,,,Emotion_(exp. subj.),synthetic,,,,False
She pities the stray dogs in winter.,pity,1,,,,Emotion_(exp. subj.),synthetic,,,,False
She loves quiet afternoons at the lake.,love,1,,,,Emotion_(exp. subj.),synthetic,,,,False
He envies his sister's musical talent.,envy,1,,,,Emotion_(exp. subj.),synthetic,,,,False
I ca n't stand throwing something away.,stand,3,4,stand.v.04;stand.v.05;stand.v.08,admire-31.2,Emotion (exp. subj.),VN,../../Linguistic data/ontonotes-release-5.0/data/files/data/english/annotations/wb/eng/00/eng_0001.sense,70,1,False
and we just can tolerate this /.,tolerate,4,1,tolerate.v.01;tolerate.v.03;tolerate.v.04,admire-31.2,Emotion (exp. subj.),VN,../../Linguistic data/ontonotes-release-5.0/data/files/data/english/annotations/bc/cnn/00/cnn_0008.sense,112,1,False
"In the past, too much emphasis on schoolwork and good grades encouraged the development of a society in which many are crudely obsessed with personal gain.",obsess,23,1,obsess.v.01;obsess.v.02,marvel-31.3,Emotion (exp. subj.),WN,../../Linguistic data/ontonotes-release-5.0/data/files/data/english/annotations/mz/sinorama/10/ectb_1053.sense,58,1,False
"The past six years have seen the greatest degree of military escalation and political aggravation in all the crises in the Middle East, and neither escalation nor aggravation has helped achieve the specific agendas of any side that has worked to provoke or inflame these crises.",provoke,42,1,provoke.v.01;provoke.v.02;provoke.v.03,engender-27.1,Cause and Effect,WN,../../Linguistic data/ontonotes-release-5.0/data/files/data/english/annotations/wb/p2.5_a2e/00/p2.5_a2e_0048.sense,1,1,False
The insult provoked him to leave the room.,provoke,2,,,,Cause_and_Effect,synthetic,,,,False
His speech provoked anger among the listeners.,provoke,2,,,,Cause_and_Effect,synthetic,,,,False
"If it is correct to find that concerns over corporate debt and LBOs caused Gray Friday, what are the implications for policy makers?",cause,13,1,cause.v.01;cause.v.02,engender-27.1,Cause and Effect,WN,../../Linguistic data/ontonotes-release-5.0/data/files/data/english/annotations/nw/wsj/22/wsj_2229.sense,24,1,False
"INTERNATIONAL BUSINESS MACHINES Corp, Armonk, N.Y., maker of business machines, NYSE, said flooding caused by broken water pipes closed its San Jose plant, which makes high - end data - storage devices.",cause,18,1,cause.v.01;cause.v.02,engender-27.1,Cause and Effect,WN,../../Linguistic data/ontonotes-release-5.0/data/files/data/english/annotations/nw/wsj/19/wsj_1915.sense,70,1,False
"The procedure causes ""great uncertainty"" because an investor ca n't be sure of his or her individual liability, Lloyd 's said.",cause,2,1,cause.v.01;cause.v.02,engender-27.1,Cause and Effect,WN,../../Linguistic data/ontonotes-release-5.0/data/files/data/english/annotations/nw/wsj/12/wsj_1220.sense,5,1,False
"The daughter - in - law, played by Chang Yu - yen, is mistreated by her mother - in - law, and, with outsiders butting in and causing trouble, she gets abused from beginning to end.",cause,31,1,cause.v.01;cause.v.02,engender-27.1,Cause and Effect,WN,../../Linguistic data/ontonotes-release-5.0/data/files/data/english/annotations/mz/sinorama/10/ectb_1006.sense,75,1,False
The damage to the Bay area 's roadways could cause significant economic hardship.,cause,9,1,cause.v.01;cause.v.02,engender-27.1,Cause and Effect,WN,../../Linguistic data/ontonotes-release-5.0/data/files/data/english/annotations/nw/wsj/18/wsj_1870.sense,24,1,False
All this causes Rep. Hyde to muse about an alternate way to drum up more enthusiasm.,cause,2,1,cause.v.01;cause.v.02,engender-27.1,Cause and Effect,WN,../../Linguistic data/ontonotes-release-5.0/data/files/data/english/annotations/nw/wsj/20/wsj_2053.sense,41,1,False
The shock caused the pipes to burst.,cause,2,,,,Cause_and_Effect,synthetic,,,,False
"Although the recent fires have been put out fairly quickly, a blaze on Snow Mountain caused alarm when it burned near a stand of rare Chinese hemlock as well as streams that are home to the Formosan landlocked salmon, which is regarded as a national treasure.",cause,16,1,cause.v.01;cause.v.02,engender-27.1,Cause and Effect,WN,../../Linguistic data/ontonotes-release-5.0/data/files/data/english/annotations/mz/sinorama/10/ectb_1074.sense,39,1,False
"Explosions shook a Phillips Petroleum Co. plastics plant near Pasadena, Texas, hurling debris and causing a fire visible from 10 miles away.",cause,16,1,cause.v.01;cause.v.02,engender-27.1,Cause and Effect,WN,../../Linguistic data/ontonotes-release-5.0/data/files/data/english/annotations/nw/wsj/13/wsj_1353.sense,17,1,False
"Yuan Chen also pointed out that what causes worry is that some industrial countries take labor standards, environment and human rights, etc., as excuses to frequently adopt trade protection measures.",cause,7,1,cause.v.01;cause.v.02,engender-27.1,Cause and Effect,WN,../../Linguistic data/ontonotes-release-5.0/data/files/data/english/annotations/nw/xinhua/01/chtb_0167.sense,20,1,False
it could bring better treatments even cures for diseases that cause a lot of pain and death to millions of people /.,cause,10,1,cause.v.01;cause.v.02,engender-27.1,Cause and Effect,WN,../../Linguistic data/ontonotes-release-5.0/data/files/data/english/annotations/bc/cnn/00/cnn_0006.sense,388,1,False
"Lawful demonstrations, such as peaceful picketing and other assemblages that do not disturb the peace or cause a public nuisance or interfere with the rights of others, are rights guaranteed by any truly free system of government.",cause,17,1,cause.v.01;cause.v.02,engender-27.1,Cause and Effect,WN,../../Linguistic data/ontonotes-release-5.0/data/files/data/english/annotations/nw/wsj/02/wsj_0290.sense,13,1,False
The Venezuelan government panel wants both Ford and Firestone to compensate victims of accidents caused by Ford vehicles equipped with Firestone tyres.,cause,14,1,cause.v.01;cause.v.02,engender-27.1,Cause and Effect,WN,../../Linguistic data/ontonotes-release-5.0/data/files/data/english/annotations/bn/voa/00/voa_0010.sense,3,1,False
"Under traditional legal theories, inability to prove which company manufactured a drug that caused an injury or death would lead to the lawsuit being dismissed.",cause,14,1,cause.v.01;cause.v.02,engender-27.1,Cause and Effect,WN,../../Linguistic data/ontonotes-release-5.0/data/files/data/english/annotations/nw/wsj/04/wsj_0455.sense,14,1,False
"Mazda and Ford said a combination of limited crankcase ventilation and improper maintenance could cause engine oil in some of the Mercury Tracers and Mazda 323s to deteriorate more rapidly than normal, causing increased engine noise or reduced engine life.",cause,33,1,cause.v.01;cause.v.02,engender-27.1,Cause and Effect,WN,../../Linguistic data/ontonotes-release-5.0/data/files/data/english/annotations/nw/wsj/04/wsj_0451.sense,7,1,False
"One analyst, Peter Cardillo of Josephthal & Co., New York, said the gold market already had some good price - supporting technical factors that would have caused prices to rise, with or without the stock market.",cause,29,1,cause.v.01;cause.v.02,engender-27.1,Cause and Effect,WN,../../Linguistic data/ontonotes-release-5.0/data/files/data/english/annotations/nw/wsj/22/wsj_2265.sense,22,1,False
"At the same time, William T. Archey, international vice president at the U.S. Chamber of Commerce, notes: ""Clearly the stronger dollar has made imports more attractive"" by causing their prices to decline.",cause,33,1,cause.v.01;cause.v.02,engender-27.1,Cause and Effect,WN,../../Linguistic data/ontonotes-release-5.0/data/files/data/english/annotations/nw/wsj/19/wsj_1970.sense,27,1,False
"And by then, expensive automobile sound systems were keeping the gridlocked parking lot by the bay informed about the fire causing the big black plume of smoke we saw on the northern horizon.",cause,21,1,cause.v.01;cause.v.02,engender-27.1,Cause and Effect,WN,../../Linguistic data/ontonotes-release-5.0/data/files/data/english/annotations/nw/wsj/16/wsj_1643.sense,50,1,False
"Delegates from 180 countries were unable to agree on how to cut greenhouse gas emissions, which many believe causes global warming.",cause,19,1,cause.v.01;cause.v.02,engender-27.1,Cause and Effect,WN,../../Linguistic data/ontonotes-release-5.0/data/files/data/english/annotations/bn/voa/01/voa_0122.sense,1,1,False
Campeau developed a cash squeeze that caused it to be tardy on some interest payments and to put its prestigious Bloomingdales department - store chain up for sale.,cause,6,1,cause.v.01;cause.v.02,engender-27.1,Cause and Effect,WN,../../Linguistic data/ontonotes-release-5.0/data/files/data/english/annotations/nw/wsj/24/wsj_2428.sense,13,1,False
The impact caused the ice to crack.,cause,2,,,,Cause_and_Effect,synthetic,,,,False
"""There 's a lot of uncertainty out there, and it will cause a lot of swings,"" he said.",cause,13,1,cause.v.01;cause.v.02,engender-27.1,Cause and Effect,WN,../../Linguistic data/ontonotes-release-5.0/data/files/data/english/annotations/nw/wsj/10/wsj_1055.sense,16,1,False
"There would be a charioteer, and he, in those ancient times, in order to goad the horses to pull the chariot, would make a sound like ra.",goad,17,1,goad.v.01;goad.v.02;goad.v.03;goad.v.04,bully-59.5,Induction,WN,../../Linguistic data/ontonotes-release-5.0/data/files/data/english/annotations/wb/sel/56/sel_5685.sense,0,1,False
"But markets took some heart from the warning signs, hoping that they would goad the Federal Reserve to lower interest rates more.",goad,14,1,goad.v.01;goad.v.02;goad.v.03;goad.v.04,bully-59.5,Induction,WN,../../Linguistic data/ontonotes-release-5.0/data/files/data/english/annotations/wb/sel/56/sel_5683.sense,0,1,False
Chang Yu - yen ( right ) plays a much - abused daughter - in - law in the series The Astonishing Daughter - in - Law.,abuse,11,1,abuse.v.01;abuse.v.02;abuse.v.03;abuse.v.04,judgment-33.1,Aggression,WN,../../Linguistic data/ontonotes-release-5.0/data/files/data/english/annotations/mz/sinorama/10/ectb_1006.sense,196,2,True
The outbreak triggered a regional shutdown.,trigger,2,,,,Cause_and_Effect,synthetic,,,,False
The announcement sparked widespread protests.,spark,2,,,,Cause_and_Effect,synthetic,,,,False
The decision set off a chain reaction.,set_off,2,,,,Cause_and_Effect,synthetic,,,,False
The article incited the crowd to protest.,incite,2,,,,Cause_and_Effect,synthetic,,,,False
His remarks stirred outrage in the chamber.,stir,2,,,,Cause_and_Effect,synthetic,,,,False
"In Taipei, 1997 was designated as the Year of Public Art, and the following year experimental installations went on display at nine cultural centers around the island, chosen by the Council for Cultural Affairs ( CCA ).",designate,5,designate-v 1,designate.v.01;designate.v.03,appoint-29.1,Induction,pos_fill,mz/sinorama/10/ectb_1037.sense,5,,False
"However, for example, in France the strict machinery of justice is separated from the constitutional court, which is a separate body, but yes there also the members are appointed by the President and therefore there also, the members of the Coseque Constitutionalle are somewhat open to criticism that the decisions are often more motivated by politics than they are by the law.",appoint,32,appoint-v 1,appoint.v.01;appoint.v.02,appoint-29.1,Induction,pos_fill,bn/pri/00/pri_0083.sense,12,,False
We think they started cheating in the late nineties by getting some gas centrifuge equipment from Pakistan /.,cheat,4,2,cheat.v.02;cheat.v.03;cheat.v.04,trick-59.2,Induction,WN,../../Linguistic data/ontonotes-release-5.0/data/files/data/english/annotations/bc/msnbc/00/msnbc_0007.sense,456,1,False
"And has he truly persuaded the Communist Party to accept economic change of a kind that will, sooner or later, lead to its demise?",persuade,4,1,persuade.v.01;persuade.v.02,compel-59.1,Induction,WN,../../Linguistic data/ontonotes-release-5.0/data/files/data/english/annotations/nw/wsj/04/wsj_0439.sense,7,1,False
I think he resigned because they were trying to blackmail him into lying about Benghazi.,blackmail,,,,,Induction,,"Kalm 2022, p. 242f",,,
Leslie blackmailed the watch out of John.,blackmail,,,,,Induction,,"Kalm 2022, p. 242f",,,
"Besides the fact that advertising and sales pitches in a modern commercial society "" seduce "" some men into falling into the beauty trap, many observers suggest that a major force behind male vanity are women, especially the women closest to individual men.",seduce,14,seduce-v 1,seduce.v.01;seduce.v.02,force-59-1,Induction,pos_fill,mz/sinorama/10/ectb_1018.sense,32,,False
Jansen Jones was rushed by helicopter to the hospital /.,rush,3,rush-v 2,rush.v.02;rush.v.03;rush.v.06;rush.v.07;rush.v.01;rush.v.01;rush.v.01;rush.v.01,,Induction,pos_fill,bc/cnn/00/cnn_0002.sense,226,,False
"The 100 - foot - long mural, painted by James Daugherty in 1934, was commissioned by the federal Works Project Administration.",commission,16,commission-v 2,commission.v.02,NM,Induction,pos_fill,nw/wsj/16/wsj_1686.sense,2,,False
"But in the letters sent in recent days, Christopher J. Lezovich of the IRS computing center in Detroit, told attorneys that ""failing to voluntarily submit the requested information could result in summons enforcement action being initiated.""",initiate,38,initiate-v 1,initiate.v.01;initiate.v.02;initiate.v.04;initiate.v.05,complete-55.2,Induction,pos_fill,nw/wsj/00/wsj_0049.sense,20,,False
"At the very least, a recession would prompt investors to buy the highest - quality bonds they can find -- that is, Treasurys.",prompt,8,prompt-v 1,prompt.v.01;prompt.v.02,,Induction,pos_fill,nw/wsj/16/wsj_1635.sense,75,,False
"You lured me into a job, and then you fired me.",lure,,,,,Induction,,"Kalm 2022, p. 242f",,,
That pea soup tasted like heaven.,taste,,,,,Perception_(stim._subj.),,"Levin 1993, stimulus_subject-30.4",,,
That pea soup tasted delicious to me.,taste,,,,,Perception_(stim._subj.),,"Levin 1993, stimulus_subject-30.4",,,
That pea soup tasted delicious.,taste,,,,,Perception_(stim._subj.),,"Levin 1993, stimulus_subject-30.4",,,
"Because they also detected tritium and indications of nuclear radiation, they asserted that the ""excess"" heat energy must be coming from energy released by the nuclear fusion of deuterium atoms inside the palladium rod.",detect,3,1,detect.v.01,see-30.1,Perception_(exp._subj.),WN,../../Linguistic data/ontonotes-release-5.0/data/files/data/english/annotations/nw/wsj/15/wsj_1550.sense,16,1,False
We can not stay there the way the secretary of state Rice said we 'll stay there as long as they need us /.,need,21,1,need.v.01;need.v.02;need.v.03,want-32.1,Desire,WN,../../Linguistic data/ontonotes-release-5.0/data/files/data/english/annotations/bc/cnn/00/cnn_0005.sense,329,1,False
What you need is a hot bowl of soup.,need,,,,,Desire,,synthetic,,,
"So, there is a kind of states ' rights issue there, but they need, or at least they once thought they needed the Supreme Court to endorse it.",need,24,1,need.v.01;need.v.02;need.v.03,want-32.1,Desire,WN,../../Linguistic data/ontonotes-release-5.0/data/files/data/english/annotations/bn/voa/01/voa_0131.sense,16,1,False
I really need a rest from all this.,need,,,,,Desire,,synthetic,,,
I don't need all this hassle.,need,,,,,Desire,,synthetic,,,
"""We need research that convinces us that magazines are a real value in reader 's lives, that readers are really involved.""",need,2,1,need.v.01;need.v.02;need.v.03,want-32.1,Desire,WN,../../Linguistic data/ontonotes-release-5.0/data/files/data/english/annotations/nw/wsj/11/wsj_1123.sense,8,1,False
"In fact, Ms. Volokh was n't just a rich lady who needed a hobby.",need,12,1,need.v.01;need.v.02;need.v.03,want-32.1,Desire,WN,../../Linguistic data/ontonotes-release-5.0/data/files/data/english/annotations/nw/wsj/13/wsj_1367.sense,49,1,False
"The evil angel acted like he did n't even know about the shots, and leafed through a clipboard.",leaf,15,1,leaf.v.01;leaf.v.02,rummage-35.5,Intention,VN,../../Linguistic data/ontonotes-release-5.0/data/files/data/english/annotations/wb/sel/68/sel_6878.sense,0,1,False
He learned where you can buy the best tomatoes in town.,learn,,,,,Discovery,,ontonotes (learn sense 2),,,
"There was a famous British psychologist named Ellis in the last century, who encouraged people to learn a special, reasonable and healthy way of thinking by reading professional books, organizing group discussions and doing specific training in thinking, in order to deal with emotional problems caused by stresses.",learn,17,1,learn.v.01;learn.v.03;learn.v.04,learn-14,Learning,WN,../../Linguistic data/ontonotes-release-5.0/data/files/data/english/annotations/wb/c2e/00/c2e_0042.sense,8,1,False
Rhoda learned from an old book.,learn,,,,,Learning,,"Levin 1993, learn-14",,,
A gaggle of students were frantically memorizing the answers out in the hall.,memorize,,,,,Learning,,framenet (Memorization),,,
"But the longer it takes us to understand the new landscape of this war, the more costly and painful the victory will be.",take,4,3,take.v.02;take.v.14,cost-54.2,Measurement,VN,../../Linguistic data/ontonotes-release-5.0/data/files/data/english/annotations/wb/eng/00/eng_0000.sense,263,1,False
It ruled that recounts submitted to state officials after a filing deadline had passed had to be counted.,count,17,1,count.v.01;count.v.04,multiply-108,Counting,WN,../../Linguistic data/ontonotes-release-5.0/data/files/data/english/annotations/bn/cnn/01/cnn_0113.sense,21,1,False
They were staring straight ahead as well /.,stare,2,1,stare.v.01;stare.v.02,peer-30.3,Perception_(exp._subj.),VN,../../Linguistic data/ontonotes-release-5.0/data/files/data/english/annotations/bc/msnbc/00/msnbc_0002.sense,106,1,False
The villagers long for the days when the river still ran clear.,long,,,,,Intention,,synthetic,,,
"By opening the book to page 10, you will find the Van Eerdens' number.",find,,,,,Discovery,,framenet (Becoming_aware),,,
"Anyway, there 's no harm in giving it a try yourself, and you may find your own answer.",find,16,1,find.v.01;find.v.02;find.v.03;find.v.06;find.v.07;find.v.08;find.v.09;find.v.12;find.v.13;find.v.14;find.v.15;find.v.16,discover-84,Discovery,WN,../../Linguistic data/ontonotes-release-5.0/data/files/data/english/annotations/mz/sinorama/10/ectb_1056.sense,38,3,True
I weighed the package.,weigh,,,,,Measurement,,"Levin 1993, Register-54.1",,,
