sentence,verb_lemma,verb_token_idx,on_sense,wn_synsets,vn_class,situation,match_path,source_file,sentence_idx,situation_count,needs_review
"The heat energy plus the energy consumed by the breakup of the water molecules added to far more energy coming out of the apparatus than electrical energy going in, they reported.",consume,6,2,consume.v.03;consume.v.05,consume-66,Dynamic Possession,VN,../../Linguistic data/ontonotes-release-5.0/data/files/data/english/annotations/nw/wsj/15/wsj_1550.sense,15,1,False
Foreign - funded processing export consumes domestic electricity and water resources substantially.,consume,5,2,consume.v.03;consume.v.05,consume-66,Dynamic Possession,VN,../../Linguistic data/ontonotes-release-5.0/data/files/data/english/annotations/wb/c2e/00/c2e_0022.sense,45,1,False
A lot of people had to borrow money just to pay their taxes.,borrow,6,1,borrow.v.01,obtain-13.5.2,Dynamic Possession,VN,../../Linguistic data/ontonotes-release-5.0/data/files/data/english/annotations/mz/sinorama/10/ectb_1021.sense,39,1,False
But the percentage of your cash reserve that you can borrow tax - free is very small.,borrow,10,1,borrow.v.01,obtain-13.5.2,Dynamic Possession,VN,../../Linguistic data/ontonotes-release-5.0/data/files/data/english/annotations/nw/wsj/15/wsj_1574.sense,50,1,False
"The theory: Such individuals, many with young children, are in their prime borrowing years -- and, having borrowed from the bank, they may continue to use it for other services in later years.",borrow,15,1,borrow.v.01,obtain-13.5.2,Dynamic Possession,VN,../../Linguistic data/ontonotes-release-5.0/data/files/data/english/annotations/nw/wsj/00/wsj_0085.sense,16,1,False
The law does allow the RTC to borrow from the Treasury up to $ 5 billion at any time.,borrow,7,1,borrow.v.01,obtain-13.5.2,Dynamic Possession,VN,../../Linguistic data/ontonotes-release-5.0/data/files/data/english/annotations/nw/wsj/22/wsj_2200.sense,14,1,False
All international commercial loans borrowed by domestic institutions should be approved by the National Foreign Exchange Management Bureau.,borrow,4,1,borrow.v.01,obtain-13.5.2,Dynamic Possession,VN,../../Linguistic data/ontonotes-release-5.0/data/files/data/english/annotations/nw/xinhua/01/chtb_0119.sense,5,1,False
"Because his beverage wholesaling business requires a lot of space for large warehouses, he borrowed money from friends for many years to buy land.",borrow,15,1,borrow.v.01,obtain-13.5.2,Dynamic Possession,VN,../../Linguistic data/ontonotes-release-5.0/data/files/data/english/annotations/mz/sinorama/10/ectb_1021.sense,104,1,False
"Within a matter of weeks, less - conservative magazines reported that members of the ruling LDP had received much larger donations from pachinko organizations.",receive,18,1,receive.v.01;receive.v.02;receive.v.03;receive.v.04;receive.v.08;receive.v.09;receive.v.11;receive.v.12,obtain-13.5.2,Dynamic Possession,VN,../../Linguistic data/ontonotes-release-5.0/data/files/data/english/annotations/nw/wsj/13/wsj_1387.sense,29,1,False
"Tenders for the bills, available in minimum $ 10,000 denominations, must be received by 1 p.m. EST Monday at the Treasury or at Federal Reserve banks or branches.",receive,14,1,receive.v.01;receive.v.02;receive.v.03;receive.v.04;receive.v.08;receive.v.09;receive.v.11;receive.v.12,obtain-13.5.2,Dynamic Possession,VN,../../Linguistic data/ontonotes-release-5.0/data/files/data/english/annotations/nw/wsj/11/wsj_1198.sense,2,1,False
"Mrs. Arafat, who lives in Paris with her daughter, receives tens of thousands of dollars per month from the allegedly bankrupt Palestinian Authority, while a typical local ringleader of the Al-Aksa brigade, reporting to Arafat, receives only a cash payment of a couple of hundred dollars, for performing murders at the retail level.",receive,11,1,receive.v.01;receive.v.02;receive.v.03;receive.v.04;receive.v.08;receive.v.09;receive.v.11;receive.v.12,obtain-13.5.2,Dynamic Possession,VN,../../Linguistic data/ontonotes-release-5.0/data/files/data/english/annotations/wb/eng/00/eng_0000.sense,170,1,False
The legislation also arranges for children under 18 orphaned by the quake to receive a government - subsidized trust fund to pay for their living expenses and education.,receive,13,1,receive.v.01;receive.v.02;receive.v.03;receive.v.04;receive.v.08;receive.v.09;receive.v.11;receive.v.12,obtain-13.5.2,Dynamic Possession,VN,../../Linguistic data/ontonotes-release-5.0/data/files/data/english/annotations/mz/sinorama/10/ectb_1008.sense,47,1,False
Former Iranian hostage Terry Anderson and the families of seven other former hostages will soon begin receiving compensation for their suffering.,receive,16,1,receive.v.01;receive.v.02;receive.v.03;receive.v.04;receive.v.08;receive.v.09;receive.v.11;receive.v.12,obtain-13.5.2,Dynamic Possession,VN,../../Linguistic data/ontonotes-release-5.0/data/files/data/english/annotations/bn/abc/00/abc_0021.sense,0,1,False
British police are puzzling over an item of stolen property which has just been recovered.,recover,14,1,recover.v.01;recover.v.04,obtain-13.5.2,Dynamic Possession,WN,../../Linguistic data/ontonotes-release-5.0/data/files/data/english/annotations/bn/pri/00/pri_0027.sense,2,1,False
"He says: "" If I had used my allowance every year from the time I was small to invest in a fund, at the rate of NT$ 30,000 per year, after 20 years, there would be quite a lot of money right now. """,use,7,3,use.v.03,consume-66,Dynamic Possession,WN,../../Linguistic data/ontonotes-release-5.0/data/files/data/english/annotations/mz/sinorama/10/ectb_1028.sense,21,1,False
"In order to promote the development of the Tumen River region, South Korea donated one million US dollars to establish the Tumen River development fund.",donate,14,1,donate.v.01,contribute-13.2,Dynamic Possession,WN,../../Linguistic data/ontonotes-release-5.0/data/files/data/english/annotations/nw/xinhua/00/chtb_0049.sense,20,1,False
They also donated tents and other necessities.,donate,2,1,donate.v.01,contribute-13.2,Dynamic Possession,WN,../../Linguistic data/ontonotes-release-5.0/data/files/data/english/annotations/mz/sinorama/10/ectb_1062.sense,28,1,False
The initiative seems to have been crafted to include all the hot issues that set off the wealthy Hollywood weepers who donate money.,donate,21,1,donate.v.01,contribute-13.2,Dynamic Possession,WN,../../Linguistic data/ontonotes-release-5.0/data/files/data/english/annotations/nw/wsj/22/wsj_2231.sense,20,1,False
"Now, they have donated the fertilizer store to the Peasants Association.",donate,4,1,donate.v.01,contribute-13.2,Dynamic Possession,WN,../../Linguistic data/ontonotes-release-5.0/data/files/data/english/annotations/bc/phoenix/00/phoenix_0001.sense,24,1,False
"First, they have to remember the passenger 's order and seat number, collect the money ( and check for counterfeits ). Then heat the meal, deliver the meal... there 's more than just one type of meal, and the preparation is n't always simple.",collect,14,2,collect.v.02,obtain-13.5.2,Dynamic Possession,VN,../../Linguistic data/ontonotes-release-5.0/data/files/data/english/annotations/wb/c2e/00/c2e_0031.sense,27,1,False
"In the case of foreign manufacturers, the recycling fee would haqve a similar effect as an import duty and could be collected in the same way, but without being called a tariff.",collect,22,2,collect.v.02,obtain-13.5.2,Dynamic Possession,VN,../../Linguistic data/ontonotes-release-5.0/data/files/data/english/annotations/wb/eng/00/eng_0001.sense,57,1,False
"However, when the Chinese New Year passes, many employees, having collected their annual bonuses, want to change jobs, and this is when the market really heats up.",collect,13,2,collect.v.02,obtain-13.5.2,Dynamic Possession,VN,../../Linguistic data/ontonotes-release-5.0/data/files/data/english/annotations/mz/sinorama/10/ectb_1052.sense,63,1,False
"Also for sale are Buckingham Wile Co., which distributes Cutty Sark blended whiskey in the U.S., and Whitbread 's Atlas Peak Vineyards in California 's Napa Valley.",distribute,9,1,distribute.v.01;distribute.v.04,contribute-13.2,Dynamic Possession,WN,../../Linguistic data/ontonotes-release-5.0/data/files/data/english/annotations/nw/wsj/18/wsj_1804.sense,4,1,False
"Maryland Club also distributes tea, which fits well with P&G 's Tender Leaf brand, and hot cocoa products.",distribute,3,1,distribute.v.01;distribute.v.04,contribute-13.2,Dynamic Possession,WN,../../Linguistic data/ontonotes-release-5.0/data/files/data/english/annotations/nw/wsj/20/wsj_2073.sense,6,1,False
"They are also taking oil off the grounded tanker, but so far they 've only managed to retrieve 20,000 gallons.",retrieve,18,1,retrieve.v.01;retrieve.v.03;retrieve.v.04,obtain-13.5.2,Dynamic Possession,VN,../../Linguistic data/ontonotes-release-5.0/data/files/data/english/annotations/bn/abc/00/abc_0065.sense,13,1,False
"Because the people are Muslims and do not accept interest from their bank accounts, this interest goes to the banks.",accept,8,1,accept.v.02;accept.v.03;accept.v.05;accept.v.06;accept.v.09;accept.v.10;accept.v.11,obtain-13.5.2,Dynamic Possession,VN,../../Linguistic data/ontonotes-release-5.0/data/files/data/english/annotations/wb/p2.5_a2e/00/p2.5_a2e_0013.sense,1,1,False
"Colonel Taufiq Tarawi, a director of Palestinian intelligence was briefly detained by Israeli soldiers at a West Bank roadblock, where they confiscated an Israeli permit that grants him free movement in and out of the area.",confiscate,23,1,confiscate.v.01,steal-10.5,Transfer_of_Possession,VN,../../Linguistic data/ontonotes-release-5.0/data/files/data/english/annotations/bn/voa/01/voa_0138.sense,4,1,False
"Colonel Taffiq Terrawi, a director of Palestinian intelligence, was briefly detained by Israeli soldiers at a West Bank road block, where they confiscated an Israeli permit that grants him free movement in and out of the area.",confiscate,25,1,confiscate.v.01,steal-10.5,Transfer_of_Possession,VN,../../Linguistic data/ontonotes-release-5.0/data/files/data/english/annotations/bn/voa/01/voa_0139.sense,2,1,False
Seventeen percent reported their customers being robbed.,rob,6,2,rob.v.01,cheat-10.6.1,Transfer_of_Possession,WN,../../Linguistic data/ontonotes-release-5.0/data/files/data/english/annotations/nw/wsj/14/wsj_1450.sense,21,1,False
"""It 's hard to deal with clients this way in a service business,"" says Ralph ""Bud"" Conner, owner of the agency, which was robbed of 180 blank tickets and $ 850 last month.",rob,30,2,rob.v.01,rob-10.6.4,Transfer_of_Possession,WN,../../Linguistic data/ontonotes-release-5.0/data/files/data/english/annotations/nw/wsj/07/wsj_0730.sense,15,1,False
"To quote the highly regarded director of a privately funded drop - in center for the homeless in New York: ""If you 're homeless, you do n't sleep for fear of being robbed or murdered.",rob,35,2,rob.v.01,rob-10.6.4,Transfer_of_Possession,WN,../../Linguistic data/ontonotes-release-5.0/data/files/data/english/annotations/nw/wsj/01/wsj_0105.sense,18,1,False
A witness says Williams robbed and executed a Seven Eleven employee then made fun of the man as he died /.,rob,4,2,rob.v.01,cheat-10.6.1,Transfer_of_Possession,WN,../../Linguistic data/ontonotes-release-5.0/data/files/data/english/annotations/bc/cnn/00/cnn_0001.sense,421,1,False
He robbed and murdered and was convicted of his crimes in nineteen eighty - one /.,rob,1,2,rob.v.01,steal-10.5,Transfer_of_Possession,WN,../../Linguistic data/ontonotes-release-5.0/data/files/data/english/annotations/bc/cnn/00/cnn_0001.sense,408,1,False
The survey found that over a three - year period 22 % of the firms said employees or owners had been robbed on their way to or from work or while on the job.,rob,21,2,rob.v.01,rob-10.6.4,Transfer_of_Possession,WN,../../Linguistic data/ontonotes-release-5.0/data/files/data/english/annotations/nw/wsj/14/wsj_1450.sense,20,1,False
"Following the acquisition of R.P. Scherer by a buy - out group led by Shearson Lehman Hutton earlier this year, the maker of gelatin capsules decided to divest itself of certain of its non-encapsulating businesses.",divest,28,2,divest.v.03,deprive-10.6.2,Transfer_of_Possession,WN,../../Linguistic data/ontonotes-release-5.0/data/files/data/english/annotations/nw/wsj/00/wsj_0025.sense,1,1,False
"He takes his wash to the laundromat, where he meets a punky French girl who dupes him into providing a home for her pet piranha and then promptly steals his car and dumps it in Dieppe.",steal,29,1,steal.v.01,steal-10.5,Transfer_of_Possession,VN,../../Linguistic data/ontonotes-release-5.0/data/files/data/english/annotations/nw/wsj/24/wsj_2402.sense,33,1,False
"Some even wear army uniforms to pass themselves off as soldiers, and enter and steal from the camps.",steal,15,1,steal.v.01,steal-10.5,Transfer_of_Possession,VN,../../Linguistic data/ontonotes-release-5.0/data/files/data/english/annotations/bc/p2.5_c2e/00/p2.5_c2e_0034.sense,7,1,False
"Colorado woman wants to thank and reward the person who found her $ 7,000 ring she lost at the beach.",reward,6,1,reward.v.01;reward.v.02;reward.v.03,equip-13.4.2,Transfer_of_Possession,WN,../../Linguistic data/ontonotes-release-5.0/data/files/data/english/annotations/bn/cnn/03/cnn_0323.sense,0,1,False
The First National Bank of America will totally compensate the three Chinese enterprises for 1.850 million US dollars.,compensate,8,2,compensate.v.02;compensate.v.05;compensate.v.06,equip-13.4.2,Transfer_of_Possession,WN,../../Linguistic data/ontonotes-release-5.0/data/files/data/english/annotations/nw/xinhua/00/chtb_0086.sense,2,1,False
"A bachelor fellow named Ward, A pretty young woman, adored, He took her to dine, And he plied her with wine, And when he took her home, she was floored.",ply,21,1,ply.v.01,equip-13.4.2,Transfer_of_Possession,VN,../../Linguistic data/ontonotes-release-5.0/data/files/data/english/annotations/wb/sel/80/sel_8008.sense,0,1,False
"And then sometimes, it 's just a way to try to extort money from a successful company via lawsuit.",extort,12,1,extort.v.01;extort.v.02;extort.v.03,steal-10.5,Transfer_of_Possession,VN,../../Linguistic data/ontonotes-release-5.0/data/files/data/english/annotations/wb/sel/49/sel_4958.sense,0,1,False
"According to his official biography, he bought his first bison in 1976.",buy,,,,,Buying,,ontonotes,,,
Lee buys potatoes by the pound.,buy,,,,,Buying,,framenet,,,
I have been buying from him for over 10 years.,buy,,,,,Buying,,framenet,,,
Jon bought some expensive apples at five dollars a pound!,buy,,,,,Buying,,framenet,,,
Jess bought a coat.,buy,,,,,Buying,,framenet,,,
"Yeh recalls a "" beautiful accident "": He bought a second - hand electroplater from a Japanese and tried to plate various plastic products with chrome so as to make them more resilient.",buy,9,1,buy.v.01;buy.v.04;buy.v.03,get-13.5.1,Buying,VN,../../Linguistic data/ontonotes-release-5.0/data/files/data/english/annotations/mz/sinorama/10/ectb_1054.sense,43,2,True
"Taking hold of the opportunity, he bought a cattle ranch in America.",buy,7,1,buy.v.01;buy.v.04;buy.v.03,get-13.5.1,Buying,VN,../../Linguistic data/ontonotes-release-5.0/data/files/data/english/annotations/mz/sinorama/10/ectb_1054.sense,95,2,True
"My son was coming in late, so I booked a hotel for him in the area.",book,9,,,,Buying,,ontonotes,,,False
Seats and meals must be booked directly from Vintage Trains.,book,5,,,,Buying,,ontonotes,,,False
I just ordered pizza from panhandle pizza.,order,2,,,,Buying,,ontonotes,,,False
"The Japanese management guru Matsushita Konosuke has said, "" Do n't sell customers things they find attractive, sell them things they find useful. """,sell,12,1,sell.v.01;sell.v.02;sell.v.04;sell.v.07,give-13.1,Selling,WN,../../Linguistic data/ontonotes-release-5.0/data/files/data/english/annotations/mz/sinorama/10/ectb_1035.sense,43,2,True
Harry Potter books have been selling like hotcakes.,sell,,,,,Selling,,ontonotes,,,
She didn't want to sell shoes the rest of her life.,sell,,,,,Selling,,ontonotes,,,
His uncle sells produce.,sell,,,,,Selling,,ontonotes,,,
"But this year, our paper was sold to a land developer.",sell,,,,,Selling,,COCA via Croft et al 2021,,,
They sold off their property before they moved.,sell,,,,,Selling,,ontonotes,,,
Movies usually help to sell the video games that are based on them.,sell,,,,,Selling,,ontonotes,,,
Lee sold a textbook to Abby.,sell,,,,,Selling,,framenet (Commerce_sell),,,
"Priceline.com, the first American company to sell airline tickets directly over the Internet, surpassed the combined market capitalization of the three largest US airlines ( United, American and Delta ) after only two years of operations.",sell,7,1,sell.v.01;sell.v.02;sell.v.04;sell.v.07,give-13.1,Selling,WN,../../Linguistic data/ontonotes-release-5.0/data/files/data/english/annotations/mz/sinorama/10/ectb_1035.sense,80,2,True
They are selling oil illegally.,sell,,,,,Selling,,ontonotes,,,
Both the cases and the machines to make them sold well all over Taiwan.,sell,9,1,sell.v.01;sell.v.02;sell.v.04;sell.v.07,give-13.1,Selling,WN,../../Linguistic data/ontonotes-release-5.0/data/files/data/english/annotations/mz/sinorama/10/ectb_1054.sense,37,2,True
"Others, like broker John Mitchell, hawked a humidor bearing Madoff's name.",hawk,,,,,Selling,,ontonotes,,,
"If they go shopping for food by bike, they have to pay 20 cents for parking.",pay,12,1,pay.v.01;pay.v.05;pay.v.09;pay.v.03;pay.v.11;pay.v.10,pay-68,Payment,VN,../../Linguistic data/ontonotes-release-5.0/data/files/data/english/annotations/wb/c2e/00/c2e_0009.sense,68,1,False
"Average of top rates paid by major New York banks on primary new issues of negotiable C.D.s, usually on amounts of $ 1 million and more.",pay,4,1,pay.v.01;pay.v.05;pay.v.09;pay.v.03;pay.v.11;pay.v.10,pay-68,Payment,VN,../../Linguistic data/ontonotes-release-5.0/data/files/data/english/annotations/nw/wsj/23/wsj_2380.sense,22,1,False
"Acquirers paid premiums ranging from 1.5 % to 3.7 % for the deposits and branch systems, roughly in line with what analysts were expecting.",pay,1,1,pay.v.01;pay.v.05;pay.v.09;pay.v.03;pay.v.11;pay.v.10,pay-68,Payment,VN,../../Linguistic data/ontonotes-release-5.0/data/files/data/english/annotations/nw/wsj/23/wsj_2348.sense,7,1,False
and I knew that if I did n't pay up they would burn the car.,pay,8,1,pay.v.01;pay.v.05;pay.v.09;pay.v.03;pay.v.11;pay.v.10,pay-68,Payment,VN,../../Linguistic data/ontonotes-release-5.0/data/files/data/english/annotations/wb/eng/00/eng_0017.sense,331,1,False
Patti and Gary Thompson of New Jersey prefer Al Gore 's plan to pay off the nation 's $ 3.5 half dollar national debt.,pay,13,1,pay.v.01;pay.v.05;pay.v.09;pay.v.03;pay.v.11;pay.v.10,pay-68,Payment,VN,../../Linguistic data/ontonotes-release-5.0/data/files/data/english/annotations/bn/nbc/00/nbc_0001.sense,8,1,False
and if we have a situation where young people grow up in the world that thinks that newspapers are things you read for free online who 's going to -- who 's going to pay my travel expenses /?,pay,34,1,pay.v.01;pay.v.05;pay.v.09;pay.v.03;pay.v.11;pay.v.10,pay-68,Payment,VN,../../Linguistic data/ontonotes-release-5.0/data/files/data/english/annotations/bc/cnn/00/cnn_0008.sense,592,1,False
But salvation has come from an unlikely suitor - an Australian company called Transurban that has agreed to pay the Virginia Department of Transportation $ 522 million in exchange for a 99 - year lease of the road.,pay,18,1,pay.v.01;pay.v.05;pay.v.09;pay.v.03;pay.v.11;pay.v.10,pay-68,Payment,VN,../../Linguistic data/ontonotes-release-5.0/data/files/data/english/annotations/wb/eng/00/eng_0005.sense,91,1,False
"If we want to support students, we might adopt the idea used in other countries of offering more scholarships based on something called ""scholarship,"" rather than on the government 's idea of ""service.""",offer,17,1,offer.v.01;offer.v.02;offer.v.04;offer.v.06;offer.v.07;offer.v.11;offer.v.12,future_having-13.3,Future Having,VN,../../Linguistic data/ontonotes-release-5.0/data/files/data/english/annotations/nw/wsj/24/wsj_2407.sense,34,1,False
"Additionally, the company said it filed with the Securities and Exchange Commission for the proposed offering of 10 million shares of common stock, expected to be offered in November.",offer,28,1,offer.v.01;offer.v.02;offer.v.04;offer.v.06;offer.v.07;offer.v.11;offer.v.12,future_having-13.3,Future Having,VN,../../Linguistic data/ontonotes-release-5.0/data/files/data/english/annotations/nw/wsj/23/wsj_2340.sense,6,1,False
"The cafeteria offered donated croissants and brie for breakfast, and for dinner, pasta salad and chocolate mousse torts along with the salmon.",offer,2,1,offer.v.01;offer.v.02;offer.v.04;offer.v.06;offer.v.07;offer.v.11;offer.v.12,future_having-13.3,Future Having,VN,../../Linguistic data/ontonotes-release-5.0/data/files/data/english/annotations/nw/wsj/14/wsj_1435.sense,13,1,False
"Because the CD had an effective yield of 13.4 % when it was issued in 1984, and interest rates in general had declined sharply since then, part of the price Dr. Blumenfeld paid was a premium -- an additional amount on top of the CD 's base value plus accrued interest that represented the CD 's increased market value.",issue,13,1,issue.v.01;issue.v.02;issue.v.03;issue.v.05,future_having-13.3,Future Having,WN,../../Linguistic data/ontonotes-release-5.0/data/files/data/english/annotations/nw/wsj/12/wsj_1273.sense,11,1,False
"All told, the federal government already guarantees more than $ 900 billion of mortgages.",guarantee,7,1,guarantee.v.01;guarantee.v.03;guarantee.v.04,future_having-13.3,Future Having,VN,../../Linguistic data/ontonotes-release-5.0/data/files/data/english/annotations/nw/wsj/22/wsj_2227.sense,21,1,False
"This is a sign that there was good in him otherwise he would not have ordered the killing of his son, his own child.",order,15,1,order.v.01;order.v.03;order.v.04,order-58.3,Request,WN,../../Linguistic data/ontonotes-release-5.0/data/files/data/english/annotations/wb/a2e/00/a2e_0019.sense,12,1,False
Mr. Fried also is the managing partner of Albert Fried & Co.,manage,5,2,manage.v.02;manage.v.04,supervision-95.2.2,Membership,WN,../../Linguistic data/ontonotes-release-5.0/data/files/data/english/annotations/nw/wsj/12/wsj_1224.sense,2,1,False
"Meanwhile, American Health Partners, publisher of American Health magazine, is deep in debt, and Owen Lipstein, founder and managing partner, is being forced to sell the magazine to Reader 's Digest Association Inc.",manage,23,2,manage.v.02;manage.v.04,supervision-95.2.2,Membership,WN,../../Linguistic data/ontonotes-release-5.0/data/files/data/english/annotations/nw/wsj/12/wsj_1264.sense,17,1,False
I you know I think it was a wake - up call particularly for those Republicans that campaign like Ronald Reagan and then govern like Mike Dukakis /.,govern,23,1,govern.v.01;govern.v.03,supervision-95.2.2,Membership,WN,../../Linguistic data/ontonotes-release-5.0/data/files/data/english/annotations/bc/msnbc/00/msnbc_0004.sense,137,1,False
I expect she would govern Qatar --,govern,4,1,govern.v.01;govern.v.03,supervision-95.2.2,Membership,WN,../../Linguistic data/ontonotes-release-5.0/data/files/data/english/annotations/wb/a2e/00/a2e_0021.sense,47,1,False
"Huaqing Liu, vice president of the Military Commission of the CCP, Wannian Zhang, Military Commission member, Yongbo Yu, Quanyou Fu and leaders of the three headquarters of the PLA and the Central Office of the Military Commission attended the meeting.",attend,42,1,attend.v.01,attend-107.4,Membership,WN,../../Linguistic data/ontonotes-release-5.0/data/files/data/english/annotations/nw/xinhua/02/chtb_0290.sense,7,1,False
President Clinton plans to attend.,attend,4,1,attend.v.01,attend-107.4,Membership,WN,../../Linguistic data/ontonotes-release-5.0/data/files/data/english/annotations/bn/cnn/00/cnn_0036.sense,5,1,False
"Her Highness Princess Takamado, member of the Japanese Imperial Household, took a special trip to attend the ceremony; speakers of both the Senate and the House of Representatives came in person to celebrate the event; and more than 70 members of both the Senate and the Houses of Representatives found time in their busy schedules to come; just name a few highlights.",attend,17,1,attend.v.01,attend-107.4,Membership,WN,../../Linguistic data/ontonotes-release-5.0/data/files/data/english/annotations/nw/p2.5_c2e/00/p2.5_c2e_0027.sense,4,1,False
"With membership of the Church of England steadily dwindling, strong - willed vicars are pressing equally strong - willed and often non-religious ringers to attend services.",attend,25,1,attend.v.01,attend-107.4,Membership,WN,../../Linguistic data/ontonotes-release-5.0/data/files/data/english/annotations/nw/wsj/00/wsj_0089.sense,37,1,False
"The Beijing Association warmly welcomes all members, along with any friends who love Beijing and love the Beijing Association, to attend the "" Golden Pig Good Luck "" Spring Festival Party.",attend,22,1,attend.v.01,attend-107.4,Membership,WN,../../Linguistic data/ontonotes-release-5.0/data/files/data/english/annotations/wb/c2e/00/c2e_0038.sense,17,1,False
Thus we gained a great deal from attending.,attend,7,1,attend.v.01,attend-107.4,Membership,WN,../../Linguistic data/ontonotes-release-5.0/data/files/data/english/annotations/mz/sinorama/10/ectb_1032.sense,19,1,False
"To assure the livelihood of the local Atayal aborigines of Chilan, when the cypress national park is set up consideration will have to be given to how to balance the need to protect the forests with the demand for sustainable tourism.",protect,33,1,protect.v.01,defend-72.3,Protection,WN,../../Linguistic data/ontonotes-release-5.0/data/files/data/english/annotations/mz/sinorama/10/ectb_1070.sense,106,2,True
Those other branches of government are functioning to protect us from abuses by the executive branch /.,protect,8,1,protect.v.01,defend-72.3,Protection,WN,../../Linguistic data/ontonotes-release-5.0/data/files/data/english/annotations/bc/msnbc/00/msnbc_0006.sense,791,2,True
