sentence,verb_lemma,verb_token_idx,on_sense,wn_synsets,vn_class,situation,match_path,source_file,sentence_idx,situation_count,needs_review
"In the industrial age, capitalists who commanded the wealth to buy machinery and hire workers, or who owned critical resources like coal and oil, replaced landowners as the dominant figures in the economy.",own,19,1,own.v.01,own-100.1,Possession,WN,../../Linguistic data/ontonotes-release-5.0/data/files/data/english/annotations/mz/sinorama/10/ectb_1042.sense,25,1,False
She has owned the painting since her grandmother's passing.,own,2,,,,Possession,synthetic,,,,False
"I own a Panasonic 42 "" THPHD7UY commercial plasma I got over 2.5 years ago for HD viewing, which incidentally replaced a then 10 year 27 "" Trinitron.",own,1,1,own.v.01,own-100.1,Possession,WN,../../Linguistic data/ontonotes-release-5.0/data/files/data/english/annotations/wb/sel/12/sel_1213.sense,0,1,False
Ray Hyde - My comments were directed at investors who lobby to place roads near where they own property and the incompetent system that funds these requests without regard to their link or lack thereof to a master transportation plan.,own,17,1,own.v.01,own-100.1,Possession,WN,../../Linguistic data/ontonotes-release-5.0/data/files/data/english/annotations/wb/eng/00/eng_0003.sense,99,1,False
reminder I own this group!,own,2,1,own.v.01,own-100.1,Possession,WN,../../Linguistic data/ontonotes-release-5.0/data/files/data/english/annotations/wb/sel/12/sel_1218.sense,0,1,False
"To assure the livelihood of the local Atayal aborigines of Chilan, when the cypress national park is set up consideration will have to be given to how to balance the need to protect the forests with the demand for sustainable tourism.",protect,33,1,protect.v.01,defend-72.3,Protection,WN,../../Linguistic data/ontonotes-release-5.0/data/files/data/english/annotations/mz/sinorama/10/ectb_1070.sense,106,2,True
That 's not the question I asked you.,ask,6,1,ask.v.01;ask.v.03;ask.v.05,inquire-37.1.2,Communicate,VN,../../Linguistic data/ontonotes-release-5.0/data/files/data/english/annotations/bn/cnn/04/cnn_0425.sense,8,1,False
"Paul, let me ask you, if I may, quickly, are we expecting -- is there any reason for us to expect that there would be the ability to identify those remains as a result of these autopsies this afternoon?",ask,4,1,ask.v.01;ask.v.03;ask.v.05,inquire-37.1.2,Communicate,VN,../../Linguistic data/ontonotes-release-5.0/data/files/data/english/annotations/bn/cnn/02/cnn_0288.sense,25,1,False
Through this mechanism no ministry will be allowed to ask annually for an increase in its budget if it does n't submit a report showing where and how of the money was spent.,ask,9,2,ask.v.02;ask.v.04,urge-58.1,Request,VN,../../Linguistic data/ontonotes-release-5.0/data/files/data/english/annotations/wb/a2e/00/a2e_0008.sense,29,1,False
"In a minute we 'll ask Linda what happened to bring it to a head, how she turned a corner /.",ask,5,1,ask.v.01;ask.v.03;ask.v.05,inquire-37.1.2,Communicate,VN,../../Linguistic data/ontonotes-release-5.0/data/files/data/english/annotations/bc/cnn/00/cnn_0003.sense,210,1,False
She asked him for advice.,ask,,,,,Request,,"Kalm 2022, p. 198ff",,,
"This is a sign that there was good in him otherwise he would not have ordered the killing of his son, his own child.",order,15,1,order.v.01;order.v.03;order.v.04,order-58.3,Request,WN,../../Linguistic data/ontonotes-release-5.0/data/files/data/english/annotations/wb/a2e/00/a2e_0019.sense,12,1,False
"The daughter - in - law, played by Chang Yu - yen, is mistreated by her mother - in - law, and, with outsiders butting in and causing trouble, she gets abused from beginning to end.",abuse,36,1,abuse.v.01;abuse.v.02;abuse.v.03;abuse.v.04,judgment-33.1,Aggression,WN,../../Linguistic data/ontonotes-release-5.0/data/files/data/english/annotations/mz/sinorama/10/ectb_1006.sense,75,2,True
Chang Yu - yen ( right ) plays a much - abused daughter - in - law in the series The Astonishing Daughter - in - Law.,abuse,11,1,abuse.v.01;abuse.v.02;abuse.v.03;abuse.v.04,judgment-33.1,Aggression,WN,../../Linguistic data/ontonotes-release-5.0/data/files/data/english/annotations/mz/sinorama/10/ectb_1006.sense,196,2,True
"The Vice Premier of the State Council, Jiahua Zou, attended the ribbon cutting ceremony held today for the start of operations.",attend,11,1,attend.v.01,attend-107.4,Membership,WN,../../Linguistic data/ontonotes-release-5.0/data/files/data/english/annotations/nw/xinhua/00/chtb_0038.sense,2,1,False
President Clinton plans to attend.,attend,4,1,attend.v.01,attend-107.4,Membership,WN,../../Linguistic data/ontonotes-release-5.0/data/files/data/english/annotations/bn/cnn/00/cnn_0036.sense,5,1,False
"While all this is going on, the Republican leaders of Florida 's legislature begin a special session Friday, to appoint the state 's 25 electors, a move designed to ensure that George W Bush is guaranteed enough electoral votes to win the White House.",appoint,21,1,appoint.v.01;appoint.v.02,appoint-29.1,Cause Participation,VN,../../Linguistic data/ontonotes-release-5.0/data/files/data/english/annotations/bn/voa/01/voa_0148.sense,8,1,False
"President Bush must appoint two other members, one a Democrat and one a Republican.",appoint,3,1,appoint.v.01;appoint.v.02,appoint-29.1,Cause Participation,VN,../../Linguistic data/ontonotes-release-5.0/data/files/data/english/annotations/nw/wsj/12/wsj_1299.sense,4,1,False
"They do n't know when to expect him back, and have been told he faces lots of questions.",face,15,1,face.v.01;face.v.06,confront-98,Response,VN,../../Linguistic data/ontonotes-release-5.0/data/files/data/english/annotations/bn/cnn/03/cnn_0313.sense,3,1,False
And a few Americans -- namely those with high incomes -- face much lower taxes than they did a generation ago.,face,11,1,face.v.01;face.v.06,confront-98,Response,VN,../../Linguistic data/ontonotes-release-5.0/data/files/data/english/annotations/wb/sel/07/sel_0753.sense,0,1,False
"Mr. Jobs said the changes were prompted by requests from customers who are frustrated with the performance of the optical device, which is n't offered as standard equipment by any rivals.",prompt,6,1,prompt.v.01;prompt.v.02,stimulate-59.4,Induction,WN,../../Linguistic data/ontonotes-release-5.0/data/files/data/english/annotations/nw/wsj/19/wsj_1971.sense,12,1,False
The criminals were put away.,put,,,,,Cause Membership,,ontonotes,,,
Her big brother always bullied her when she was young.,bully,,,,,Aggression,,ontonotes,,,
"Salim said that he had suffered a shortfall of 36,000 Riyals in the course of just one week as a result of the lack of customers buying vegetables following the price increase, in addition to having to pay out 100 Riyals in daily wages to five Saudi workers and 100 to foreign workers who carry the goods and are employed by the company which manages the market.",manage,65,2,manage.v.02;manage.v.04,supervision-95.2.2,Membership,WN,../../Linguistic data/ontonotes-release-5.0/data/files/data/english/annotations/wb/p2.5_a2e/00/p2.5_a2e_0024.sense,6,1,False
The book belongs to him.,belong,,,,,Possession,,"Kalm 2022, p. 107ff",,,
The title remained theirs until the lawsuit.,remain,2,,,,Possession,synthetic,,,,False
The scar is hers alone.,be,2,,,,Possession,synthetic,,,,False
"Three members of Solace, including superstar fiddler Winfred Horan are Irish Americans, the remaining two are Irish transplants living in New York City.",remain,15,2,remain.v.03,exist-47.1,Existence,WN,../../Linguistic data/ontonotes-release-5.0/data/files/data/english/annotations/bn/pri/00/pri_0037.sense,6,1,False
""" Or the one in which she and Josh are stranded in the city, and, after insisting on separate motel rooms, she knocks on his door to pour out her feelings about the rape -- wearing nothing but a mini-slip and a push - up bra.",knock,25,2,knock.v.02;knock.v.04;knock.v.05,hit-18.1,Contact,WN,../../Linguistic data/ontonotes-release-5.0/data/files/data/english/annotations/nw/wsj/05/wsj_0526.sense,40,1,False
He drove the car.,drive,,,,,Manipulation,,"Croft et al 2021, p. 92f",,,
The boat cut through the water.,cut,,,,,Motion,,ontonotes,,,
The river cuts through the valley.,cut,,,,,Motion,,ontonotes,,,
She accompanied her friend to the hospital.,accompany,,,,,Pursuit,,"Croft et al 2021, p. 71f",,,
"She gives before - school tutoring to students who need extra help learning to read, and volunteers on school committees after hours.",need,9,1,need.v.01;need.v.02;need.v.03,want-32.1,Desire,WN,../../Linguistic data/ontonotes-release-5.0/data/files/data/english/annotations/bn/cnn/03/cnn_0324.sense,31,1,False
"Anyway, there 's no harm in giving it a try yourself, and you may find your own answer.",find,16,1,find.v.01;find.v.02;find.v.03;find.v.06;find.v.07;find.v.08;find.v.09;find.v.12;find.v.13;find.v.14;find.v.15;find.v.16,discover-84,Discovery,WN,../../Linguistic data/ontonotes-release-5.0/data/files/data/english/annotations/mz/sinorama/10/ectb_1056.sense,38,3,True
Steve tossed John the ball.,toss,,,,,Throwing,,verbnet (throw-17.1),,,
"There was a famous British psychologist named Ellis in the last century, who encouraged people to learn a special, reasonable and healthy way of thinking by reading professional books, organizing group discussions and doing specific training in thinking, in order to deal with emotional problems caused by stresses.",learn,17,1,learn.v.01;learn.v.03;learn.v.04,learn-14,Learning,WN,../../Linguistic data/ontonotes-release-5.0/data/files/data/english/annotations/wb/c2e/00/c2e_0042.sense,8,1,False
"By day she dragged herself to work like a zombie, but in the middle of the night she would wake with a start, her heart pounding so hard she could n't breathe.",breathe,33,1,breathe.v.01;breathe.v.02,breathe-40.1.2,Emission,WN,../../Linguistic data/ontonotes-release-5.0/data/files/data/english/annotations/mz/sinorama/10/ectb_1068.sense,82,1,False
"In fact, Aer Lingus started ferrying Russians from Shannon to New York when Washington stripped Aeroflot of its U.S. landing rights.",ferry,6,1,ferry.v.01;ferry.v.02;ferry.v.03,drive-11.5,Vehicular_Motion,WN,../../Linguistic data/ontonotes-release-5.0/data/files/data/english/annotations/nw/wsj/21/wsj_2151.sense,44,1,False
I weighed the package.,weigh,,,,,Measurement,,"Levin 1993, Register-54.1",,,
"Walt Disney Co. 's Disneyland in Anaheim, Calif., stocks rescue equipment, medical supplies, and enough food and water to feed at least 10,000 visitors for as long as five days in the event that a calamity isolates the theme park.",feed,23,1,feed.v.01;feed.v.02;feed.v.11,feeding-39.7,Feeding,VN,../../Linguistic data/ontonotes-release-5.0/data/files/data/english/annotations/nw/wsj/16/wsj_1691.sense,37,1,False
One other Major League baseball manager is now looking for a new team to lead.,look,8,1,look.v.01;look.v.04,peer-30.3,Intention,WN,../../Linguistic data/ontonotes-release-5.0/data/files/data/english/annotations/bn/voa/00/voa_0026.sense,0,1,False
"Following World War II, when one family with mechanized equipment could farm crops formerly requiring 20 families, the surplus people were dumped into the mainstream of society with no Social Security, no skills in the workplace, no hope for their future except welfare.",farm,12,1,farm.v.01;farm.v.03,rear-26.2.2,Form,WN,../../Linguistic data/ontonotes-release-5.0/data/files/data/english/annotations/nw/wsj/06/wsj_0687.sense,6,1,False
It ruled that recounts submitted to state officials after a filing deadline had passed had to be counted.,count,17,1,count.v.01;count.v.04,multiply-108,Counting,WN,../../Linguistic data/ontonotes-release-5.0/data/files/data/english/annotations/bn/cnn/01/cnn_0113.sense,21,1,False
Dice the butter and rub into the flour until it resembles fine breadcrumbs.,dice,,,,,Cause Change of State,,framenet,,,
Karl carried the books to the library.,carry,,,,,Carrying,,framenet,,,
"On July 22, 1940, a campaign preparation order to attack the Zhengtai Railway, jointly signed by Zhu De, Peng Dehuai, and Zuo Quan, was sent to Yan'an and all units of the Eighth Route Army.",send,30,1,send.v.02;send.v.03;send.v.04;send.v.06;send.v.08,send-11.1,Sending,WN,../../Linguistic data/ontonotes-release-5.0/data/files/data/english/annotations/bc/cctv/00/cctv_0001.sense,38,1,False
"In most cases, this means you 're actually eating the fruit of the plants, rather than getting down on your hands and knees to graze on the green stuff.",graze,26,1,graze.v.01;graze.v.03;graze.v.05,dine-39.5,Ingestion,VN,../../Linguistic data/ontonotes-release-5.0/data/files/data/english/annotations/wb/sel/58/sel_5812.sense,0,1,False
"Now, he is making a trip and you see him there with his hands raised, there with the cloak on, shaking his fists, hands clasped there, in a salute to the crowd.",make,4,2,make.v.03;make.v.05;make.v.06;make.v.09;make.v.15;make.v.17;make.v.18;make.v.23;make.v.39;make.v.38,build-26.1,Cause Creation,WN,../../Linguistic data/ontonotes-release-5.0/data/files/data/english/annotations/bn/cnn/03/cnn_0346.sense,2,1,False
Flute player Shamus Eagan comes from Pennsylvania.,come,4,5,come.v.05;come.v.07;come.v.08;come.v.18,appear-48.1.1,Location,VN,../../Linguistic data/ontonotes-release-5.0/data/files/data/english/annotations/bn/pri/00/pri_0037.sense,11,1,False
"Most of the 34 sailors hurt, are being reunited with family in Norfolk, Virginia, before moving on to a naval hospital for further treatment.",hurt,5,1,hurt.v.01;hurt.v.02;hurt.v.06;hurt.v.07,hurt-40.8.3,Hurt,WN,../../Linguistic data/ontonotes-release-5.0/data/files/data/english/annotations/bn/cnn/00/cnn_0036.sense,2,1,False
This incident of observing of the comet colliding with Jupiter possesses extremely important significance in researching and forecasting comets colliding with Earth.,collide,19,1,collide.v.03;collide.v.02,bump-18.4,Contact,WN,../../Linguistic data/ontonotes-release-5.0/data/files/data/english/annotations/nw/xinhua/02/chtb_0287.sense,3,1,False
"When stamps have risen in value to a certain degree, even if you ask someone to, he wo n't use stamps that are worth more than their face value as postage.",use,21,1,use.v.01;use.v.04;use.v.05,use-105.1,Manipulation,WN,../../Linguistic data/ontonotes-release-5.0/data/files/data/english/annotations/wb/c2e/00/c2e_0043.sense,72,1,False
The police chased the suspect down the street.,chase,,,,,Pursuit,,"Croft et al 2021, p. 71f",,,
I want you all to be quiet!,want,,,,,Desire,,synthetic,,,
"Coming up, a new gallop poll shows a big lead for both John McCain and Rudy Giuliani in presidential matchups with guess who Hillary Rodham Clinton /.",guess,22,2,guess.v.02;guess.v.03;guess.v.04,discover-84,Discovery,WN,../../Linguistic data/ontonotes-release-5.0/data/files/data/english/annotations/bc/msnbc/00/msnbc_0004.sense,414,1,False
I 'm certain that neither a.m. or myself will ever lose the sharp frozen second as 'Nita put her head under water and then threw it back with her long hair and an arc of water saying youth and grace in perfect agreement.,throw,24,1,throw.v.01;throw.v.02;throw.v.04;throw.v.05;throw.v.08;throw.v.10;throw.v.13;throw.v.14,throw-17.1,Throwing,WN,../../Linguistic data/ontonotes-release-5.0/data/files/data/english/annotations/wb/eng/00/eng_0017.sense,43,1,False
