sentence,verb_lemma,verb_token_idx,on_sense,wn_synsets,vn_class,situation,match_path,source_file,sentence_idx,situation_count,needs_review
Those other branches of government are functioning to protect us from abuses by the executive branch /.,protect,8,1,protect.v.01,defend-72.3,Protection,WN,../../Linguistic data/ontonotes-release-5.0/data/files/data/english/annotations/bc/msnbc/00/msnbc_0006.sense,791,2,True
I expect she would govern Qatar --,govern,4,1,govern.v.01;govern.v.03,supervision-95.2.2,Membership,WN,../../Linguistic data/ontonotes-release-5.0/data/files/data/english/annotations/wb/a2e/00/a2e_0021.sense,47,1,False
I would n't quote you even as an anonymous source /.,quote,3,1,quote.v.01;quote.v.04,transfer_mesg-37.1.1,Communicate,WN,../../Linguistic data/ontonotes-release-5.0/data/files/data/english/annotations/bc/cnn/00/cnn_0007.sense,136,1,False
She asked him for advice.,ask,,,,,Request,,"Kalm 2022, p. 198ff",,,
"During negotiations with American officials in May 1988 over proposals to drop the U.S. indictments in exchange for his resignation, Mr. Noriega often asked almost plaintively how the Americans, whom he had helped for so many years, could turn against him.",ask,24,1,ask.v.01;ask.v.03;ask.v.05,inquire-37.1.2,Communicate,VN,../../Linguistic data/ontonotes-release-5.0/data/files/data/english/annotations/nw/wsj/20/wsj_2013.sense,157,1,False
That 's not the question I asked you.,ask,6,1,ask.v.01;ask.v.03;ask.v.05,inquire-37.1.2,Communicate,VN,../../Linguistic data/ontonotes-release-5.0/data/files/data/english/annotations/bn/cnn/04/cnn_0425.sense,8,1,False
"In a minute we 'll ask Linda what happened to bring it to a head, how she turned a corner /.",ask,5,1,ask.v.01;ask.v.03;ask.v.05,inquire-37.1.2,Communicate,VN,../../Linguistic data/ontonotes-release-5.0/data/files/data/english/annotations/bc/cnn/00/cnn_0003.sense,210,1,False
"Really now, did she have to ask?",ask,7,1,ask.v.01;ask.v.03;ask.v.05,inquire-37.1.2,Communicate,VN,../../Linguistic data/ontonotes-release-5.0/data/files/data/english/annotations/nw/wsj/14/wsj_1412.sense,4,1,False
They asked him how many times he 's used it during batting practice and he says three or four times.,ask,1,1,ask.v.01;ask.v.03;ask.v.05,inquire-37.1.2,Communicate,VN,../../Linguistic data/ontonotes-release-5.0/data/files/data/english/annotations/bn/cnn/03/cnn_0383.sense,32,1,False
"When he was through, the court members asked many questions, then the chairman said they would like to hear his manager 's side and talk to witnesses.",ask,8,1,ask.v.01;ask.v.03;ask.v.05,inquire-37.1.2,Communicate,VN,../../Linguistic data/ontonotes-release-5.0/data/files/data/english/annotations/nw/wsj/15/wsj_1504.sense,10,1,False
"Jim, I ask, what is victory?",ask,3,1,ask.v.01;ask.v.03;ask.v.05,inquire-37.1.2,Communicate,VN,../../Linguistic data/ontonotes-release-5.0/data/files/data/english/annotations/wb/eng/00/eng_0004.sense,61,1,False
"On Capitol Hill today, senators were asking the general who sent the ""USS Cole"" into the port of Aden in Yemen, why he made that decision.",ask,7,1,ask.v.01;ask.v.03;ask.v.05,inquire-37.1.2,Communicate,VN,../../Linguistic data/ontonotes-release-5.0/data/files/data/english/annotations/bn/abc/00/abc_0016.sense,2,1,False
He reacted to the situation as a coward.,react,,,,,Response,,"Kalm 2022, p. 205ff",,,
"Palestinians are burying their dead in Gaza, the latest victims in a month of fighting with Israeli troops.",fight,15,1,fight.v.01;fight.v.02,battle-36.4,Reciprocal,VN,../../Linguistic data/ontonotes-release-5.0/data/files/data/english/annotations/bn/cnn/00/cnn_0077.sense,2,1,False
"He was speaking in front of invitees to his office at 10 Downing Street in London and said, "" The immigrant 's right to live within a multicultural society is always balanced by his duty to integrate, to be part of Britain, to be Asian British, black British, or white British. """,say,17,1,say.v.01;say.v.02;say.v.09;say.v.08;say.v.05;say.v.10,say-37.7,Statement,WN,../../Linguistic data/ontonotes-release-5.0/data/files/data/english/annotations/nw/p2.5_a2e/00/p2.5_a2e_0034.sense,1,1,False
"With membership of the Church of England steadily dwindling, strong - willed vicars are pressing equally strong - willed and often non-religious ringers to attend services.",attend,25,1,attend.v.01,attend-107.4,Membership,WN,../../Linguistic data/ontonotes-release-5.0/data/files/data/english/annotations/nw/wsj/00/wsj_0089.sense,37,1,False
"The report, which comes 25 years after the U.S. Surgeon General issued a report warning against the dangers of smoking, is the strongest indication to date that the reduction in smoking is leading to lower death rates from lung cancer.",warn,15,1,warn.v.01;warn.v.02;warn.v.03;warn.v.04,advise-37.9,Communicate,VN,../../Linguistic data/ontonotes-release-5.0/data/files/data/english/annotations/nw/wsj/20/wsj_2017.sense,3,1,False
The ambassador warned the minister of unrest in the capital.,warn,2,,,,Communicate,synthetic,,,,False
"On the eve of the handover, the signboard of the Taipei Trade and Tourism Office in Macau was quietly taken down, after the office had been privately warned to remove the sign before the transfer of sovereignty.",warn,29,1,warn.v.01;warn.v.02;warn.v.03;warn.v.04,advise-37.9,Communicate,VN,../../Linguistic data/ontonotes-release-5.0/data/files/data/english/annotations/mz/sinorama/10/ectb_1001.sense,29,1,False
Secondly it is absolutely a misrepresentation that they told us before just the week before /.,tell,8,1,tell.v.01;tell.v.02;tell.v.03;tell.v.04;tell.v.06,transfer_mesg-37.1.1,Communicate,WN,../../Linguistic data/ontonotes-release-5.0/data/files/data/english/annotations/bc/cnn/00/cnn_0008.sense,305,1,False
"Well, when someone does n't read the newspapers and does n't know anything about the wider world, and just accepts whatever close aides tell him, then he might easily believe 10 impossible things before breakfast.",tell,25,1,tell.v.01;tell.v.02;tell.v.03;tell.v.04;tell.v.06,transfer_mesg-37.1.1,Communicate,WN,../../Linguistic data/ontonotes-release-5.0/data/files/data/english/annotations/wb/sel/20/sel_2058.sense,0,1,False
A traveling reporter now on leave and joins us to tell her story.,tell,10,1,tell.v.01;tell.v.02;tell.v.03;tell.v.04;tell.v.06,transfer_mesg-37.1.1,Communicate,WN,../../Linguistic data/ontonotes-release-5.0/data/files/data/english/annotations/bn/cnn/03/cnn_0380.sense,8,1,False
"I told them, "" Inform the search point to check them. """,tell,1,1,tell.v.01;tell.v.02;tell.v.03;tell.v.04;tell.v.06,transfer_mesg-37.1.1,Communicate,WN,../../Linguistic data/ontonotes-release-5.0/data/files/data/english/annotations/wb/a2e/00/a2e_0005.sense,22,1,False
An emergency official tells CNN that ten people died there.,tell,3,1,tell.v.01;tell.v.02;tell.v.03;tell.v.04;tell.v.06,transfer_mesg-37.1.1,Communicate,WN,../../Linguistic data/ontonotes-release-5.0/data/files/data/english/annotations/bn/cnn/03/cnn_0331.sense,16,1,False
I 'm not -- and I 'm not questioning -- I 'm n- -- I did n't mean to be suggesting he 's not going to tell the truth /.,tell,26,1,tell.v.01;tell.v.02;tell.v.03;tell.v.04;tell.v.06,transfer_mesg-37.1.1,Communicate,WN,../../Linguistic data/ontonotes-release-5.0/data/files/data/english/annotations/bc/msnbc/00/msnbc_0001.sense,405,1,False
Ivanov says he told Milosevic Yugoslavia needs a peaceful transition of power.,tell,3,1,tell.v.01;tell.v.02;tell.v.03;tell.v.04;tell.v.06,transfer_mesg-37.1.1,Communicate,WN,../../Linguistic data/ontonotes-release-5.0/data/files/data/english/annotations/bn/cnn/00/cnn_0013.sense,7,1,False
"Lee Kuan Yew told me that he found that his country spoke many languages, so he decided that the first step is for people to communicate in one language, so he made English the country 's official language.",tell,3,1,tell.v.01;tell.v.02;tell.v.03;tell.v.04;tell.v.06,transfer_mesg-37.1.1,Communicate,WN,../../Linguistic data/ontonotes-release-5.0/data/files/data/english/annotations/nw/p2.5_a2e/00/p2.5_a2e_0002.sense,7,1,False
"Before I tell you how big those parachutes are, let me tell you what the U.S. Treasury Secretary is saying about it now.",tell,12,1,tell.v.01;tell.v.02;tell.v.03;tell.v.04;tell.v.06,transfer_mesg-37.1.1,Communicate,WN,../../Linguistic data/ontonotes-release-5.0/data/files/data/english/annotations/bn/cnn/04/cnn_0400.sense,6,1,False
Alright tell me about this unusual book a collection of memories and interviews a great memoir that also has a DVD /.,tell,1,1,tell.v.01;tell.v.02;tell.v.03;tell.v.04;tell.v.06,transfer_mesg-37.1.1,Communicate,WN,../../Linguistic data/ontonotes-release-5.0/data/files/data/english/annotations/bc/cnn/00/cnn_0004.sense,247,1,False
They should be told that we will have to reconsider our position if you do n't live up to your time table including including the withdrawal of American forces /.,tell,3,1,tell.v.01;tell.v.02;tell.v.03;tell.v.04;tell.v.06,transfer_mesg-37.1.1,Communicate,WN,../../Linguistic data/ontonotes-release-5.0/data/files/data/english/annotations/bc/cnn/00/cnn_0005.sense,331,1,False
"His father inquires, & quot; What kind of job could you have in the army? & quot;",inquire,2,1,inquire.v.01;inquire.v.02,inquire-37.1.2,Communicate,VN,../../Linguistic data/ontonotes-release-5.0/data/files/data/english/annotations/wb/sel/66/sel_6694.sense,0,1,False
Police now say the wife is being questioned as a possible suspect /.,question,7,1,question.v.02;question.v.03;question.v.04,interrogate-37.1.3,Communicate,WN,../../Linguistic data/ontonotes-release-5.0/data/files/data/english/annotations/bc/msnbc/00/msnbc_0002.sense,439,1,False
"When stamps have risen in value to a certain degree, even if you ask someone to, he wo n't use stamps that are worth more than their face value as postage.",use,21,1,use.v.01;use.v.04;use.v.05,use-105.1,Manipulation,WN,../../Linguistic data/ontonotes-release-5.0/data/files/data/english/annotations/wb/c2e/00/c2e_0043.sense,72,1,False
He drove the car.,drive,,,,,Manipulation,,"Croft et al 2021, p. 92f",,,
One press of this button will send off missiles toward our enemies.,send,,,,,Sending,,ontonotes (send-v sense 3),,,
Karl hauled the books from the library to the office.,haul,,,,,Carrying,,framenet,,,
I weighed the package.,weigh,,,,,Measurement,,"Levin 1993, Register-54.1",,,
We had heard a few months ago about some theories on how the submarine could be raised.,raise,16,2,raise.v.02;raise.v.08;raise.v.20;raise.v.24,put_direction-9.4,Pick_Up_and_Drop_Off,WN,../../Linguistic data/ontonotes-release-5.0/data/files/data/english/annotations/bn/pri/01/pri_0106.sense,21,3,True
"Follow a few paces behind him, spraying everything he touches with a can of disinfectant.",touch,10,1,touch.v.01;touch.v.02;touch.v.08;touch.v.11;touch.v.13;touch.v.14,touch-20,Contact,WN,../../Linguistic data/ontonotes-release-5.0/data/files/data/english/annotations/wb/sel/34/sel_3446.sense,0,1,False
The guide led the tourists through the museum.,lead,,,,,Pursuit,,"Croft et al 2021, p. 71f",,,
Steve tossed John the ball.,toss,,,,,Throwing,,verbnet (throw-17.1),,,
Five years probation for killing her 4 - year - old by scalding it to death in the bathtub.,scald,12,1,scald.v.02;scald.v.03;scald.v.04,hurt-40.8.3,Hurt,WN,../../Linguistic data/ontonotes-release-5.0/data/files/data/english/annotations/bn/cnn/02/cnn_0247.sense,21,2,True
"She gives before - school tutoring to students who need extra help learning to read, and volunteers on school committees after hours.",need,9,1,need.v.01;need.v.02;need.v.03,want-32.1,Desire,WN,../../Linguistic data/ontonotes-release-5.0/data/files/data/english/annotations/bn/cnn/03/cnn_0324.sense,31,1,False
Flute player Shamus Eagan comes from Pennsylvania.,come,4,5,come.v.05;come.v.07;come.v.08;come.v.18,appear-48.1.1,Location,VN,../../Linguistic data/ontonotes-release-5.0/data/files/data/english/annotations/bn/pri/00/pri_0037.sense,11,1,False
"And a couple of years later, somebody bright a White Bros kayak to the pool chass, and I saw it and said & quot; I 've got to paddle this thing! & quot;",paddle,31,1,,nonvehicle-51.4.2,Vehicular_Motion,VN,../../Linguistic data/ontonotes-release-5.0/data/files/data/english/annotations/wb/sel/75/sel_7590.sense,0,1,False
"Still bleeding, he ran downstairs and scooped up the baby, and took the baby to the hospital.",bleed,1,1,bleed.v.01,substance_emission-43.4,Emission,VN,../../Linguistic data/ontonotes-release-5.0/data/files/data/english/annotations/bn/cnn/02/cnn_0241.sense,21,1,False
"Walt Disney Co. 's Disneyland in Anaheim, Calif., stocks rescue equipment, medical supplies, and enough food and water to feed at least 10,000 visitors for as long as five days in the event that a calamity isolates the theme park.",feed,23,1,feed.v.01;feed.v.02;feed.v.11,feeding-39.7,Feeding,VN,../../Linguistic data/ontonotes-release-5.0/data/files/data/english/annotations/nw/wsj/16/wsj_1691.sense,37,1,False
"Now, he is making a trip and you see him there with his hands raised, there with the cloak on, shaking his fists, hands clasped there, in a salute to the crowd.",make,4,2,make.v.03;make.v.05;make.v.06;make.v.09;make.v.15;make.v.17;make.v.18;make.v.23;make.v.39;make.v.38,build-26.1,Cause Creation,WN,../../Linguistic data/ontonotes-release-5.0/data/files/data/english/annotations/bn/cnn/03/cnn_0346.sense,2,1,False
"In southern Iraq today, British forces also moving closer to the center of the second largest city in Iraq, Basra.",move,8,1,move.v.01;move.v.02;move.v.03;move.v.05;move.v.07;move.v.13,roll-51.3.1,Motion,WN,../../Linguistic data/ontonotes-release-5.0/data/files/data/english/annotations/bn/cnn/02/cnn_0267.sense,15,1,False
Taipei mayor Ma Ying - jeou was angered to learn that intelligence organs would abuse their power by carrying out political surveillance against the Taipei City Government.,learn,9,2,learn.v.02;learn.v.06,learn-14,Discovery,WN,../../Linguistic data/ontonotes-release-5.0/data/files/data/english/annotations/mz/sinorama/10/ectb_1033.sense,14,1,False
Rhoda learned from an old book.,learn,,,,,Learning,,"Levin 1993, learn-14",,,
There are some votes that apparently were counted wrong.,count,7,1,count.v.01;count.v.04,multiply-108,Counting,WN,../../Linguistic data/ontonotes-release-5.0/data/files/data/english/annotations/bn/cnn/00/cnn_0015.sense,6,1,False
"Following World War II, when one family with mechanized equipment could farm crops formerly requiring 20 families, the surplus people were dumped into the mainstream of society with no Social Security, no skills in the workplace, no hope for their future except welfare.",farm,12,1,farm.v.01;farm.v.03,rear-26.2.2,Form,WN,../../Linguistic data/ontonotes-release-5.0/data/files/data/english/annotations/nw/wsj/06/wsj_0687.sense,6,1,False
"In most cases, this means you 're actually eating the fruit of the plants, rather than getting down on your hands and knees to graze on the green stuff.",graze,26,1,graze.v.01;graze.v.03;graze.v.05,dine-39.5,Ingestion,VN,../../Linguistic data/ontonotes-release-5.0/data/files/data/english/annotations/wb/sel/58/sel_5812.sense,0,1,False
"Three members of Solace, including superstar fiddler Winfred Horan are Irish Americans, the remaining two are Irish transplants living in New York City.",remain,15,2,remain.v.03,exist-47.1,Existence,WN,../../Linguistic data/ontonotes-release-5.0/data/files/data/english/annotations/bn/pri/00/pri_0037.sense,6,1,False
One other Major League baseball manager is now looking for a new team to lead.,look,8,1,look.v.01;look.v.04,peer-30.3,Intention,WN,../../Linguistic data/ontonotes-release-5.0/data/files/data/english/annotations/bn/voa/00/voa_0026.sense,0,1,False
TransCanada transports all gas that moves eastward from Alberta.,transport,1,1,transport.v.01;transport.v.02;transport.v.04;transport.v.05,send-11.1,Sending,VN,../../Linguistic data/ontonotes-release-5.0/data/files/data/english/annotations/nw/wsj/05/wsj_0529.sense,4,1,False
I remember the first day we took Chien - chien to Martine 's place.,take,6,4,take.v.03;take.v.07;take.v.27;take.v.30,bring-11.3,Carrying,VN,../../Linguistic data/ontonotes-release-5.0/data/files/data/english/annotations/mz/sinorama/10/ectb_1027.sense,18,1,False
"But the longer it takes us to understand the new landscape of this war, the more costly and painful the victory will be.",take,4,3,take.v.02;take.v.14,cost-54.2,Measurement,VN,../../Linguistic data/ontonotes-release-5.0/data/files/data/english/annotations/wb/eng/00/eng_0000.sense,263,1,False
"Tugs push the Cole into position over the deck and the Marlin rises to lift the 8,000 - ton warship out of the water.",lift,14,1,lift.v.01;lift.v.02;lift.v.03;lift.v.08;lift.v.10;lift.v.12;lift.v.19,put_direction-9.4,Pick_Up_and_Drop_Off,WN,../../Linguistic data/ontonotes-release-5.0/data/files/data/english/annotations/bn/mnb/00/mnb_0006.sense,6,2,True
"And he 'd peck at it ( or maybe pick it up, I do n't remember ).",peck,3,1,peck.v.01,swat-18.2,Contact,VN,../../Linguistic data/ontonotes-release-5.0/data/files/data/english/annotations/wb/sel/76/sel_7625.sense,0,1,False
"Although the outdoor temperature in Beijing has fallen to minus 3 degrees, the traffic police deployed additional manpower on the roads to direct traffic, ah, and guide drivers in making detours.",guide,29,1,guide.v.01;guide.v.02;guide.v.04;guide.v.05,accompany-51.7,Pursuit,VN,../../Linguistic data/ontonotes-release-5.0/data/files/data/english/annotations/bc/cctv/00/cctv_0005.sense,201,1,False
