sentence,verb_lemma,verb_token_idx,on_sense,wn_synsets,vn_class,situation,match_path,source_file,sentence_idx,situation_count,needs_review
"The heat energy plus the energy consumed by the breakup of the water molecules added to far more energy coming out of the apparatus than electrical energy going in, they reported.",consume,6,2,consume.v.03;consume.v.05,consume-66,Dynamic Possession,VN,../../Linguistic data/ontonotes-release-5.0/data/files/data/english/annotations/nw/wsj/15/wsj_1550.sense,15,1,False
Foreign - funded processing export consumes domestic electricity and water resources substantially.,consume,5,2,consume.v.03;consume.v.05,consume-66,Dynamic Possession,VN,../../Linguistic data/ontonotes-release-5.0/data/files/data/english/annotations/wb/c2e/00/c2e_0022.sense,45,1,False
A lot of people had to borrow money just to pay their taxes.,borrow,6,1,borrow.v.01,obtain-13.5.2,Dynamic Possession,VN,../../Linguistic data/ontonotes-release-5.0/data/files/data/english/annotations/mz/sinorama/10/ectb_1021.sense,39,1,False
But the percentage of your cash reserve that you can borrow tax - free is very small.,borrow,10,1,borrow.v.01,obtain-13.5.2,Dynamic Possession,VN,../../Linguistic data/ontonotes-release-5.0/data/files/data/english/annotations/nw/wsj/15/wsj_1574.sense,50,1,False
"The theory: Such individuals, many with young children, are in their prime borrowing years -- and, having borrowed from the bank, they may continue to use it for other services in later years.",borrow,15,1,borrow.v.01,obtain-13.5.2,Dynamic Possession,VN,../../Linguistic data/ontonotes-release-5.0/data/files/data/english/annotations/nw/wsj/00/wsj_0085.sense,16,1,False
The law does allow the RTC to borrow from the Treasury up to $ 5 billion at any time.,borrow,7,1,borrow.v.01,obtain-13.5.2,Dynamic Possession,VN,../../Linguistic data/ontonotes-release-5.0/data/files/data/english/annotations/nw/wsj/22/wsj_2200.sense,14,1,False
All international commercial loans borrowed by domestic institutions should be approved by the National Foreign Exchange Management Bureau.,borrow,4,1,borrow.v.01,obtain-13.5.2,Dynamic Possession,VN,../../Linguistic data/ontonotes-release-5.0/data/files/data/english/annotations/nw/xinhua/01/chtb_0119.sense,5,1,False
"Because his beverage wholesaling business requires a lot of space for large warehouses, he borrowed money from friends for many years to buy land.",borrow,15,1,borrow.v.01,obtain-13.5.2,Dynamic Possession,VN,../../Linguistic data/ontonotes-release-5.0/data/files/data/english/annotations/mz/sinorama/10/ectb_1021.sense,104,1,False
"Within a matter of weeks, less - conservative magazines reported that members of the ruling LDP had received much larger donations from pachinko organizations.",receive,18,1,receive.v.01;receive.v.02;receive.v.03;receive.v.04;receive.v.08;receive.v.09;receive.v.11;receive.v.12,obtain-13.5.2,Dynamic Possession,VN,../../Linguistic data/ontonotes-release-5.0/data/files/data/english/annotations/nw/wsj/13/wsj_1387.sense,29,1,False
"Tenders for the bills, available in minimum $ 10,000 denominations, must be received by 1 p.m. EST Monday at the Treasury or at Federal Reserve banks or branches.",receive,14,1,receive.v.01;receive.v.02;receive.v.03;receive.v.04;receive.v.08;receive.v.09;receive.v.11;receive.v.12,obtain-13.5.2,Dynamic Possession,VN,../../Linguistic data/ontonotes-release-5.0/data/files/data/english/annotations/nw/wsj/11/wsj_1198.sense,2,1,False
"Mrs. Arafat, who lives in Paris with her daughter, receives tens of thousands of dollars per month from the allegedly bankrupt Palestinian Authority, while a typical local ringleader of the Al-Aksa brigade, reporting to Arafat, receives only a cash payment of a couple of hundred dollars, for performing murders at the retail level.",receive,11,1,receive.v.01;receive.v.02;receive.v.03;receive.v.04;receive.v.08;receive.v.09;receive.v.11;receive.v.12,obtain-13.5.2,Dynamic Possession,VN,../../Linguistic data/ontonotes-release-5.0/data/files/data/english/annotations/wb/eng/00/eng_0000.sense,170,1,False
The legislation also arranges for children under 18 orphaned by the quake to receive a government - subsidized trust fund to pay for their living expenses and education.,receive,13,1,receive.v.01;receive.v.02;receive.v.03;receive.v.04;receive.v.08;receive.v.09;receive.v.11;receive.v.12,obtain-13.5.2,Dynamic Possession,VN,../../Linguistic data/ontonotes-release-5.0/data/files/data/english/annotations/mz/sinorama/10/ectb_1008.sense,47,1,False
British police are puzzling over an item of stolen property which has just been recovered.,recover,14,1,recover.v.01;recover.v.04,obtain-13.5.2,Dynamic Possession,WN,../../Linguistic data/ontonotes-release-5.0/data/files/data/english/annotations/bn/pri/00/pri_0027.sense,2,1,False
"He says: "" If I had used my allowance every year from the time I was small to invest in a fund, at the rate of NT$ 30,000 per year, after 20 years, there would be quite a lot of money right now. """,use,7,3,use.v.03,consume-66,Dynamic Possession,WN,../../Linguistic data/ontonotes-release-5.0/data/files/data/english/annotations/mz/sinorama/10/ectb_1028.sense,21,1,False
"In order to promote the development of the Tumen River region, South Korea donated one million US dollars to establish the Tumen River development fund.",donate,14,1,donate.v.01,contribute-13.2,Dynamic Possession,WN,../../Linguistic data/ontonotes-release-5.0/data/files/data/english/annotations/nw/xinhua/00/chtb_0049.sense,20,1,False
They also donated tents and other necessities.,donate,2,1,donate.v.01,contribute-13.2,Dynamic Possession,WN,../../Linguistic data/ontonotes-release-5.0/data/files/data/english/annotations/mz/sinorama/10/ectb_1062.sense,28,1,False
The initiative seems to have been crafted to include all the hot issues that set off the wealthy Hollywood weepers who donate money.,donate,21,1,donate.v.01,contribute-13.2,Dynamic Possession,WN,../../Linguistic data/ontonotes-release-5.0/data/files/data/english/annotations/nw/wsj/22/wsj_2231.sense,20,1,False
"Now, they have donated the fertilizer store to the Peasants Association.",donate,4,1,donate.v.01,contribute-13.2,Dynamic Possession,WN,../../Linguistic data/ontonotes-release-5.0/data/files/data/english/annotations/bc/phoenix/00/phoenix_0001.sense,24,1,False
"First, they have to remember the passenger 's order and seat number, collect the money ( and check for counterfeits ). Then heat the meal, deliver the meal... there 's more than just one type of meal, and the preparation is n't always simple.",collect,14,2,collect.v.02,obtain-13.5.2,Dynamic Possession,VN,../../Linguistic data/ontonotes-release-5.0/data/files/data/english/annotations/wb/c2e/00/c2e_0031.sense,27,1,False
"In the case of foreign manufacturers, the recycling fee would haqve a similar effect as an import duty and could be collected in the same way, but without being called a tariff.",collect,22,2,collect.v.02,obtain-13.5.2,Dynamic Possession,VN,../../Linguistic data/ontonotes-release-5.0/data/files/data/english/annotations/wb/eng/00/eng_0001.sense,57,1,False
"However, when the Chinese New Year passes, many employees, having collected their annual bonuses, want to change jobs, and this is when the market really heats up.",collect,13,2,collect.v.02,obtain-13.5.2,Dynamic Possession,VN,../../Linguistic data/ontonotes-release-5.0/data/files/data/english/annotations/mz/sinorama/10/ectb_1052.sense,63,1,False
"Also for sale are Buckingham Wile Co., which distributes Cutty Sark blended whiskey in the U.S., and Whitbread 's Atlas Peak Vineyards in California 's Napa Valley.",distribute,9,1,distribute.v.01;distribute.v.04,contribute-13.2,Dynamic Possession,WN,../../Linguistic data/ontonotes-release-5.0/data/files/data/english/annotations/nw/wsj/18/wsj_1804.sense,4,1,False
"Maryland Club also distributes tea, which fits well with P&G 's Tender Leaf brand, and hot cocoa products.",distribute,3,1,distribute.v.01;distribute.v.04,contribute-13.2,Dynamic Possession,WN,../../Linguistic data/ontonotes-release-5.0/data/files/data/english/annotations/nw/wsj/20/wsj_2073.sense,6,1,False
"They are also taking oil off the grounded tanker, but so far they 've only managed to retrieve 20,000 gallons.",retrieve,18,1,retrieve.v.01;retrieve.v.03;retrieve.v.04,obtain-13.5.2,Dynamic Possession,VN,../../Linguistic data/ontonotes-release-5.0/data/files/data/english/annotations/bn/abc/00/abc_0065.sense,13,1,False
"Because the people are Muslims and do not accept interest from their bank accounts, this interest goes to the banks.",accept,8,1,accept.v.02;accept.v.03;accept.v.05;accept.v.06;accept.v.09;accept.v.10;accept.v.11,obtain-13.5.2,Dynamic Possession,VN,../../Linguistic data/ontonotes-release-5.0/data/files/data/english/annotations/wb/p2.5_a2e/00/p2.5_a2e_0013.sense,1,1,False
"TVA, which operates one of the nation 's largest electric power systems, is a corporation owned by the federal government.",own,17,1,own.v.01,own-100.1,Possession,WN,../../Linguistic data/ontonotes-release-5.0/data/files/data/english/annotations/nw/wsj/14/wsj_1464.sense,27,1,False
"Thus he had to specify in his present statement, in addition to the names of the companies, the percentage he owns in each company ( more than 5 % in Samba, more than 10 % in Manufacturing, more than 13 % in Safola, more than 25 % in Research,... etc. )",own,22,1,own.v.01,own-100.1,Possession,WN,../../Linguistic data/ontonotes-release-5.0/data/files/data/english/annotations/wb/a2e/00/a2e_0024.sense,141,1,False
So either the user must own all directories below the jail including the jail or others need read permissions to the same directories?!,own,5,1,own.v.01,own-100.1,Possession,WN,../../Linguistic data/ontonotes-release-5.0/data/files/data/english/annotations/wb/sel/12/sel_1209.sense,0,1,False
"They were as poor as their neighbors, to be sure, but they owned land and were thus classified as small landowners, which by definition meant that they neither had any extra land to rent out nor did they rent from others.",own,14,1,own.v.01,own-100.1,Possession,WN,../../Linguistic data/ontonotes-release-5.0/data/files/data/english/annotations/mz/sinorama/10/ectb_1021.sense,43,1,False
"Samsung already owns Korea First Advertising Co., that country 's largest agency.",own,2,1,own.v.01,own-100.1,Possession,WN,../../Linguistic data/ontonotes-release-5.0/data/files/data/english/annotations/nw/wsj/23/wsj_2331.sense,37,1,False
"It 's now official, former star Mario Lemieux is coming out of retirement to play for the National Ice Hockey League team that he owns, the Pittsburgh Penguins.",own,25,1,own.v.01,own-100.1,Possession,WN,../../Linguistic data/ontonotes-release-5.0/data/files/data/english/annotations/bn/voa/01/voa_0150.sense,0,1,False
"Iran 's neighbors in the Gulf expressed their concern over Iran 's nuclear plans, and Saudi officials said that an Iran which owns nuclear weapons could spur a regional arms race.",own,23,1,own.v.01,own-100.1,Possession,WN,../../Linguistic data/ontonotes-release-5.0/data/files/data/english/annotations/wb/a2e/00/a2e_0021.sense,69,1,False
folks that own that gas are not going to discount it regardless of where your plant is located.,own,2,1,own.v.01,own-100.1,Possession,WN,../../Linguistic data/ontonotes-release-5.0/data/files/data/english/annotations/wb/sel/12/sel_1242.sense,0,1,False
Thank - you Do you own a Signal Generator?,own,5,1,own.v.01,own-100.1,Possession,WN,../../Linguistic data/ontonotes-release-5.0/data/files/data/english/annotations/wb/sel/12/sel_1239.sense,0,1,False
She owns a house.,own,,,,,Possession,,"Kalm 2022, p. 107ff",,,
"The film producer, owned by Madrid - based financier Jacques Hachuel, received a 5 % stake in the Barcelona - based publishing group.",own,4,1,own.v.01,own-100.1,Possession,WN,../../Linguistic data/ontonotes-release-5.0/data/files/data/english/annotations/nw/wsj/10/wsj_1018.sense,3,1,False
"""Their principal asset is Manville common stock,"" says Jeffrey Halis, who runs Sabre Associates, an investment fund that owns Manville shares.",own,23,1,own.v.01,own-100.1,Possession,WN,../../Linguistic data/ontonotes-release-5.0/data/files/data/english/annotations/nw/wsj/13/wsj_1328.sense,8,1,False
"But today, whoever owns systematized knowledge will win out over his or her competitors.",own,4,1,own.v.01,own-100.1,Possession,WN,../../Linguistic data/ontonotes-release-5.0/data/files/data/english/annotations/mz/sinorama/10/ectb_1042.sense,26,1,False
I own a Nissan pickup with a 4 cylinder engine.,own,1,1,own.v.01,own-100.1,Possession,WN,../../Linguistic data/ontonotes-release-5.0/data/files/data/english/annotations/wb/sel/12/sel_1249.sense,0,1,False
The book belongs to him.,belong,,,,,Possession,,"Kalm 2022, p. 107ff",,,
"According to his official biography, he bought his first bison in 1976.",buy,,,,,Buying,,ontonotes,,,
Lee buys potatoes by the pound.,buy,,,,,Buying,,framenet,,,
I have been buying from him for over 10 years.,buy,,,,,Buying,,framenet,,,
Jon bought some expensive apples at five dollars a pound!,buy,,,,,Buying,,framenet,,,
Jess bought a coat.,buy,,,,,Buying,,framenet,,,
"Yeh recalls a "" beautiful accident "": He bought a second - hand electroplater from a Japanese and tried to plate various plastic products with chrome so as to make them more resilient.",buy,9,1,buy.v.01;buy.v.04;buy.v.03,get-13.5.1,Buying,VN,../../Linguistic data/ontonotes-release-5.0/data/files/data/english/annotations/mz/sinorama/10/ectb_1054.sense,43,2,True
"Taking hold of the opportunity, he bought a cattle ranch in America.",buy,7,1,buy.v.01;buy.v.04;buy.v.03,get-13.5.1,Buying,VN,../../Linguistic data/ontonotes-release-5.0/data/files/data/english/annotations/mz/sinorama/10/ectb_1054.sense,95,2,True
"My son was coming in late, so I booked a hotel for him in the area.",book,9,,,,Buying,,ontonotes,,,False
Seats and meals must be booked directly from Vintage Trains.,book,5,,,,Buying,,ontonotes,,,False
I just ordered pizza from panhandle pizza.,order,2,,,,Buying,,ontonotes,,,False
"The Japanese management guru Matsushita Konosuke has said, "" Do n't sell customers things they find attractive, sell them things they find useful. """,sell,12,1,sell.v.01;sell.v.02;sell.v.04;sell.v.07,give-13.1,Selling,WN,../../Linguistic data/ontonotes-release-5.0/data/files/data/english/annotations/mz/sinorama/10/ectb_1035.sense,43,2,True
Harry Potter books have been selling like hotcakes.,sell,,,,,Selling,,ontonotes,,,
She didn't want to sell shoes the rest of her life.,sell,,,,,Selling,,ontonotes,,,
His uncle sells produce.,sell,,,,,Selling,,ontonotes,,,
"But this year, our paper was sold to a land developer.",sell,,,,,Selling,,COCA via Croft et al 2021,,,
They sold off their property before they moved.,sell,,,,,Selling,,ontonotes,,,
Movies usually help to sell the video games that are based on them.,sell,,,,,Selling,,ontonotes,,,
Lee sold a textbook to Abby.,sell,,,,,Selling,,framenet (Commerce_sell),,,
"Priceline.com, the first American company to sell airline tickets directly over the Internet, surpassed the combined market capitalization of the three largest US airlines ( United, American and Delta ) after only two years of operations.",sell,7,1,sell.v.01;sell.v.02;sell.v.04;sell.v.07,give-13.1,Selling,WN,../../Linguistic data/ontonotes-release-5.0/data/files/data/english/annotations/mz/sinorama/10/ectb_1035.sense,80,2,True
"Others, like broker John Mitchell, hawked a humidor bearing Madoff's name.",hawk,,,,,Selling,,ontonotes,,,
"If they go shopping for food by bike, they have to pay 20 cents for parking.",pay,12,1,pay.v.01;pay.v.05;pay.v.09;pay.v.03;pay.v.11;pay.v.10,pay-68,Payment,VN,../../Linguistic data/ontonotes-release-5.0/data/files/data/english/annotations/wb/c2e/00/c2e_0009.sense,68,1,False
"Average of top rates paid by major New York banks on primary new issues of negotiable C.D.s, usually on amounts of $ 1 million and more.",pay,4,1,pay.v.01;pay.v.05;pay.v.09;pay.v.03;pay.v.11;pay.v.10,pay-68,Payment,VN,../../Linguistic data/ontonotes-release-5.0/data/files/data/english/annotations/nw/wsj/23/wsj_2380.sense,22,1,False
"Acquirers paid premiums ranging from 1.5 % to 3.7 % for the deposits and branch systems, roughly in line with what analysts were expecting.",pay,1,1,pay.v.01;pay.v.05;pay.v.09;pay.v.03;pay.v.11;pay.v.10,pay-68,Payment,VN,../../Linguistic data/ontonotes-release-5.0/data/files/data/english/annotations/nw/wsj/23/wsj_2348.sense,7,1,False
and I knew that if I did n't pay up they would burn the car.,pay,8,1,pay.v.01;pay.v.05;pay.v.09;pay.v.03;pay.v.11;pay.v.10,pay-68,Payment,VN,../../Linguistic data/ontonotes-release-5.0/data/files/data/english/annotations/wb/eng/00/eng_0017.sense,331,1,False
Patti and Gary Thompson of New Jersey prefer Al Gore 's plan to pay off the nation 's $ 3.5 half dollar national debt.,pay,13,1,pay.v.01;pay.v.05;pay.v.09;pay.v.03;pay.v.11;pay.v.10,pay-68,Payment,VN,../../Linguistic data/ontonotes-release-5.0/data/files/data/english/annotations/bn/nbc/00/nbc_0001.sense,8,1,False
and if we have a situation where young people grow up in the world that thinks that newspapers are things you read for free online who 's going to -- who 's going to pay my travel expenses /?,pay,34,1,pay.v.01;pay.v.05;pay.v.09;pay.v.03;pay.v.11;pay.v.10,pay-68,Payment,VN,../../Linguistic data/ontonotes-release-5.0/data/files/data/english/annotations/bc/cnn/00/cnn_0008.sense,592,1,False
But salvation has come from an unlikely suitor - an Australian company called Transurban that has agreed to pay the Virginia Department of Transportation $ 522 million in exchange for a 99 - year lease of the road.,pay,18,1,pay.v.01;pay.v.05;pay.v.09;pay.v.03;pay.v.11;pay.v.10,pay-68,Payment,VN,../../Linguistic data/ontonotes-release-5.0/data/files/data/english/annotations/wb/eng/00/eng_0005.sense,91,1,False
"Owners of intellectual property rights, when requesting Customs to investigate and deal with goods that violate rights, should bear responsibility for reporting, assist Customs to develop investigation work and pay the appraisal and investigation of the related goods and other related expenses.",pay,32,1,pay.v.01;pay.v.05;pay.v.09;pay.v.03;pay.v.11;pay.v.10,pay-68,Payment,VN,../../Linguistic data/ontonotes-release-5.0/data/files/data/english/annotations/nw/xinhua/02/chtb_0289.sense,7,1,False
"If we want to support students, we might adopt the idea used in other countries of offering more scholarships based on something called ""scholarship,"" rather than on the government 's idea of ""service.""",offer,17,1,offer.v.01;offer.v.02;offer.v.04;offer.v.06;offer.v.07;offer.v.11;offer.v.12,future_having-13.3,Future Having,VN,../../Linguistic data/ontonotes-release-5.0/data/files/data/english/annotations/nw/wsj/24/wsj_2407.sense,34,1,False
"Additionally, the company said it filed with the Securities and Exchange Commission for the proposed offering of 10 million shares of common stock, expected to be offered in November.",offer,28,1,offer.v.01;offer.v.02;offer.v.04;offer.v.06;offer.v.07;offer.v.11;offer.v.12,future_having-13.3,Future Having,VN,../../Linguistic data/ontonotes-release-5.0/data/files/data/english/annotations/nw/wsj/23/wsj_2340.sense,6,1,False
"The cafeteria offered donated croissants and brie for breakfast, and for dinner, pasta salad and chocolate mousse torts along with the salmon.",offer,2,1,offer.v.01;offer.v.02;offer.v.04;offer.v.06;offer.v.07;offer.v.11;offer.v.12,future_having-13.3,Future Having,VN,../../Linguistic data/ontonotes-release-5.0/data/files/data/english/annotations/nw/wsj/14/wsj_1435.sense,13,1,False
"Because the CD had an effective yield of 13.4 % when it was issued in 1984, and interest rates in general had declined sharply since then, part of the price Dr. Blumenfeld paid was a premium -- an additional amount on top of the CD 's base value plus accrued interest that represented the CD 's increased market value.",issue,13,1,issue.v.01;issue.v.02;issue.v.03;issue.v.05,future_having-13.3,Future Having,WN,../../Linguistic data/ontonotes-release-5.0/data/files/data/english/annotations/nw/wsj/12/wsj_1273.sense,11,1,False
"Citicorp issued $ 200 million of seven - year notes priced to yield 8.82 %, and Xerox priced $ 150 million of six - year notes to yield 8.85 %.",issue,1,1,issue.v.01;issue.v.02;issue.v.03;issue.v.05,future_having-13.3,Future Having,WN,../../Linguistic data/ontonotes-release-5.0/data/files/data/english/annotations/nw/wsj/12/wsj_1213.sense,56,1,False
"All told, the federal government already guarantees more than $ 900 billion of mortgages.",guarantee,7,1,guarantee.v.01;guarantee.v.03;guarantee.v.04,future_having-13.3,Future Having,VN,../../Linguistic data/ontonotes-release-5.0/data/files/data/english/annotations/nw/wsj/22/wsj_2227.sense,21,1,False
"Nelson Bunker Hunt is considering it, although his attorney says he wo n't do it if the proposal jeopardizes a tentative settlement he has reached with the Internal Revenue Service, which claims the brothers owe $ 1 billion in back taxes and is by far the biggest creditor in both cases.",owe,36,1,owe.v.01;owe.v.03,future_having-13.3,Future Having,WN,../../Linguistic data/ontonotes-release-5.0/data/files/data/english/annotations/nw/wsj/16/wsj_1611.sense,5,1,False
Not since the British hired hordes of Hessians to crush George Washington 's revolutionary army had a military force tracing to America been so utterly mercenary.,hire,4,1,hire.v.01;hire.v.02;hire.v.03,hire-13.5.3,Cause Membership,WN,../../Linguistic data/ontonotes-release-5.0/data/files/data/english/annotations/wb/eng/00/eng_0016.sense,183,3,True
"Says he 's not aware he 's being expelled but says if so, it is because some bitter former colleagues of his at MSNBC blew the whistle on him.",expel,8,1,expel.v.01;expel.v.02;expel.v.03,banish-10.2,Cause Membership,VN,../../Linguistic data/ontonotes-release-5.0/data/files/data/english/annotations/bn/cnn/02/cnn_0260.sense,4,1,False
"But separate reports from Joshua Weiner and Denise Spence of the Brookings Institution and Korbin Liu of the Urban Institute find that ""a surprisingly small proportion"" -- only about 10 % -- of residents start out as private payers but ""spend down"" to Medicaid levels in a single nursing home stay before they die or are discharged.",discharge,60,2,discharge.v.03;discharge.v.10,banish-10.2,Cause Membership,WN,../../Linguistic data/ontonotes-release-5.0/data/files/data/english/annotations/nw/wsj/05/wsj_0595.sense,16,1,False
"Li Mao - tsung, a pottery expert living in the US, who was commissioned by the ROC government to do a study of the suitability of Palauan clays for pottery, says that Palau has a lot of clay of decent quality, making the islands a good location for the development of art pottery or large scale pottery and porcelain production.",commission,15,3,commission.v.03,hire-13.5.3,Cause Membership,WN,../../Linguistic data/ontonotes-release-5.0/data/files/data/english/annotations/mz/sinorama/10/ectb_1022.sense,129,1,False
Well this investigation they never put a reporter in jail -- they never put a reporter in jail for something /.,put,13,1,put.v.01;put.v.02;put.v.09,put-9.1,Cause Membership,WN,../../Linguistic data/ontonotes-release-5.0/data/files/data/english/annotations/bc/msnbc/00/msnbc_0003.sense,411,1,False
"Since he was n't a gentleman and he could hustle for money like Henslowe, he eventually got enough to buy shares in prostitution.",hustle,9,2,hustle.v.03;hustle.v.04;hustle.v.05,bully-59.5,Aggression,WN,../../Linguistic data/ontonotes-release-5.0/data/files/data/english/annotations/wb/sel/62/sel_6267.sense,0,1,False
"Cartoonist Garry Trudeau is suing the Writers Guild of America East for $ 11 million, alleging it mounted a ""campaign to harass and punish"" him for crossing a screenwriters ' picket line.",harass,23,2,harass.v.02,bully-59.5,Aggression,WN,../../Linguistic data/ontonotes-release-5.0/data/files/data/english/annotations/nw/wsj/00/wsj_0049.sense,42,1,False
It's hard not to bully other students when arguing in class.,bully,,,,,Aggression,,ontonotes,,,
"Most of the people here wo n't let you do that; they 'll goad you until you get angry again, and repeat the cycle.",goad,14,1,goad.v.01;goad.v.02;goad.v.03;goad.v.04,bully-59.5,Aggression,WN,../../Linguistic data/ontonotes-release-5.0/data/files/data/english/annotations/wb/sel/56/sel_5690.sense,0,1,False
"Sometimes I like to mention myself in the third person, to underscore the attitude of greatness Mostly, though, the self-mockery is too much of a personal joke, so I stick to trying to goad you.",goad,37,1,goad.v.01;goad.v.02;goad.v.03;goad.v.04,bully-59.5,Aggression,WN,../../Linguistic data/ontonotes-release-5.0/data/files/data/english/annotations/wb/sel/56/sel_5692.sense,0,1,False
"In addition, the officials say Israel has n't presented convincing evidence these acts were ordered by Fatah or by any group Mr. Arafat controls.",control,24,1,control.v.01;control.v.02;control.v.03;control.v.04;control.v.08,enforce-63,Enforcement,WN,../../Linguistic data/ontonotes-release-5.0/data/files/data/english/annotations/nw/wsj/11/wsj_1101.sense,23,1,False
"All these expenses are paid by the Iranian government which is trying to control the region, whether in Iraq or Syria or Lebanon.",control,13,1,control.v.01;control.v.02;control.v.03;control.v.04;control.v.08,enforce-63,Enforcement,WN,../../Linguistic data/ontonotes-release-5.0/data/files/data/english/annotations/wb/a2e/00/a2e_0031.sense,37,1,False
"To assure the livelihood of the local Atayal aborigines of Chilan, when the cypress national park is set up consideration will have to be given to how to balance the need to protect the forests with the demand for sustainable tourism.",protect,33,1,protect.v.01,defend-72.3,Protection,WN,../../Linguistic data/ontonotes-release-5.0/data/files/data/english/annotations/mz/sinorama/10/ectb_1070.sense,106,2,True
