sentence,verb_lemma,verb_token_idx,on_sense,wn_synsets,vn_class,situation,match_path,source_file,sentence_idx,situation_count,needs_review
"at which he looked at me really really funny and said ' ok, how 'bout 18 bucks. '",look,3,1,look.v.01;look.v.04,peer-30.3,Perception_(exp._subj.),WN,../../Linguistic data/ontonotes-release-5.0/data/files/data/english/annotations/wb/eng/00/eng_0017.sense,94,1,False
I went over and looked at these babies when this case started.,look,4,1,look.v.01;look.v.04,peer-30.3,Perception_(exp._subj.),WN,../../Linguistic data/ontonotes-release-5.0/data/files/data/english/annotations/bn/nbc/00/nbc_0003.sense,7,1,False
Dad looked at Qingqing and teased Qingqing: how come this kid opens her eyes while sleeping?,look,1,1,look.v.01;look.v.04,peer-30.3,Perception_(exp._subj.),WN,../../Linguistic data/ontonotes-release-5.0/data/files/data/english/annotations/wb/c2e/00/c2e_0010.sense,12,1,False
I used to see the lights going bay and by and I looked out and said it 's pitch black out here.,look,12,1,look.v.01;look.v.04,peer-30.3,Perception_(exp._subj.),WN,../../Linguistic data/ontonotes-release-5.0/data/files/data/english/annotations/bn/mnb/00/mnb_0009.sense,13,1,False
"She wants something big, and already has looked at the Chrysler New Yorker and Lincoln Town Car.",look,8,1,look.v.01;look.v.04,peer-30.3,Perception_(exp._subj.),WN,../../Linguistic data/ontonotes-release-5.0/data/files/data/english/annotations/nw/wsj/13/wsj_1377.sense,21,1,False
"In Peter and Wendy, the Lost Boys are the ones who fall out of their perambulators when their nurse is not looking.",look,22,1,look.v.01;look.v.04,peer-30.3,Perception_(exp._subj.),WN,../../Linguistic data/ontonotes-release-5.0/data/files/data/english/annotations/wb/eng/00/eng_0009.sense,347,1,False
"Look outside right now and you might not believe it, but snow or no, around the globe the year 2000 is one of the warmest on record.",look,0,1,look.v.01;look.v.04,peer-30.3,Perception_(exp._subj.),WN,../../Linguistic data/ontonotes-release-5.0/data/files/data/english/annotations/bn/cnn/01/cnn_0147.sense,2,1,False
"Jay, look at that sign.",look,2,1,look.v.01;look.v.04,peer-30.3,Perception_(exp._subj.),WN,../../Linguistic data/ontonotes-release-5.0/data/files/data/english/annotations/bn/mnb/00/mnb_0008.sense,17,1,False
"And sometimes when she looks at the poster on her wall, she feels as if she is being mocked.",look,4,1,look.v.01;look.v.04,peer-30.3,Perception_(exp._subj.),WN,../../Linguistic data/ontonotes-release-5.0/data/files/data/english/annotations/mz/sinorama/10/ectb_1028.sense,14,1,False
They were staring straight ahead as well /.,stare,2,1,stare.v.01;stare.v.02,peer-30.3,Perception_(exp._subj.),VN,../../Linguistic data/ontonotes-release-5.0/data/files/data/english/annotations/bc/msnbc/00/msnbc_0002.sense,106,1,False
"I do n't care what reality is, I knows what my peepers peeped.",peep,13,1,peep.v.01,peer-30.3,Perception_(exp._subj.),VN,../../Linguistic data/ontonotes-release-5.0/data/files/data/english/annotations/wb/sel/76/sel_7646.sense,0,1,False
"Tyco 's CEO and President Dennis Kozlowski and the last time I looked, he was sailing around Martha Vinyard on his yacht.",look,12,1,look.v.01;look.v.04,peer-30.3,Perception_(exp._subj.),WN,../../Linguistic data/ontonotes-release-5.0/data/files/data/english/annotations/bn/cnn/03/cnn_0381.sense,8,1,False
"Throughout the morning, we 're looking at a remarkable tape.",look,6,1,look.v.01;look.v.04,peer-30.3,Perception_(exp._subj.),WN,../../Linguistic data/ontonotes-release-5.0/data/files/data/english/annotations/bn/cnn/03/cnn_0336.sense,5,1,False
I saw the play.,see,,,,,Perception_(exp._subj.),,"Levin 1993, See-30.1",,,
I can see that you are feeling great.,see,,,,,Perception_(exp._subj.),,"Levin 1993, See-30.1",,,
I see someone running down the street.,see,,,,,Perception_(exp._subj.),,"Levin 1993, See-30.1",,,
I sensed the eagerness in him.,sense,,,,,Perception_(exp._subj.),,"Levin 1993, See-30.1",,,
The entire class heard about the sermon.,hear,,,,,Perception_(exp._subj.),,"Levin 1993, See-30.1",,,
The crew spotted the island.,spot,,,,,Perception_(exp._subj.),,"Levin 1993, Sight-30.2",,,
We spotted them running.,spot,,,,,Perception_(exp._subj.),,"Levin 1993, Sight-30.2",,,
I spotted the runaway cat.,spot,,,,,Perception_(exp._subj.),,"Levin 1993, Sight-30.2",,,
We peered at the baby.,peer,,,,,Perception_(exp._subj.),,"Levin 1993, Peer-30.3",,,
We checked around the room.,check,,,,,Perception_(exp._subj.),,"Levin 1993, Peer-30.3",,,
We glared through the screen.,glare,,,,,Perception_(exp._subj.),,"Levin 1993, Peer-30.3",,,
We squinted into the closet.,squint,,,,,Perception_(exp._subj.),,"Levin 1993, Peer-30.3",,,
We listened to the baby.,listen,,,,,Perception_(exp._subj.),,"Levin 1993, Peer-30.3",,,
We checked on them.,check,,,,,Perception_(exp._subj.),,"Levin 1993, Peer-30.3",,,
We peered at them running.,peer,,,,,Perception_(exp._subj.),,"Levin 1993, Peer-30.3",,,
"However, no matter how many hundred - pacers we can see at the zoo on future visits, it is obvious that we can not fully understand them just by seeing them in captivity.",see,11,1,see.v.01;see.v.07;see.v.19;see.v.20,see-30.1,Perception_(exp._subj.),WN,../../Linguistic data/ontonotes-release-5.0/data/files/data/english/annotations/mz/sinorama/10/ectb_1066.sense,78,1,False
You may have heard of the Crips or seen them portrayed in the movies /.,see,8,1,see.v.01;see.v.07;see.v.19;see.v.20,see-30.1,Perception_(exp._subj.),WN,../../Linguistic data/ontonotes-release-5.0/data/files/data/english/annotations/bc/cnn/00/cnn_0001.sense,400,1,False
"then he noticed we were parked at the mouth of his drive through car wash and said ""there 's no _way_ i 'm gon na let you use my car wash!""",notice,2,1,notice.v.01;notice.v.02;notice.v.04,see-30.1,Perception_(exp._subj.),WN,../../Linguistic data/ontonotes-release-5.0/data/files/data/english/annotations/wb/eng/00/eng_0017.sense,180,1,False
"Young 's mother says, when she sees her son, she plans on hugging him for a good solid half hour.",see,7,6,see.v.09;see.v.11;see.v.12;see.v.15;see.v.16,see-30.1,Perception_(exp._subj.),WN,../../Linguistic data/ontonotes-release-5.0/data/files/data/english/annotations/bn/cnn/02/cnn_0284.sense,29,1,False
"The officers responded to that location, noticed a suspect fitting the description, approached Derrick Lee, asked for identification.",notice,7,1,notice.v.01;notice.v.02;notice.v.04,see-30.1,Perception_(exp._subj.),WN,../../Linguistic data/ontonotes-release-5.0/data/files/data/english/annotations/bn/cnn/03/cnn_0364.sense,6,1,False
I did notice my end link bushing are worn.,notice,2,1,notice.v.01;notice.v.02;notice.v.04,see-30.1,Perception_(exp._subj.),WN,../../Linguistic data/ontonotes-release-5.0/data/files/data/english/annotations/wb/sel/11/sel_1153.sense,0,1,False
I had never seen her before /.,see,3,1,see.v.01;see.v.07;see.v.19;see.v.20,see-30.1,Perception_(exp._subj.),WN,../../Linguistic data/ontonotes-release-5.0/data/files/data/english/annotations/bc/msnbc/00/msnbc_0002.sense,393,1,False
"The dog is sent off in the direction of the fall, in a straight line, of course, and if he remains on that straight line, he 'll eventually either see or scent the fallen bird, and then he 'll pick it up and return to the line with it.",scent,35,3,,sight-30.2,Perception_(exp._subj.),VN,../../Linguistic data/ontonotes-release-5.0/data/files/data/english/annotations/wb/sel/93/sel_9319.sense,0,1,False
But the mouse experiment at a Medical Research Council laboratory in London shows genetic defects can be detected three days after conception using a new American - developed gene - copying technique.,detect,17,1,detect.v.01,see-30.1,Perception_(exp._subj.),WN,../../Linguistic data/ontonotes-release-5.0/data/files/data/english/annotations/nw/wsj/12/wsj_1218.sense,3,1,False
and then I saw the fire and the activists.,see,3,1,see.v.01;see.v.07;see.v.19;see.v.20,see-30.1,Perception_(exp._subj.),WN,../../Linguistic data/ontonotes-release-5.0/data/files/data/english/annotations/wb/eng/00/eng_0017.sense,325,1,False
You see the gentleman here wearing a brown one and they have toggles to pull and inflate.,see,1,1,see.v.01;see.v.07;see.v.19;see.v.20,see-30.1,Perception_(exp._subj.),WN,../../Linguistic data/ontonotes-release-5.0/data/files/data/english/annotations/bn/cnn/03/cnn_0360.sense,12,1,False
Oh have you seen those costumes by the way /?,see,3,1,see.v.01;see.v.07;see.v.19;see.v.20,see-30.1,Perception_(exp._subj.),WN,../../Linguistic data/ontonotes-release-5.0/data/files/data/english/annotations/bc/cnn/00/cnn_0001.sense,642,1,False
I did n't hear the DVD yet though /.,hear,3,2,hear.v.01,see-30.1,Perception_(exp._subj.),WN,../../Linguistic data/ontonotes-release-5.0/data/files/data/english/annotations/bc/cnn/00/cnn_0004.sense,253,1,False
"Readers who pull off a piece of tape and press a switch will hear a tiny -- but distinctly human - sounding -- voice announce, ""I am the talking chip,"" as it launches into a 15 - second discourse on its own attributes.",hear,13,2,hear.v.01,see-30.1,Perception_(exp._subj.),WN,../../Linguistic data/ontonotes-release-5.0/data/files/data/english/annotations/nw/wsj/24/wsj_2440.sense,2,1,False
"Because they also detected tritium and indications of nuclear radiation, they asserted that the ""excess"" heat energy must be coming from energy released by the nuclear fusion of deuterium atoms inside the palladium rod.",detect,3,1,detect.v.01,see-30.1,Perception_(exp._subj.),WN,../../Linguistic data/ontonotes-release-5.0/data/files/data/english/annotations/nw/wsj/15/wsj_1550.sense,16,1,False
"Again, correspondents, our correspondents with the -- embedded with these forces, with them in the field, saying in some cases they can see the lights of the skyline of Baghdad.",see,26,1,see.v.01;see.v.07;see.v.19;see.v.20,see-30.1,Perception_(exp._subj.),WN,../../Linguistic data/ontonotes-release-5.0/data/files/data/english/annotations/bn/cnn/02/cnn_0267.sense,3,1,False
"You might notice in those specs I quoted, that there is provision for two wires to be connected to one of the 3.3V pins on the PSU.",notice,2,1,notice.v.01;notice.v.02;notice.v.04,see-30.1,Perception_(exp._subj.),WN,../../Linguistic data/ontonotes-release-5.0/data/files/data/english/annotations/wb/sel/11/sel_1163.sense,0,1,False
"After one has seen so many dead bodies and heard the anguished wailing of bereaved relatives, it is hard to ignore the wisdom of calls to live in harmony with nature.",see,3,1,see.v.01;see.v.07;see.v.19;see.v.20,see-30.1,Perception_(exp._subj.),WN,../../Linguistic data/ontonotes-release-5.0/data/files/data/english/annotations/mz/sinorama/10/ectb_1062.sense,43,1,False
"For example, if they could see the bone compromised in some way they could tell if there had been a stab or a shooting.",see,6,1,see.v.01;see.v.07;see.v.19;see.v.20,see-30.1,Perception_(exp._subj.),WN,../../Linguistic data/ontonotes-release-5.0/data/files/data/english/annotations/bn/cnn/02/cnn_0288.sense,20,1,False
"At the job - seekers hostel, you can see employment information all around.",see,9,1,see.v.01;see.v.07;see.v.19;see.v.20,see-30.1,Perception_(exp._subj.),WN,../../Linguistic data/ontonotes-release-5.0/data/files/data/english/annotations/bn/p2.5_c2e/00/p2.5_c2e_0005.sense,10,1,False
There were times perhaps they were in a park somewhere in Salt Lake City completely robed in these veils and robes so you could not see her face.,see,25,1,see.v.01;see.v.07;see.v.19;see.v.20,see-30.1,Perception_(exp._subj.),WN,../../Linguistic data/ontonotes-release-5.0/data/files/data/english/annotations/bn/cnn/02/cnn_0251.sense,5,1,False
"Every time he sees me, he gets very nervous.""",see,3,6,see.v.09;see.v.11;see.v.12;see.v.15;see.v.16,see-30.1,Perception_(exp._subj.),WN,../../Linguistic data/ontonotes-release-5.0/data/files/data/english/annotations/nw/wsj/11/wsj_1146.sense,160,1,False
You can see it there just now.,see,2,1,see.v.01;see.v.07;see.v.19;see.v.20,see-30.1,Perception_(exp._subj.),WN,../../Linguistic data/ontonotes-release-5.0/data/files/data/english/annotations/bn/cnn/02/cnn_0270.sense,6,1,False
"See, through this footage, we see, ah, this --",see,7,1,see.v.01;see.v.07;see.v.19;see.v.20,see-30.1,Perception_(exp._subj.),WN,../../Linguistic data/ontonotes-release-5.0/data/files/data/english/annotations/bc/cctv/00/cctv_0005.sense,124,1,False
On the arrival at Allgate we saw dozens of casualties outside the front sitting down /.,see,6,1,see.v.01;see.v.07;see.v.19;see.v.20,see-30.1,Perception_(exp._subj.),WN,../../Linguistic data/ontonotes-release-5.0/data/files/data/english/annotations/bc/cnn/00/cnn_0000.sense,494,1,False
"Chia Chen - i, senior executive vice president of the Individual Banking Sector at Bank Sinopac ( which earlier this year created a stir in the industry by introducing the world 's first five - in - one money management account ) has been observing the evolution of the financial environment in Taiwan for many years, and offers the following thoughts about trends in money management.",observe,45,1,observe.v.03;observe.v.04;observe.v.07;observe.v.08,sight-30.2,Perception_(exp._subj.),WN,../../Linguistic data/ontonotes-release-5.0/data/files/data/english/annotations/mz/sinorama/10/ectb_1028.sense,45,1,False
""" After a while, ya got ta wonder if these are really miscounts, or maybe they 're just hoping nobody will notice.",notice,23,1,notice.v.01;notice.v.02;notice.v.04,see-30.1,Perception_(exp._subj.),WN,../../Linguistic data/ontonotes-release-5.0/data/files/data/english/annotations/wb/sel/11/sel_1180.sense,0,1,False
Today you can still see three - legged toads at jade markets and night markets.,see,4,1,see.v.01;see.v.07;see.v.19;see.v.20,see-30.1,Perception_(exp._subj.),WN,../../Linguistic data/ontonotes-release-5.0/data/files/data/english/annotations/mz/sinorama/10/ectb_1057.sense,46,1,False
"Seen here armed with a machine gun, supporting the Serb cause in Kosovo.",see,0,1,see.v.01;see.v.07;see.v.19;see.v.20,see-30.1,Perception_(exp._subj.),WN,../../Linguistic data/ontonotes-release-5.0/data/files/data/english/annotations/bn/nbc/00/nbc_0005.sense,10,1,False
Has anyone seen a singer or an actress with such shamelessness?..,see,2,1,see.v.01;see.v.07;see.v.19;see.v.20,see-30.1,Perception_(exp._subj.),WN,../../Linguistic data/ontonotes-release-5.0/data/files/data/english/annotations/wb/a2e/00/a2e_0025.sense,164,1,False
Lavuras asked the scholars bluntly where they had seen hundred - pacers.,see,8,1,see.v.01;see.v.07;see.v.19;see.v.20,see-30.1,Perception_(exp._subj.),WN,../../Linguistic data/ontonotes-release-5.0/data/files/data/english/annotations/mz/sinorama/10/ectb_1066.sense,80,1,False
"In order to give persons with disabilities a chance to view the exhibit without having to fight the crowds, the museum will provide free admission just for these special guests every Wednesday at 09:00.",view,10,2,view.v.03,sight-30.2,Perception_(exp._subj.),VN,../../Linguistic data/ontonotes-release-5.0/data/files/data/english/annotations/mz/sinorama/10/ectb_1047.sense,72,1,False
"Previous efforts have included musical ads, featuring simple tone - generating chips that play a tune, but the voice synthesizer in this effort is much more sophisticated, with none of the robotic flatness that one hears, for example, when calling telephone directory services.",hear,38,2,hear.v.01,see-30.1,Perception_(exp._subj.),WN,../../Linguistic data/ontonotes-release-5.0/data/files/data/english/annotations/nw/wsj/24/wsj_2440.sense,4,1,False
"Just as they disappear over the ridge, you can hear the planes and the explosions and then you see the cloud.",hear,10,2,hear.v.01,see-30.1,Perception_(exp._subj.),WN,../../Linguistic data/ontonotes-release-5.0/data/files/data/english/annotations/bn/cnn/02/cnn_0258.sense,5,1,False
And um as you can see my face has been plastered on every internet outlet every news outlet /.,see,5,1,see.v.01;see.v.07;see.v.19;see.v.20,see-30.1,Perception_(exp._subj.),WN,../../Linguistic data/ontonotes-release-5.0/data/files/data/english/annotations/bc/msnbc/00/msnbc_0002.sense,297,1,False
"Now 87 years of age, Chang Ming - sui says: "" Many years later I saw what he had written in his diary back then.",see,17,1,see.v.01;see.v.07;see.v.19;see.v.20,see-30.1,Perception_(exp._subj.),WN,../../Linguistic data/ontonotes-release-5.0/data/files/data/english/annotations/mz/sinorama/10/ectb_1063.sense,32,1,False
He was all alone no mom no dad no help until finally he was spotted by a paramedic on her way to work /.,spot,14,1,spot.v.01,sight-30.2,Perception_(exp._subj.),VN,../../Linguistic data/ontonotes-release-5.0/data/files/data/english/annotations/bc/cnn/00/cnn_0002.sense,223,1,False
14 fathers have not seen their babies.,see,4,6,see.v.09;see.v.11;see.v.12;see.v.15;see.v.16,see-30.1,Perception_(exp._subj.),WN,../../Linguistic data/ontonotes-release-5.0/data/files/data/english/annotations/bn/cnn/03/cnn_0314.sense,14,1,False
"If the show 's creators could just let themselves be quiet for a little, they might just hear it.",hear,18,2,hear.v.01,see-30.1,Perception_(exp._subj.),WN,../../Linguistic data/ontonotes-release-5.0/data/files/data/english/annotations/nw/wsj/13/wsj_1397.sense,61,1,False
During the testimony y- y- you heard that the maximum number was about twenty thousand /.,hear,6,1,hear.v.02;hear.v.04;hear.v.05,see-30.1,Perception_(exp._subj.),WN,../../Linguistic data/ontonotes-release-5.0/data/files/data/english/annotations/bc/cnn/00/cnn_0005.sense,99,1,False
It could detect objects smaller than a honey bee.,detect,2,1,detect.v.01,see-30.1,Perception_(exp._subj.),WN,../../Linguistic data/ontonotes-release-5.0/data/files/data/english/annotations/bn/cnn/03/cnn_0314.sense,6,1,False
Most of the shooters like you see in this video of Dylan Clebold and Eric Harris from Columbine High School had a fascination with firearms or violent video games /.,see,6,1,see.v.01;see.v.07;see.v.19;see.v.20,see-30.1,Perception_(exp._subj.),WN,../../Linguistic data/ontonotes-release-5.0/data/files/data/english/annotations/bc/cnn/00/cnn_0002.sense,98,1,False
""" If you eat somewhere like the Agora Garden Conference Center, you 'll hear people all around you saying things like, ' Have you been abroad recently? ' or ' I 've just come back from overseas, ' "" says Yang Ting - yuan, the former general manager of Winbond Electronic 's semiconductor subsidiary.",hear,14,2,hear.v.01,see-30.1,Perception_(exp._subj.),WN,../../Linguistic data/ontonotes-release-5.0/data/files/data/english/annotations/mz/sinorama/10/ectb_1036.sense,83,1,False
