sentence,verb_lemma,verb_token_idx,on_sense,wn_synsets,vn_class,situation,match_path,source_file,sentence_idx,situation_count,needs_review
"I worked downward, working toward the shoes, moving toward the pant legs, lifting the pant legs, and then taking off the shoes and pulling out the cushions inside the shoes.",lift,15,1,lift.v.01;lift.v.02;lift.v.03;lift.v.08;lift.v.10;lift.v.12;lift.v.19,put_direction-9.4,Pick_Up_and_Drop_Off,WN,../../Linguistic data/ontonotes-release-5.0/data/files/data/english/annotations/bc/p2.5_c2e/00/p2.5_c2e_0039.sense,35,2,True
"We had F aircraft drop laser - guided bombs, Fs drop Joint Direct Attack Munitions or J - DAM weapons into eastern Afghanistan today.",drop,4,1,drop.v.01;drop.v.02;drop.v.09;drop.v.15,put_direction-9.4,Pick_Up_and_Drop_Off,VN,../../Linguistic data/ontonotes-release-5.0/data/files/data/english/annotations/bn/cnn/03/cnn_0362.sense,3,3,True
"In August 1945, the US dropped atomic bombs on Hiroshima and Nagasaki in succession.",drop,6,1,drop.v.01;drop.v.02;drop.v.09;drop.v.15,put_direction-9.4,Pick_Up_and_Drop_Off,VN,../../Linguistic data/ontonotes-release-5.0/data/files/data/english/annotations/bc/cctv/00/cctv_0003.sense,322,3,True
"We have dropped ordnance today, and I 'm sure we 'll continue to drop ordnance, and do it with precision, do it with accuracy, and do it on call when needed first time every time.",drop,14,1,drop.v.01;drop.v.02;drop.v.09;drop.v.15,put_direction-9.4,Pick_Up_and_Drop_Off,VN,../../Linguistic data/ontonotes-release-5.0/data/files/data/english/annotations/bn/cnn/03/cnn_0362.sense,17,3,True
And these pictures show Iraqis running for cover just before U.S. planes dropped a bomb near northern Iraq.,drop,12,1,drop.v.01;drop.v.02;drop.v.09;drop.v.15,put_direction-9.4,Pick_Up_and_Drop_Off,VN,../../Linguistic data/ontonotes-release-5.0/data/files/data/english/annotations/bn/cnn/02/cnn_0258.sense,4,3,True
He drops it on the couch next to me.,drop,1,1,drop.v.01;drop.v.02;drop.v.09;drop.v.15,put_direction-9.4,Pick_Up_and_Drop_Off,VN,../../Linguistic data/ontonotes-release-5.0/data/files/data/english/annotations/wb/eng/00/eng_0009.sense,121,3,True
"In three days of unrest Army helicopters have dropped teargas in poor suburbs of the capital Harare, but many of those protesting say they wo n't stop until Mugabe, the man they blame for the country 's economic problems, surrenders the presidency.",drop,8,1,drop.v.01;drop.v.02;drop.v.09;drop.v.15,put_direction-9.4,Pick_Up_and_Drop_Off,VN,../../Linguistic data/ontonotes-release-5.0/data/files/data/english/annotations/bn/pri/00/pri_0030.sense,4,3,True
He says there are two main reasons for raising the Kursk.,raise,8,2,raise.v.02;raise.v.08;raise.v.20;raise.v.24,put_direction-9.4,Pick_Up_and_Drop_Off,WN,../../Linguistic data/ontonotes-release-5.0/data/files/data/english/annotations/bn/pri/01/pri_0106.sense,5,3,True
"""at least we have the decency to drop bombs from airplanes,"" he declared.",drop,8,1,drop.v.01;drop.v.02;drop.v.09;drop.v.15,put_direction-9.4,Pick_Up_and_Drop_Off,VN,../../Linguistic data/ontonotes-release-5.0/data/files/data/english/annotations/wb/eng/00/eng_0010.sense,128,3,True
""" People over 50 or under 16 can easily hurt themselves lifting heavy weights, so I tell people not to be foolhardy, "" she says.",lift,11,1,lift.v.01;lift.v.02;lift.v.03;lift.v.08;lift.v.10;lift.v.12;lift.v.19,put_direction-9.4,Pick_Up_and_Drop_Off,WN,../../Linguistic data/ontonotes-release-5.0/data/files/data/english/annotations/mz/sinorama/10/ectb_1055.sense,91,2,True
"He then hung a rope out a third - floor window and lowered himself to safety, injuring his hands slightly in the process.",lower,12,1,lower.v.01,put_direction-9.4,Pick_Up_and_Drop_Off,WN,../../Linguistic data/ontonotes-release-5.0/data/files/data/english/annotations/mz/sinorama/10/ectb_1011.sense,16,2,True
At times it sounded like furniture was being actually picked up and dropped /.,drop,12,1,drop.v.01;drop.v.02;drop.v.09;drop.v.15,put_direction-9.4,Pick_Up_and_Drop_Off,VN,../../Linguistic data/ontonotes-release-5.0/data/files/data/english/annotations/bc/msnbc/00/msnbc_0000.sense,481,3,True
A father in New York is accused of dropping his baby out of a seven - story apartment window.,drop,8,1,drop.v.01;drop.v.02;drop.v.09;drop.v.15,put_direction-9.4,Pick_Up_and_Drop_Off,VN,../../Linguistic data/ontonotes-release-5.0/data/files/data/english/annotations/bn/cnn/02/cnn_0241.sense,0,3,True
"suffice to say that all the local Rotarians and VFW heroes so desperate as to have voluntarily rocketed down to their local strip mall before dawn backed away from me hard, then stared at me like i had suddenly dropped my pants and started, er, ' amusing myself ' in a public place.",drop,40,1,drop.v.01;drop.v.02;drop.v.09;drop.v.15,put_direction-9.4,Pick_Up_and_Drop_Off,VN,../../Linguistic data/ontonotes-release-5.0/data/files/data/english/annotations/wb/eng/00/eng_0017.sense,5,3,True
The fighter jets dropped their ordnance in a coordinated atack on a convoy near the Afghan city of Choft.,drop,3,1,drop.v.01;drop.v.02;drop.v.09;drop.v.15,put_direction-9.4,Pick_Up_and_Drop_Off,VN,../../Linguistic data/ontonotes-release-5.0/data/files/data/english/annotations/bn/cnn/03/cnn_0362.sense,8,3,True
"There are any number of complications, one of which is that as part of the submarine is stuck in sand and clay on the seabed, so that 's going to give resistance once they do try to lift it.",lift,39,1,lift.v.01;lift.v.02;lift.v.03;lift.v.08;lift.v.10;lift.v.12;lift.v.19,put_direction-9.4,Pick_Up_and_Drop_Off,WN,../../Linguistic data/ontonotes-release-5.0/data/files/data/english/annotations/bn/pri/01/pri_0106.sense,18,2,True
"The second is a huge platform with very large cranes on it, perhaps a platform of the type more usually used for oil and gas exploration, and a third vessel involved is what the rescuers describe as a giant offshore barge and the plan is to lift the submarine off the seabed, attach it to the underneath of this barge and then take it to the Russian naval port of Mamansk.",lift,48,1,lift.v.01;lift.v.02;lift.v.03;lift.v.08;lift.v.10;lift.v.12;lift.v.19,put_direction-9.4,Pick_Up_and_Drop_Off,WN,../../Linguistic data/ontonotes-release-5.0/data/files/data/english/annotations/bn/pri/01/pri_0106.sense,27,2,True
"A plan was announced today to raise the Russian nuclear submarine ` Kursk ', next summer, almost a year after it hit the bottom of the Barents Sea following a mysterious accident.",raise,6,2,raise.v.02;raise.v.08;raise.v.20;raise.v.24,put_direction-9.4,Pick_Up_and_Drop_Off,WN,../../Linguistic data/ontonotes-release-5.0/data/files/data/english/annotations/bn/pri/01/pri_0106.sense,2,3,True
"If indeed the man overboard is located, well the hoister is dropped down with usually a torso harness.",drop,12,1,drop.v.01;drop.v.02;drop.v.09;drop.v.15,put_direction-9.4,Pick_Up_and_Drop_Off,VN,../../Linguistic data/ontonotes-release-5.0/data/files/data/english/annotations/bn/cnn/03/cnn_0360.sense,23,3,True
"We have dropped ordnance today, and I 'm sure we 'll continue to drop ordnance, and do it with precision, do it with accuracy, and do it on call when needed first time every time.",drop,2,1,drop.v.01;drop.v.02;drop.v.09;drop.v.15,put_direction-9.4,Pick_Up_and_Drop_Off,VN,../../Linguistic data/ontonotes-release-5.0/data/files/data/english/annotations/bn/cnn/03/cnn_0362.sense,17,3,True
"In the cold and wind whipped waters of the Barents Sea, divers are trying to raise the bodies of 118 sailors from the wrecked Kursk.",raise,16,2,raise.v.02;raise.v.08;raise.v.20;raise.v.24,put_direction-9.4,Pick_Up_and_Drop_Off,WN,../../Linguistic data/ontonotes-release-5.0/data/files/data/english/annotations/bn/pri/00/pri_0038.sense,0,3,True
"We had F aircraft drop laser - guided bombs, Fs drop Joint Direct Attack Munitions or J - DAM weapons into eastern Afghanistan today.",drop,11,1,drop.v.01;drop.v.02;drop.v.09;drop.v.15,put_direction-9.4,Pick_Up_and_Drop_Off,VN,../../Linguistic data/ontonotes-release-5.0/data/files/data/english/annotations/bn/cnn/03/cnn_0362.sense,3,3,True
"There are still more than 100 bodies which have n't been recovered, so at least raising the vessel and being able to return the bodies of the dead sailors to their loved ones might go some small way towards redressing their grief.",raise,16,2,raise.v.02;raise.v.08;raise.v.20;raise.v.24,put_direction-9.4,Pick_Up_and_Drop_Off,WN,../../Linguistic data/ontonotes-release-5.0/data/files/data/english/annotations/bn/pri/01/pri_0106.sense,38,3,True
We had heard a few months ago about some theories on how the submarine could be raised.,raise,16,2,raise.v.02;raise.v.08;raise.v.20;raise.v.24,put_direction-9.4,Pick_Up_and_Drop_Off,WN,../../Linguistic data/ontonotes-release-5.0/data/files/data/english/annotations/bn/pri/01/pri_0106.sense,21,3,True
"Tugs push the Cole into position over the deck and the Marlin rises to lift the 8,000 - ton warship out of the water.",lift,14,1,lift.v.01;lift.v.02;lift.v.03;lift.v.08;lift.v.10;lift.v.12;lift.v.19,put_direction-9.4,Pick_Up_and_Drop_Off,WN,../../Linguistic data/ontonotes-release-5.0/data/files/data/english/annotations/bn/mnb/00/mnb_0006.sense,6,2,True
"And I still do... dropping my anchor one day and raising it another. Facing clear, calm days... and facing storms and hurricanes.",raise,11,2,raise.v.02;raise.v.08;raise.v.20;raise.v.24,put_direction-9.4,Pick_Up_and_Drop_Off,WN,../../Linguistic data/ontonotes-release-5.0/data/files/data/english/annotations/wb/p2.5_a2e/00/p2.5_a2e_0001.sense,18,3,True
"Also on the way, equipment to lift the ""Cole"" out of the water and specialists to help retrieve the bodies of those trapped and presumed dead.",lift,7,1,lift.v.01;lift.v.02;lift.v.03;lift.v.08;lift.v.10;lift.v.12;lift.v.19,put_direction-9.4,Pick_Up_and_Drop_Off,WN,../../Linguistic data/ontonotes-release-5.0/data/files/data/english/annotations/bn/nbc/00/nbc_0010.sense,7,2,True
"A B bomber dropped four 2,000 - pound bombs on a building in a residential area of Baghdad after getting intelligence reports senior officials were meeting there, possibly including Saddam Hussein and his sons.",drop,3,1,drop.v.01;drop.v.02;drop.v.09;drop.v.15,put_direction-9.4,Pick_Up_and_Drop_Off,VN,../../Linguistic data/ontonotes-release-5.0/data/files/data/english/annotations/bn/cnn/02/cnn_0277.sense,7,3,True
"Today, FBI agents and divers were collecting evidence near the place they believe the boat was lowered into the water just before the attack on the ""USS Cole"" which killed 17 sailors and two suicide bombers.",lower,17,1,lower.v.01,put_direction-9.4,Pick_Up_and_Drop_Off,WN,../../Linguistic data/ontonotes-release-5.0/data/files/data/english/annotations/bn/abc/00/abc_0020.sense,11,2,True
"At the level of the other factions, supporters of six factions demonstrated, raising the Palestinian flag only, calling for Fatah and Hamas to abide by the truce agreement, to end the security chaos syndrome, and return to the negotiations table in order to activate the talks to form a national unity government.",raise,14,2,raise.v.02;raise.v.08;raise.v.20;raise.v.24,put_direction-9.4,Pick_Up_and_Drop_Off,WN,../../Linguistic data/ontonotes-release-5.0/data/files/data/english/annotations/bn/p2.5_a2e/00/p2.5_a2e_0037.sense,9,3,True
The person who lifted the cover off his face kissed him ( may God have mercy on him ).,lift,3,1,lift.v.01;lift.v.02;lift.v.03;lift.v.08;lift.v.10;lift.v.12;lift.v.19,put_direction-9.4,Pick_Up_and_Drop_Off,WN,../../Linguistic data/ontonotes-release-5.0/data/files/data/english/annotations/wb/a2e/00/a2e_0014.sense,3,2,True
He picked up the keys.,pick,,,,,Pick_Up_and_Drop_Off,,"Croft et al 2021, p. 79f",,,
He dropped the books.,drop,,,,,Pick_Up_and_Drop_Off,,"Croft et al 2021, p. 79f",,,
He dropped the books on the ground.,drop,,,,,Pick_Up_and_Drop_Off,,"Croft et al 2021, p. 79f",,,
He picked the keys from the table.,pick,,,,,Pick_Up_and_Drop_Off,,"Croft et al 2021, p. 79f",,,
She lifted the heavy box off the floor.,lift,,,,,Pick_Up_and_Drop_Off,,"Croft et al 2021, p. 79f",,,
The crane lowered the steel beam.,lower,,,,,Pick_Up_and_Drop_Off,,"Croft et al 2021, p. 79f",,,
The rescuers raised the sunken submarine.,raise,,,,,Pick_Up_and_Drop_Off,,"Croft et al 2021, p. 79f",,,
The nurse lowered the supplies.,lower,2,,,,Pick_Up_and_Drop_Off,synthetic,,,,False
The driver lowered the cargo.,lower,2,,,,Pick_Up_and_Drop_Off,synthetic,,,,False
The children lowered the firewood.,lower,2,,,,Pick_Up_and_Drop_Off,synthetic,,,,False
My neighbor lowered her daughter.,lower,2,,,,Pick_Up_and_Drop_Off,synthetic,,,,False
The nurse picked her daughter.,pick,2,,,,Pick_Up_and_Drop_Off,synthetic,,,,False
She dropped the coins into the jar.,drop,1,,,,Pick_Up_and_Drop_Off,synthetic,,,,False
He lifted the crate onto the truck.,lift,1,,,,Pick_Up_and_Drop_Off,synthetic,,,,False
She picked up the groceries on her way home.,pick,1,,,,Pick_Up_and_Drop_Off,synthetic,,,,False
He lowered the bucket into the well.,lower,1,,,,Pick_Up_and_Drop_Off,synthetic,,,,False
She raised the flag at sunrise.,raise,1,,,,Pick_Up_and_Drop_Off,synthetic,,,,False
He dropped the anchor in the harbor.,drop,1,,,,Pick_Up_and_Drop_Off,synthetic,,,,False
She lifted the child onto her shoulders.,lift,1,,,,Pick_Up_and_Drop_Off,synthetic,,,,False
